,number,value,datetime_start,datetime_complete,duration,params_alpha,params_booster,params_colsample_bytree,params_gamma,params_grow_policy,params_lambda,params_learning_rate,params_max_depth,params_min_child_weight,params_subsample,state
925,925,0.2723898040338512,2023-06-21 21:12:40.700671,2023-06-21 21:12:44.364728,0 days 00:00:03.664057,9.115758191699221e-06,gbtree,0.9086506442109418,7.708275008226771e-08,lossguide,0.0008019684831892532,0.048725268702095766,3,4,0.5599405251574854,COMPLETE
926,926,0.2604026404561136,2023-06-21 21:12:44.365688,2023-06-21 21:12:55.348396,0 days 00:00:10.982708,1.9693668375453164e-05,gbtree,0.7867658524089569,1.1029007303464582e-07,lossguide,0.00017047476695160552,0.010702125328850011,3,8,0.6038963175098956,COMPLETE
927,927,0.25945419736730096,2023-06-21 21:12:55.349417,2023-06-21 21:12:59.260971,0 days 00:00:03.911554,0.005019613229598676,gbtree,0.9243782743399601,1.6996694838052296e-07,lossguide,0.7068493472162755,0.05630284605617208,3,4,0.4488734698868632,COMPLETE
928,928,0.4542859098296684,2023-06-21 21:12:59.261929,2023-06-21 21:13:23.255626,0 days 00:00:23.993697,3.8905692969122956e-05,gbtree,0.9138348985687006,7.584883054675299e-08,lossguide,0.00046031468182951643,0.0003030187965568319,3,4,0.4879625436766067,COMPLETE
929,929,0.2584147217106054,2023-06-21 21:13:23.256680,2023-06-21 21:13:27.280707,0 days 00:00:04.024027,1.1932162735513847e-05,gbtree,0.9773783268686479,4.1774511139335293e-08,lossguide,0.0030507847751209374,0.044081336284393216,3,4,0.45884727402861075,COMPLETE
930,930,0.26431552620486637,2023-06-21 21:13:27.281682,2023-06-21 21:13:48.574904,0 days 00:00:21.293222,0.2157369676227555,gbtree,0.851958253681979,5.4502949683607835e-08,lossguide,0.002304377416638755,0.0033794321433234468,3,4,0.4381664719017627,COMPLETE
931,931,0.26988429902458666,2023-06-21 21:13:48.576941,2023-06-21 21:14:11.057981,0 days 00:00:22.481040,2.260270343888777e-05,gbtree,0.7974447934991555,0.004819752030603028,lossguide,0.00026268194735239566,0.0025405061237872557,3,4,0.5106964854386592,COMPLETE
932,932,0.25438173158475236,2023-06-21 21:14:11.058988,2023-06-21 21:14:15.361313,0 days 00:00:04.302325,1.4054800716823392e-05,gbtree,0.9728187908321274,3.031822547834894e-05,lossguide,0.3372613401363297,0.03852344352952168,3,4,0.4207435038364101,COMPLETE
933,933,0.25719940115746015,2023-06-21 21:14:15.362302,2023-06-21 21:14:19.563449,0 days 00:00:04.201147,9.264278597516269e-06,gbtree,0.994970395443109,1.3606519460565101e-05,lossguide,0.3809961469902687,0.03968053641728426,3,4,0.41277641694957967,COMPLETE
934,934,0.5338641290346025,2023-06-21 21:14:19.564402,2023-06-21 21:14:43.191629,0 days 00:00:23.627227,1.297535972655519e-05,gbtree,0.9761652056313278,3.342224645564993e-05,lossguide,0.0003811162628364559,0.0001607125170894887,3,4,0.42374595649966484,COMPLETE
935,935,0.2663567719228231,2023-06-21 21:14:43.192651,2023-06-21 21:14:48.290325,0 days 00:00:05.097674,2.368680901619329e-05,gbtree,0.9906338202012454,9.217984629099353e-08,lossguide,0.4852418568030449,0.03757560114694107,3,4,0.813492397943251,COMPLETE
936,936,0.261031202568938,2023-06-21 21:14:48.291314,2023-06-21 21:14:51.272370,0 days 00:00:02.981056,1.2863647671366578e-05,gbtree,0.9590986989107948,1.696721400772142e-08,lossguide,0.370850385226343,0.045946006594874876,3,4,0.40306571961467935,COMPLETE
937,937,0.25579617467276106,2023-06-21 21:14:51.273321,2023-06-21 21:14:56.617382,0 days 00:00:05.344061,5.885490924588209e-06,gbtree,0.976875850183389,1.769859727753604e-08,lossguide,0.2760404605789038,0.03143284719537204,3,4,0.4728699297349727,COMPLETE
938,938,0.2618532781245469,2023-06-21 21:14:56.618343,2023-06-21 21:15:16.337183,0 days 00:00:19.718840,0.0033126504628045316,gbtree,0.9358607742121818,3.274447501692562e-08,lossguide,0.6853907667949138,0.004482605042403338,3,4,0.46078663743440024,COMPLETE
939,939,0.43712513362596034,2023-06-21 21:15:16.338681,2023-06-21 21:15:41.069681,0 days 00:00:24.731000,7.907943786469348e-06,gbtree,0.948813613819688,2.4843894553147055e-05,lossguide,0.0008638602683401459,0.0003457595936142712,3,4,0.4806950019262817,COMPLETE
940,940,0.27359270213545117,2023-06-21 21:15:41.070664,2023-06-21 21:15:46.543927,0 days 00:00:05.473263,1.4693641392922271e-08,gbtree,0.9748398623502649,2.954404588304563e-08,lossguide,0.5806027904431829,0.03916114508776943,4,4,0.8647616408884553,COMPLETE
941,941,0.49132034640652433,2023-06-21 21:15:46.544897,2023-06-21 21:16:09.946905,0 days 00:00:23.402008,1.4687717598709052e-05,gbtree,0.9461408157305297,1.6066021282815694e-07,lossguide,0.996605472111273,0.00024187919070540738,3,4,0.44288818549707065,COMPLETE
942,942,0.27250854331086577,2023-06-21 21:16:09.947880,2023-06-21 21:16:20.967513,0 days 00:00:11.019633,2.4339152946867253e-05,gbtree,0.9569301459602357,1.071486350623492e-07,lossguide,0.0014424431903571984,0.013586103869947441,3,4,0.9889353346881973,COMPLETE
943,943,0.2614015807891757,2023-06-21 21:16:20.968400,2023-06-21 21:16:26.449194,0 days 00:00:05.480794,4.90190230044755e-07,gbtree,0.9677293072064115,1.3579801762982495e-07,lossguide,0.45722714392963804,0.03313464087396457,3,5,0.5472986297250176,COMPLETE
944,944,0.2582468467993122,2023-06-21 21:16:26.450164,2023-06-21 21:16:30.349628,0 days 00:00:03.899464,3.8986419268841585e-06,gbtree,0.9801353411505759,3.5451586784957e-08,lossguide,0.3073337162675693,0.049328406146020166,3,4,0.49400736433559606,COMPLETE
945,945,0.2529905881343804,2023-06-21 21:16:30.350771,2023-06-21 21:16:34.375012,0 days 00:00:04.024241,3.794847330326736e-05,gbtree,0.992338655128294,5.936929135466122e-05,lossguide,0.007953954718789034,0.04276739996529136,3,4,0.4566034459907825,COMPLETE
946,946,0.25427416653871143,2023-06-21 21:16:34.376800,2023-06-21 21:16:39.108711,0 days 00:00:04.731911,3.8425380520999725e-05,gbtree,0.9975004273624929,6.360937866558155e-05,lossguide,0.0030901248223464597,0.03747622639174531,3,4,0.4218822529673599,COMPLETE
947,947,0.25659247938698215,2023-06-21 21:16:39.109671,2023-06-21 21:16:43.974397,0 days 00:00:04.864726,4.8601468715512e-05,gbtree,0.9989760649812583,8.118371996616722e-05,lossguide,0.004871087821645194,0.03703493757508507,3,4,0.41421362073918483,COMPLETE
948,948,0.26553132686606584,2023-06-21 21:16:43.976193,2023-06-21 21:16:48.439625,0 days 00:00:04.463432,5.0748993767363094e-05,gbtree,0.9865259456095418,4.7589573527416525e-05,lossguide,0.010854784884845502,0.041903218977892114,3,4,0.5997446300220807,COMPLETE
949,949,0.254902797543111,2023-06-21 21:16:48.440706,2023-06-21 21:16:53.383679,0 days 00:00:04.942973,6.472010766881896e-05,gbtree,0.9866150113485457,6.228502375082149e-05,lossguide,0.0027633743703383722,0.032472668661793797,3,4,0.42112338852584036,COMPLETE
950,950,0.2618063592103835,2023-06-21 21:16:53.384649,2023-06-21 21:16:57.737937,0 days 00:00:04.353288,4.259256767026542e-05,gbtree,0.9886456683988417,5.869639212888066e-05,lossguide,0.006091596694263504,0.042157264011092696,3,4,0.5941484394672468,COMPLETE
951,951,0.25664006951298995,2023-06-21 21:16:57.738937,2023-06-21 21:17:00.537885,0 days 00:00:02.798948,8.147347428854871e-05,gbtree,0.9961797475657437,8.469321076951055e-05,lossguide,0.022226162498441438,0.05638622885994648,3,4,0.40983204149213315,COMPLETE
952,952,0.2660952996942835,2023-06-21 21:17:00.538855,2023-06-21 21:17:15.806676,0 days 00:00:15.267821,3.0507867480780407e-05,gbtree,0.965232772275842,2.6467331239998655e-05,lossguide,0.014111639550928262,0.006798685305640717,3,4,0.6948990646396191,COMPLETE
953,953,0.5639448703025233,2023-06-21 21:17:15.807557,2023-06-21 21:17:43.070535,0 days 00:00:27.262978,3.575612381311721e-05,gbtree,0.9726736513390031,4.008709349919125e-05,lossguide,0.005476070142353885,0.0001181442038673188,4,4,0.4010214109799525,COMPLETE
954,954,0.25320311985806326,2023-06-21 21:17:43.071524,2023-06-21 21:17:47.783016,0 days 00:00:04.711492,1.1945002864401225e-07,gbtree,0.9833558203486004,5.564632184639171e-05,lossguide,0.002615631020352931,0.03611318031364769,3,4,0.42744230844268777,COMPLETE
955,955,0.25567428919780194,2023-06-21 21:17:47.784015,2023-06-21 21:17:52.882325,0 days 00:00:05.098310,1.1499580171514047e-07,gbtree,0.9632479639581164,5.613783071779063e-05,lossguide,0.004351002892780155,0.027928831927511975,3,4,0.43180976150180894,COMPLETE
956,956,0.26917715340899256,2023-06-21 21:17:52.883302,2023-06-21 21:18:15.078493,0 days 00:00:22.195191,1.6494585941749864e-07,gbtree,0.996036151752879,6.663964673872408e-05,lossguide,0.003706213231477109,0.0027272565963997906,3,4,0.4506378831332701,COMPLETE
957,957,0.26867536916457396,2023-06-21 21:18:15.080711,2023-06-21 21:18:20.767856,0 days 00:00:05.687145,7.710021467628404e-08,gbtree,0.8875615758443057,0.00011013275616571615,lossguide,0.0026330917010987127,0.033327394593553994,3,4,0.9136512146586334,COMPLETE
958,958,0.26755931187133153,2023-06-21 21:18:20.768835,2023-06-21 21:18:34.802029,0 days 00:00:14.033194,0.000107581175397184,gbtree,0.9806061370355186,0.00010711968686948605,lossguide,0.0023848621458487777,0.008520388146527969,3,5,0.8022000420680557,COMPLETE
959,959,0.29414431805148555,2023-06-21 21:18:34.802917,2023-06-21 21:18:58.434662,0 days 00:00:23.631745,6.295762440290631e-08,gbtree,0.9850461576426573,4.32422123538342e-05,lossguide,0.011722019778303915,0.0014947054202716491,3,4,0.4597261630938427,COMPLETE
960,960,0.2590035635333088,2023-06-21 21:18:58.436986,2023-06-21 21:19:01.324536,0 days 00:00:02.887550,1.043668255703195e-07,gbtree,0.9967545206944497,7.076174537645288e-05,lossguide,0.003197749635002996,0.05208855927328979,3,4,0.44308435173251054,COMPLETE
961,961,0.5669440438459145,2023-06-21 21:19:01.325498,2023-06-21 21:19:25.939417,0 days 00:00:24.613919,4.54884903173274e-08,gbtree,0.9969356513099278,5.074863947641154e-05,lossguide,0.00159410629347564,0.00011168472296207386,3,4,0.6239565457223759,COMPLETE
962,962,0.26833316374980537,2023-06-21 21:19:25.940427,2023-06-21 21:19:30.691633,0 days 00:00:04.751206,1.8427581457506418e-07,gbtree,0.9667709589639241,0.00010566708037189367,lossguide,0.01749431036063651,0.044366587195419645,3,4,0.5693409035208001,COMPLETE
963,963,0.25659378169155217,2023-06-21 21:19:30.692607,2023-06-21 21:19:33.269722,0 days 00:00:02.577115,1.8282250964669884e-08,gbtree,0.9977109347879523,3.5733102564146864e-05,lossguide,0.0012717987559056699,0.06138883960221312,3,4,0.4667952575780819,COMPLETE
964,964,0.30183270007967516,2023-06-21 21:19:33.270723,2023-06-21 21:19:56.472643,0 days 00:00:23.201920,6.91534483275158e-05,gbtree,0.9395204913669108,8.77695748782118e-05,lossguide,0.00820133793029879,0.0013358751287080464,3,4,0.45198201704182156,COMPLETE
965,965,0.2741871955277346,2023-06-21 21:19:56.473669,2023-06-21 21:20:05.594268,0 days 00:00:09.120599,3.788410118830186e-08,gbtree,0.98519881187778,0.00012994895578358627,lossguide,0.0030868118252183577,0.01937120184753051,3,4,0.943034243589493,COMPLETE
966,966,0.25958239353117635,2023-06-21 21:20:05.596256,2023-06-21 21:20:13.694089,0 days 00:00:08.097833,2.4541253663030926e-07,gbtree,0.9234774867116677,1.8673222533647372e-05,lossguide,0.006959874042369359,0.014886693586520214,4,4,0.5384669211074473,COMPLETE
967,967,0.2566904819638305,2023-06-21 21:20:13.694970,2023-06-21 21:20:18.707392,0 days 00:00:05.012422,1.420418905872764e-07,gbtree,0.9692221065300282,0.06680759571460732,lossguide,0.00698196844326612,0.037526820810869804,3,5,0.5260938438402596,COMPLETE
968,968,0.2630300152243977,2023-06-21 21:20:18.708388,2023-06-21 21:20:22.466818,0 days 00:00:03.758430,0.00013301022749689283,gbtree,0.9042321111638851,0.0009482069548611545,lossguide,0.0011195222143763868,0.05516827200436055,3,4,0.6423194649528243,COMPLETE
969,969,0.315402974327437,2023-06-21 21:20:22.467835,2023-06-21 21:20:46.016155,0 days 00:00:23.548320,7.916931480847945e-08,gbtree,0.9500327795934762,4.249140992182837e-05,lossguide,0.0015805766075317757,0.0011055889766157056,3,4,0.428753088470148,COMPLETE
970,970,0.2669591689228352,2023-06-21 21:20:46.017281,2023-06-21 21:20:50.001946,0 days 00:00:03.984665,3.263258622644741e-07,gbtree,0.8945260645135842,0.00013915184314166408,lossguide,0.005130341253575817,0.045992476138688315,4,4,0.7150277921248138,COMPLETE
971,971,0.2645043651641349,2023-06-21 21:20:50.002908,2023-06-21 21:20:52.625934,0 days 00:00:02.623026,4.066134959355402e-05,gbtree,0.9819619977596107,0.0002067497455566805,lossguide,0.002613974119078917,0.06149546442430233,3,4,0.4720574168128702,COMPLETE
972,972,0.2589808892502215,2023-06-21 21:20:52.626887,2023-06-21 21:20:55.507126,0 days 00:00:02.880239,7.784212309293121e-05,gbtree,0.9858839473972913,2.2285433010976333e-05,lossguide,0.001850530196554357,0.05170113794604519,3,4,0.44387660980229593,COMPLETE
973,973,0.25202636871114187,2023-06-21 21:20:55.508090,2023-06-21 21:21:01.140628,0 days 00:00:05.632538,0.6395509729048093,gbtree,0.9623327133185338,0.0004116533671083459,lossguide,0.0032032109668727105,0.02945079631138272,3,4,0.459547281101394,COMPLETE
974,974,0.45738980005251967,2023-06-21 21:21:01.141602,2023-06-21 21:21:27.443255,0 days 00:00:26.301653,0.6702873208293957,gbtree,0.9535325509192584,0.00017036463772787658,lossguide,0.0034277541449836495,0.00030391759580237424,3,4,0.9791801024774657,COMPLETE
975,975,0.2533131255751761,2023-06-21 21:21:27.444154,2023-06-21 21:21:33.310922,0 days 00:00:05.866768,0.83750399579721,gbtree,0.9730064396001973,3.144009028757808e-05,lossguide,0.0037757354610073587,0.030796280894405823,3,4,0.46087988353913084,COMPLETE
976,976,0.27051467247129474,2023-06-21 21:21:33.311885,2023-06-21 21:21:39.401095,0 days 00:00:06.089210,0.3360372360980297,gbtree,0.9822521623708923,0.001058162123759223,lossguide,0.0020328202848680825,0.031081216321311944,3,5,0.8953677641817432,COMPLETE
977,977,0.25304314385557786,2023-06-21 21:21:39.402072,2023-06-21 21:21:45.156339,0 days 00:00:05.754267,0.9057688696622543,gbtree,0.969985954420216,5.9885949541300263e-05,lossguide,0.004495178456959113,0.03008843364249876,3,4,0.45937305534866546,COMPLETE
978,978,0.5597025069185775,2023-06-21 21:21:45.157329,2023-06-21 21:22:08.872601,0 days 00:00:23.715272,0.7032471339477753,gbtree,0.9528274279952506,0.0006251194232503141,lossguide,0.006529216716518727,0.00012797527801446841,3,4,0.4593951818442445,COMPLETE
979,979,0.2709227445546936,2023-06-21 21:22:08.873533,2023-06-21 21:22:18.314823,0 days 00:00:09.441290,0.978676179147273,gbtree,0.9674765383138959,0.0004664070451926751,depthwise,0.003256334763558065,0.021466058316753633,3,4,0.8888193514078294,COMPLETE
980,980,0.5079573576825478,2023-06-21 21:22:18.315719,2023-06-21 21:22:42.056190,0 days 00:00:23.740471,0.9899127671479964,gbtree,0.9667161068761375,0.0016963508833778083,lossguide,0.003612732031571456,0.00020436589504886277,3,4,0.47990560775916175,COMPLETE
981,981,0.2547536579001204,2023-06-21 21:22:42.057223,2023-06-21 21:22:48.480768,0 days 00:00:06.423545,0.4664810132535717,gbtree,0.9451092601152197,2.6062911632453936e-05,depthwise,0.008766683732975806,0.025384319522150648,3,4,0.4675141463452253,COMPLETE
982,982,0.5369844532201834,2023-06-21 21:22:48.481652,2023-06-21 21:23:14.070403,0 days 00:00:25.588751,0.5749040230029083,gbtree,0.9632096786734093,3.8298876816520396e-05,lossguide,0.005110574697635747,0.00015226707652404818,3,4,0.7800365914202857,COMPLETE
983,983,0.2608274098199803,2023-06-21 21:23:14.071410,2023-06-21 21:23:20.670335,0 days 00:00:06.598925,0.76564745714211,gbtree,0.971942118951563,7.926004881521445e-05,depthwise,0.007786097276767517,0.027153357202525777,3,4,0.6112431707706595,COMPLETE
984,984,0.2666834772216686,2023-06-21 21:23:20.671306,2023-06-21 21:23:26.844600,0 days 00:00:06.173294,0.47181788891286613,gbtree,0.9569289390856505,3.3238737644971725e-05,lossguide,0.009698371423899378,0.029986241714856476,3,4,0.7716713856810961,COMPLETE
985,985,0.4201616984716519,2023-06-21 21:23:26.845664,2023-06-21 21:23:53.007450,0 days 00:00:26.161786,0.611434668871611,gbtree,0.9718967017909477,5.2003237444519264e-05,depthwise,0.0020043285030280993,0.0003992646398808393,3,4,0.8760231448200076,COMPLETE
986,986,0.25424839751293327,2023-06-21 21:23:53.008351,2023-06-21 21:23:58.576042,0 days 00:00:05.567691,0.35611554168706283,gbtree,0.9545998673974342,0.0003336536606423049,lossguide,0.006224273231249957,0.028491665294134348,3,4,0.4604480299282722,COMPLETE
987,987,0.26539871597379255,2023-06-21 21:23:58.577041,2023-06-21 21:24:04.062221,0 days 00:00:05.485180,0.6567566516872254,gbtree,0.9254189202618924,1.7475275769927894e-05,depthwise,0.004088312312291337,0.036541698491625425,3,4,0.5813732717155526,COMPLETE
988,988,0.25595286275552537,2023-06-21 21:24:04.064621,2023-06-21 21:24:10.624143,0 days 00:00:06.559522,0.9950434846047916,gbtree,0.975389811500704,0.0011140150895863924,lossguide,0.003820035960587376,0.02299755346370159,5,5,0.4722458638823832,COMPLETE
989,989,0.2585224535000504,2023-06-21 21:24:10.626266,2023-06-21 21:24:15.995788,0 days 00:00:05.369522,0.5010259667615131,gbtree,0.7712476458003628,0.00024594967426849247,depthwise,0.001640723498087744,0.03077540258149122,3,4,0.45164388753524953,COMPLETE
990,990,0.25635301827334817,2023-06-21 21:24:15.996777,2023-06-21 21:24:21.284653,0 days 00:00:05.287876,0.6858565769292144,gbtree,0.9333329948327804,3.149173323587751e-05,lossguide,0.0010608861035370008,0.033515536153763945,3,4,0.48433017146768625,COMPLETE
991,991,0.270209838642127,2023-06-21 21:24:21.285624,2023-06-21 21:24:30.125643,0 days 00:00:08.840019,0.31659854253474307,gbtree,0.9599333948969505,0.00036422411805579356,depthwise,0.0006642101859658748,0.016641226439703134,4,7,0.7017494734115685,COMPLETE
992,992,0.2616767641954483,2023-06-21 21:24:30.126535,2023-06-21 21:24:47.937056,0 days 00:00:17.810521,0.7651816091848329,gbtree,0.9426736901760815,0.0007917191396823221,lossguide,0.0024203561574066778,0.005877173830582918,3,4,0.5016219871136608,COMPLETE
993,993,0.541901911703873,2023-06-21 21:24:47.938077,2023-06-21 21:25:10.873070,0 days 00:00:22.934993,0.9909120548609058,gbtree,0.7567776627111767,0.00018318960450212308,depthwise,0.004258949994403377,0.0001602646739223691,3,4,0.4591836519119961,COMPLETE
994,994,0.3501324424292281,2023-06-21 21:25:10.874104,2023-06-21 21:25:32.739213,0 days 00:00:21.865109,0.4561522833414867,gbtree,0.5281644047826993,0.0004467706390538521,lossguide,0.02053964180503345,0.000800176165773871,3,4,0.4756190915877865,COMPLETE
995,995,0.2787262328637506,2023-06-21 21:25:32.740209,2023-06-21 21:25:55.384615,0 days 00:00:22.644406,0.6723314888391533,gbtree,0.9997045149057657,5.783807326468076e-05,depthwise,0.0023879414161309042,0.002148321294686738,3,4,0.448287229875292,COMPLETE
996,996,0.25917029718411905,2023-06-21 21:25:55.385753,2023-06-21 21:26:01.169098,0 days 00:00:05.783345,3.094030348864078e-08,gbtree,0.9714829169017606,0.018926893318339938,lossguide,0.01105967332648669,0.02591328996896799,3,4,0.4655068700491625,COMPLETE
997,997,0.2665104406280143,2023-06-21 21:26:01.170931,2023-06-21 21:26:08.075279,0 days 00:00:06.904348,0.04589473144701828,gbtree,0.7491327986609109,1.954251117652971e-05,depthwise,0.005361895738542151,0.019612898546471427,4,4,0.5133532232740653,COMPLETE
998,998,0.2591110041451848,2023-06-21 21:26:08.076256,2023-06-21 21:26:18.184879,0 days 00:00:10.108623,0.22562215773638425,gbtree,0.980281892077689,0.002631066029472396,lossguide,0.004774823884312627,0.010709104827968574,3,4,0.4415519656886548,COMPLETE
999,999,0.2563497475594723,2023-06-21 21:26:18.185803,2023-06-21 21:26:22.962693,0 days 00:00:04.776890,0.43769167395037833,gbtree,0.9410350672792847,0.0021619538859415214,depthwise,0.0006160155756535705,0.04269537122970305,3,4,0.4838835338309632,COMPLETE
