,number,value,datetime_start,datetime_complete,duration,params_bagging_temperature,params_boosting_type,params_colsample_bylevel,params_depth,params_grow_policy,params_l2_leaf_reg,params_learning_rate,params_max_leaves,params_min_data_in_leaf,params_random_strength,params_subsample,state
262,262,0.2811587781749279,2023-06-13 12:20:19.058251,2023-06-13 12:20:27.652111,0 days 00:00:08.593860,7.267530794589996,,0.7242220642684201,6,Depthwise,59.65538282954963,0.036238268186490986,,76,64.33699723026876,0.6478404503329229,COMPLETE
263,263,0.30744322748741115,2023-06-13 12:20:27.652852,2023-06-13 12:20:33.778007,0 days 00:00:06.125155,4.575709126914974,,0.6972506721769292,6,Depthwise,0.3026447264092871,0.036095355767438046,,74,64.83753648516104,0.6496642794806436,COMPLETE
264,264,0.28603150823791906,2023-06-13 12:20:33.778720,2023-06-13 12:20:38.327728,0 days 00:00:04.549008,9.407520303932342,,0.722875379057972,7,Depthwise,25.672800067444044,0.07164146513775983,,75,64.12580052567377,0.6152701419561105,COMPLETE
265,265,0.2801191474059491,2023-06-13 12:20:38.328529,2023-06-13 12:20:47.349644,0 days 00:00:09.021115,11.938025760398201,,0.7238074623456523,7,Depthwise,56.99277032452418,0.03558950532882675,,81,58.157543295020574,0.6855817665210512,COMPLETE
266,266,0.2856465681820142,2023-06-13 12:20:47.350438,2023-06-13 12:20:56.117811,0 days 00:00:08.767373,12.453593966217444,,0.7074922345847886,7,Depthwise,61.512574373501394,0.036564369755931456,,81,66.68552270925504,0.6638278774807053,COMPLETE
267,267,0.2832898381521153,2023-06-13 12:20:56.118525,2023-06-13 12:21:05.669075,0 days 00:00:09.550550,11.823424918398558,,0.7517928594912405,7,Depthwise,58.49042945289247,0.030204175231985327,,84,58.5163057391106,0.6752124777345517,COMPLETE
268,268,0.3186624002363833,2023-06-13 12:21:05.669867,2023-06-13 12:21:10.892826,0 days 00:00:05.222959,9.838413330145938,,0.6930444462638501,7,Depthwise,0.008077255982118574,0.0420539721382583,,81,62.43039110447138,0.6789441928066638,COMPLETE
269,269,0.327935880317403,2023-06-13 12:21:10.893610,2023-06-13 12:22:03.096855,0 days 00:00:52.203245,15.195778217800282,Plain,0.7216920625806331,7,SymmetricTree,17.031278316114157,0.03521841665464279,,78,64.27330786074987,0.6485736587319493,COMPLETE
270,270,0.2852373951650907,2023-06-13 12:22:03.097588,2023-06-13 12:22:09.822271,0 days 00:00:06.724683,13.128214478560293,,0.7119867403260645,7,Depthwise,59.53710872951689,0.044503366592776906,,79,66.39496907178865,0.5830662242000606,COMPLETE
271,271,0.2868694301824412,2023-06-13 12:22:09.823017,2023-06-13 12:22:17.034809,0 days 00:00:07.211792,7.5904257129484645,,0.756260019585831,7,Depthwise,41.95126294955241,0.03935794482411295,,82,61.819256353702976,0.5988857659006545,COMPLETE
272,272,0.27981821237977444,2023-06-13 12:22:17.035528,2023-06-13 12:22:25.625436,0 days 00:00:08.589908,10.757401432210383,,0.7271463655131485,7,Depthwise,61.12772152668093,0.033776208836989584,,84,59.36021569074103,0.614570375859034,COMPLETE
273,273,0.2837742661311366,2023-06-13 12:22:25.626150,2023-06-13 12:22:32.804690,0 days 00:00:07.178540,5.240549629069969,,0.7425117691260607,7,Depthwise,19.581602048545772,0.03403705389058555,,84,58.523221466970135,0.6888859413538553,COMPLETE
274,274,0.28437647099277197,2023-06-13 12:22:32.805417,2023-06-13 12:22:40.917860,0 days 00:00:08.112443,1.926084352890346,,0.6940289329807089,7,Depthwise,30.24844684047443,0.030234292331999018,,77,53.15038425116292,0.6200652878835489,COMPLETE
275,275,0.2905508345064532,2023-06-13 12:22:40.918689,2023-06-13 12:22:48.461257,0 days 00:00:07.542568,9.268196102986623,,0.7267468348376274,7,Depthwise,46.14181674640929,0.036625533370474146,,81,59.674507346789845,0.639160410096511,COMPLETE
276,276,0.28513685564897795,2023-06-13 12:22:48.462071,2023-06-13 12:22:55.439883,0 days 00:00:06.977812,15.24978623509502,,0.7274807448278393,7,Depthwise,61.863954731597254,0.04611012717371196,,85,61.105677024927026,0.6528390116300411,COMPLETE
277,277,0.3150599239903419,2023-06-13 12:22:55.440734,2023-06-13 12:23:01.933812,0 days 00:00:06.493078,3.977468691370084,,0.7668598751549387,6,Depthwise,0.02809124203720698,0.03236137709734215,,82,62.94069495435209,0.6905470786856465,COMPLETE
278,278,0.2817448198470759,2023-06-13 12:23:01.934630,2023-06-13 12:23:08.390625,0 days 00:00:06.455995,7.032579026256048,,0.7054487589171845,7,Depthwise,99.877227513807,0.05942398825867582,,77,57.614145438323476,0.6174902145449918,COMPLETE
279,279,0.2877459111329974,2023-06-13 12:23:08.391468,2023-06-13 12:23:14.291056,0 days 00:00:05.899588,11.135438432562061,,0.7428174431191725,7,Depthwise,28.402804110460426,0.04554839353815887,,80,66.82260529130076,0.5859371318352239,COMPLETE
280,280,0.28531253791434646,2023-06-13 12:23:14.291874,2023-06-13 12:23:20.832913,0 days 00:00:06.541039,13.252820003695415,,0.7260376507820853,7,Depthwise,42.29893383097994,0.04017437575668242,,83,59.78283474421842,0.6049865603051476,COMPLETE
281,281,0.2858519180528754,2023-06-13 12:23:20.833705,2023-06-13 12:23:26.994714,0 days 00:00:06.161009,2.9790696111913837,,0.6965199308394475,6,Depthwise,60.53431864965192,0.052200196897325996,,75,64.98308038329267,0.6327805993107343,COMPLETE
282,282,0.28157542262708984,2023-06-13 12:23:26.995516,2023-06-13 12:23:35.800805,0 days 00:00:08.805289,8.669001996615659,,0.7516025109576839,7,Depthwise,67.62457622188096,0.03505887388860856,,79,62.00338489765795,0.6189514170451039,COMPLETE
283,283,0.2866159621138953,2023-06-13 12:23:35.801626,2023-06-13 12:23:40.217235,0 days 00:00:04.415609,11.191420585459099,,0.7356622656667274,6,Depthwise,20.56418472794028,0.07252718586944909,,77,58.37555642099479,0.6460167988556734,COMPLETE
284,284,0.2988905297582186,2023-06-13 12:23:40.218079,2023-06-13 12:23:47.050450,0 days 00:00:06.832371,15.52816453590177,,0.7134633589626027,7,Depthwise,0.2292572652405404,0.029411729405878172,,86,66.79407490713113,0.6650378516336506,COMPLETE
285,285,0.2828519596117802,2023-06-13 12:23:47.051210,2023-06-13 12:23:53.751553,0 days 00:00:06.700343,7.310274907904788,,0.7773188408366514,7,Depthwise,42.161546436172785,0.04437538916291952,,83,63.64714712292723,0.5943473607841141,COMPLETE
286,286,0.2811992132535595,2023-06-13 12:23:53.752378,2023-06-13 12:24:02.822304,0 days 00:00:09.069926,13.519213461755712,,0.758832609741329,7,Depthwise,99.72462625593614,0.03957987589472616,,80,50.60681466136384,0.5777315343415939,COMPLETE
287,287,0.321619507556884,2023-06-13 12:24:02.823129,2023-06-13 12:24:07.251663,0 days 00:00:04.428534,12.334911332573725,,0.7599790726384152,7,Depthwise,0.000299405454435998,0.05022450652919591,,81,56.72201171713813,0.5824828473953179,COMPLETE
288,288,0.28240454334873566,2023-06-13 12:24:07.252476,2023-06-13 12:24:14.871303,0 days 00:00:07.618827,5.133374907595985,,0.7893977446355642,6,Depthwise,27.30686988276468,0.03332402252765974,,84,50.94800044048428,0.6311735753759211,COMPLETE
289,289,0.2787573159329592,2023-06-13 12:24:14.872109,2023-06-13 12:24:22.826648,0 days 00:00:07.954539,13.618550502843934,,0.7587978632740735,7,Depthwise,64.32991841242635,0.03878726304518902,,75,54.19473912479981,0.575885935150568,COMPLETE
290,290,0.5339081981955819,2023-06-13 12:24:22.827471,2023-06-13 12:24:27.702950,0 days 00:00:04.875479,14.00122417830172,Plain,0.7882137583598856,6,SymmetricTree,0.001754791745435556,0.0359783810578496,,72,50.22074059681902,0.5812707273562567,COMPLETE
291,291,0.28621793796647077,2023-06-13 12:24:27.703782,2023-06-13 12:24:34.977796,0 days 00:00:07.274014,13.987044382817912,,0.7557250527150398,7,Depthwise,16.584203209649257,0.03988224600378155,,75,53.89608296805053,0.7073305076210467,COMPLETE
292,292,0.28319978035605275,2023-06-13 12:24:34.978583,2023-06-13 12:24:40.957873,0 days 00:00:05.979290,15.50754173564335,,0.7675579792600791,7,Depthwise,43.920013082561276,0.05670529776392096,,70,55.183430650833685,0.57786281868217,COMPLETE
293,293,0.27988078704605107,2023-06-13 12:24:40.958711,2023-06-13 12:24:50.159151,0 days 00:00:09.200440,0.9575351032518711,,0.7437774177609495,6,Depthwise,63.65580706823711,0.030340093410333623,,73,51.451563819817906,0.5938815267326198,COMPLETE
294,294,0.28406566065971034,2023-06-13 12:24:50.159983,2023-06-13 12:24:59.141200,0 days 00:00:08.981217,0.20708127148501543,,0.7514387141241946,6,Depthwise,59.95334122030905,0.029522239507373732,,73,48.30891833087996,0.5748357154735486,COMPLETE
295,295,0.2840480029903516,2023-06-13 12:24:59.142175,2023-06-13 12:25:06.409930,0 days 00:00:07.267755,1.8452317548868744,,0.746782781653686,6,Depthwise,29.36201631710318,0.03624205521204544,,69,48.18368530214135,0.5925966009983653,COMPLETE
296,296,0.2828208106835107,2023-06-13 12:25:06.410756,2023-06-13 12:25:14.576129,0 days 00:00:08.165373,2.4167396996411314,,0.7927309854137963,6,Depthwise,42.33054283348831,0.030742854708775816,,78,55.05918773850357,0.6092877855956391,COMPLETE
297,297,0.2817913269648259,2023-06-13 12:25:14.576977,2023-06-13 12:25:22.248601,0 days 00:00:07.671624,4.488741077899186,,0.7667669377037146,6,Depthwise,61.682635546955794,0.03936116045410128,,74,52.903888360943036,0.5936540811452093,COMPLETE
298,298,0.28584043145385396,2023-06-13 12:25:22.249425,2023-06-13 12:25:29.726368,0 days 00:00:07.476943,12.056202398690251,,0.7387208521174906,6,Depthwise,27.712811493021473,0.033795506600228634,,86,52.85227920461526,0.6579087325502024,COMPLETE
299,299,0.31221357670018823,2023-06-13 12:25:29.727167,2023-06-13 12:25:34.570279,0 days 00:00:04.843112,13.577081536646343,,0.6942488101914458,6,Depthwise,0.005831882820168611,0.04292450856681194,,77,57.438398532702664,0.5754997177538176,COMPLETE
300,300,0.30825687144022446,2023-06-13 12:25:34.571104,2023-06-13 12:25:40.075406,0 days 00:00:05.504302,16.106166395208064,,0.7609552099913043,6,Depthwise,0.0011053257923142083,0.038317506184076186,,81,68.84245481462764,0.6048550675455694,COMPLETE
301,301,0.28690265449021535,2023-06-13 12:25:40.076259,2023-06-13 12:25:46.319785,0 days 00:00:06.243526,6.603393611386801,,0.7401067717701731,6,Depthwise,18.265739468226062,0.04308881668192021,,72,59.632003071840906,0.6420440934915017,COMPLETE
302,302,0.28532211557438186,2023-06-13 12:25:46.320631,2023-06-13 12:25:55.049896,0 days 00:00:08.729265,0.13521494388080724,,0.7205222429498271,7,Depthwise,62.16973286262591,0.03223126224587561,,75,52.02485487024577,0.5921828613518718,COMPLETE
303,303,0.2813935549469107,2023-06-13 12:25:55.050717,2023-06-13 12:26:04.615990,0 days 00:00:09.565273,10.740803487691895,,0.8048859042130787,7,Depthwise,39.5019479915182,0.02911074629691838,,83,67.06153376000452,0.6701553052334784,COMPLETE
304,304,0.28216822058507185,2023-06-13 12:26:04.616805,2023-06-13 12:26:12.995762,0 days 00:00:08.378957,2.6384335034172035,,0.7080408987650487,7,Depthwise,62.82403136354882,0.036256290530347575,,79,63.11601938812517,0.6170756936622258,COMPLETE
305,305,0.28435835777242746,2023-06-13 12:26:12.996481,2023-06-13 12:26:17.736881,0 days 00:00:04.740400,5.382202973366153,,0.7724522240371898,6,Depthwise,16.13343359893238,0.05283428180350892,,81,15.477203575510032,0.5742728231061547,COMPLETE
306,306,0.279035903521873,2023-06-13 12:26:17.737698,2023-06-13 12:26:20.570242,0 days 00:00:02.832544,16.9311451036707,,0.7420171460040188,7,Depthwise,38.901775063390794,0.2220087561110433,,77,65.65092876328495,0.63322149146522,COMPLETE
307,307,0.2894821822678024,2023-06-13 12:26:20.571091,2023-06-13 12:26:25.506876,0 days 00:00:04.935785,14.756945339646778,,0.7510263810947827,6,Depthwise,28.327354134018965,0.06536190551587903,,76,67.43253888193972,0.6495655915942117,COMPLETE
308,308,0.4129277101732202,2023-06-13 12:26:25.507702,2023-06-13 12:26:27.907202,0 days 00:00:02.399500,18.188892544701943,,0.7399797448630817,7,Depthwise,0.0001638208417589061,0.2382792632435859,,84,66.00707212959269,0.636889149592291,COMPLETE
309,309,0.369598762291511,2023-06-13 12:26:27.908013,2023-06-13 12:26:31.860176,0 days 00:00:03.952163,16.990093818347134,,0.7627314155292664,7,Depthwise,5.7082204024506376e-05,0.06930525284932477,,74,60.264456194042744,0.6604224308035889,COMPLETE
310,310,0.289210761061972,2023-06-13 12:26:31.860962,2023-06-13 12:26:35.095206,0 days 00:00:03.234244,12.914416557374258,,0.7308921506557533,7,Depthwise,41.00569522131901,0.15910771308198393,,87,57.050347924729145,0.7538030947376719,COMPLETE
311,311,0.3122310383120356,2023-06-13 12:26:35.096005,2023-06-13 12:26:38.628020,0 days 00:00:03.532015,3.2529206703896394,,0.75142832326949,6,Depthwise,0.7020837489734376,0.08224525469110129,,80,65.24775457437931,0.6301719649157402,COMPLETE
312,312,0.3348736629387575,2023-06-13 12:26:38.628807,2023-06-13 12:27:30.165918,0 days 00:00:51.537111,7.662318804776679,Ordered,0.7244381410415353,7,SymmetricTree,16.955246456870206,0.2041258985548385,,77,62.15851445419165,0.6031189498503818,COMPLETE
313,313,0.28845476232774975,2023-06-13 12:27:30.166762,2023-06-13 12:27:34.149733,0 days 00:00:03.982971,11.631885419125714,,0.7753993233933726,7,Depthwise,27.452849852926217,0.09872273750207304,,79,68.52831706839216,0.6153611047705251,COMPLETE
314,314,0.286289454658823,2023-06-13 12:27:34.150460,2023-06-13 12:27:39.569765,0 days 00:00:05.419305,16.229792174984702,,0.6937510055300832,6,Depthwise,60.27949121540305,0.05875143879983772,,82,58.97723220581424,0.6253934901950524,COMPLETE
315,315,0.27761209164622785,2023-06-13 12:27:39.570585,2023-06-13 12:27:52.204662,0 days 00:00:12.634077,13.815810335820625,,0.7421153803121844,7,Depthwise,43.77603610952247,0.02153171792815415,,72,54.14690156879316,0.6432318604322366,COMPLETE
316,316,0.2878119503609952,2023-06-13 12:27:52.205491,2023-06-13 12:27:56.315536,0 days 00:00:04.110045,9.61485549171456,,0.7388972373414718,6,Depthwise,41.92793186383601,0.09837393493355366,,70,54.48406788840217,0.6433153708266142,COMPLETE
317,317,0.3947188286145398,2023-06-13 12:27:56.316382,2023-06-13 12:27:59.112480,0 days 00:00:02.796098,4.928189225199734,,0.7041780471147985,7,Depthwise,1.3477107146733607e-05,0.14476121988045926,,71,61.29284496785025,0.656320184327275,COMPLETE
318,318,0.28522571842113925,2023-06-13 12:27:59.113256,2023-06-13 12:28:10.927015,0 days 00:00:11.813759,1.6069747076326064,,0.7217537998992478,7,Depthwise,24.892372025926846,0.0209215080573055,,73,57.251393418948425,0.6339172816746114,COMPLETE
319,319,0.34219464953590994,2023-06-13 12:28:10.927874,2023-06-13 12:28:17.539259,0 days 00:00:06.611385,6.414264775473511,,0.7345374311657394,7,Depthwise,0.0004766666513014061,0.030134651482283677,,75,64.28427577622993,0.6456510817989073,COMPLETE
320,320,0.28815831993507207,2023-06-13 12:28:17.539988,2023-06-13 12:28:26.070561,0 days 00:00:08.530573,11.035210606413429,,0.7470572495508138,6,Depthwise,8.061327402558954,0.028416914631443996,,72,65.96233478745738,0.6769418163193817,COMPLETE
321,321,0.3020530958545427,2023-06-13 12:28:26.071405,2023-06-13 12:28:32.448228,0 days 00:00:06.376823,15.051378260128986,,0.7096255714960514,7,Depthwise,0.08355885433446615,0.03306504966333701,,77,55.36618370773013,0.6242382342839494,COMPLETE
322,322,0.28048665828474173,2023-06-13 12:28:32.449257,2023-06-13 12:28:36.737131,0 days 00:00:04.287874,17.941234406595463,,0.7220206223374099,7,Depthwise,38.14277450501051,0.07927754447675885,,85,59.96842429967396,0.609001561430774,COMPLETE
323,323,0.339516165972784,2023-06-13 12:28:36.737946,2023-06-13 12:28:39.650054,0 days 00:00:02.912108,16.887384188079928,,0.7391461711062055,7,Depthwise,0.008450467874026285,0.13045475694084196,,85,59.0262792672435,0.6046746604326381,COMPLETE
324,324,0.285665021757264,2023-06-13 12:28:39.650876,2023-06-13 12:28:44.634717,0 days 00:00:04.983841,12.683243133821609,,0.6956988253940427,7,Depthwise,18.028296250861022,0.05734177722708675,,83,60.54774046197678,0.5898387058856941,COMPLETE
325,325,0.30087944909813147,2023-06-13 12:28:44.635545,2023-06-13 12:28:48.389083,0 days 00:00:03.753538,23.94868862439126,,0.7186962984036395,7,Depthwise,1.3344824163346383,0.07628908658881577,,87,62.53298233074118,0.6127683819887764,COMPLETE
326,326,0.333348674885477,2023-06-13 12:28:48.389898,2023-06-13 12:28:52.337551,0 days 00:00:03.947653,15.492021438118016,,0.7581065601977252,7,Depthwise,0.00011237194167923663,0.06259278249804966,,82,58.52138960502688,0.5925034843875003,COMPLETE
327,327,0.3201792637687773,2023-06-13 12:28:52.338366,2023-06-13 12:28:56.724613,0 days 00:00:04.386247,93.36206142997423,,0.7338686081438311,7,Depthwise,0.0037288162703085254,0.04989748329396709,,86,55.57436412848249,0.6208515576885458,COMPLETE
328,328,0.3994588139183831,2023-06-13 12:28:56.725394,2023-06-13 12:28:59.132524,0 days 00:00:02.407130,17.649218068344553,,0.6905776826618656,7,Depthwise,0.01949664197451846,0.25474685590769225,,68,60.524744877750926,0.6054896073584727,COMPLETE
329,329,0.2848038020616482,2023-06-13 12:28:59.133296,2023-06-13 12:29:09.451579,0 days 00:00:10.318283,14.228651613693234,,0.7100085596878416,7,Depthwise,34.742374418020766,0.023036186395164665,,84,62.60285399354856,0.6367715709444467,COMPLETE
330,330,0.28256728525452257,2023-06-13 12:29:09.452398,2023-06-13 12:29:15.573019,0 days 00:00:06.120621,9.861517123192206,,0.7422062652173962,7,Depthwise,40.99329305309745,0.04845471760561117,,78,67.38800909882985,0.6216943513705062,COMPLETE
331,331,0.2932950646456416,2023-06-13 12:29:15.573849,2023-06-13 12:29:19.872701,0 days 00:00:04.298852,11.77173958841803,,0.8477979570668865,7,Depthwise,14.982198711393066,0.08170011713181666,,81,56.6407203390005,0.5952955327663654,COMPLETE
332,332,0.3041244317316005,2023-06-13 12:29:19.873550,2023-06-13 12:29:23.178686,0 days 00:00:03.305136,18.14492934999256,,0.7229838110325788,7,Depthwise,26.412487900969133,0.17141672444483658,,74,52.28200166793895,0.6947342019481297,COMPLETE
333,333,0.6056451389151787,2023-06-13 12:29:23.179556,2023-06-13 12:29:58.966844,0 days 00:00:35.787288,0.032589673782523754,Ordered,0.7040380755865631,7,SymmetricTree,0.03227873733532894,0.2580984323177464,,85,69.30740342686141,0.6644045041314559,COMPLETE
334,334,0.28632512502994373,2023-06-13 12:29:58.967666,2023-06-13 12:30:05.004351,0 days 00:00:06.036685,3.5778530139486224,,0.7483537031382319,7,Depthwise,61.69214610414853,0.19746227181746764,,31,58.23182466750955,0.6122016623362418,COMPLETE
335,335,0.3735408003178513,2023-06-13 12:30:05.005189,2023-06-13 12:30:07.556457,0 days 00:00:02.551268,8.078976347457214,,0.7747477493553405,7,Depthwise,8.02338592448092e-05,0.1816403074832903,,79,63.19158707645406,0.572009640895878,COMPLETE
336,336,0.41989293872816236,2023-06-13 12:30:07.557288,2023-06-13 12:30:10.651641,0 days 00:00:03.094353,13.225906053032023,,0.7277073977044684,7,Depthwise,3.5728601437764704e-05,0.12425795682016416,,83,65.79234467062966,0.894705459754876,COMPLETE
337,337,0.34452775806088554,2023-06-13 12:30:10.652453,2023-06-13 12:30:14.771078,0 days 00:00:04.118625,9.97199120642895,,0.6899897948709767,7,Depthwise,0.0005647398818128793,0.054647289742982226,,81,53.6849413841282,0.6339457762433399,COMPLETE
338,338,0.2916321083307959,2023-06-13 12:30:14.771878,2023-06-13 12:30:17.482817,0 days 00:00:02.710939,4.307846824885873,,0.7625243570058134,7,Depthwise,45.35514732596367,0.23659197713562205,,76,60.956150181133786,0.6021443158211783,COMPLETE
339,339,0.29275245046571396,2023-06-13 12:30:17.483545,2023-06-13 12:30:43.383788,0 days 00:00:25.900243,15.83562114047123,,0.7152480912676404,6,Depthwise,66.77971149357617,0.04562328961218524,,9,64.32228815901226,0.5916156551696428,COMPLETE
340,340,0.3566222792889306,2023-06-13 12:30:43.384653,2023-06-13 12:30:47.409407,0 days 00:00:04.024754,11.78606848922162,,0.7477301228435111,7,Depthwise,5.2057852457564664e-06,0.06502023561297914,,73,59.88372025667532,0.6170393864758198,COMPLETE
341,341,0.320708180391459,2023-06-13 12:30:47.410127,2023-06-13 12:30:50.937703,0 days 00:00:03.527576,2.233676525846574,,0.7332584696642876,7,Depthwise,0.1197279030664121,0.10123630608489284,,78,68.21177188789456,0.6519166647400043,COMPLETE
342,342,0.2962445011781759,2023-06-13 12:30:50.938424,2023-06-13 12:30:56.494095,0 days 00:00:05.555671,74.19322051325724,,0.7039255663029025,6,Depthwise,0.7660374543814993,0.04186261283142829,,71,56.79007155856462,0.6295977190604296,COMPLETE
343,343,0.2777923590905254,2023-06-13 12:30:56.494836,2023-06-13 12:31:00.210185,0 days 00:00:03.715349,8.287376929765799,,0.7214263059370767,7,Depthwise,99.49754806668992,0.1547819174010954,,80,61.613703347199525,0.5850674011090418,COMPLETE
344,344,0.3322524731749939,2023-06-13 12:31:00.211003,2023-06-13 12:31:03.134158,0 days 00:00:02.923155,5.9587888619993565,,0.7595835940744587,7,Depthwise,0.0391649979132064,0.14477850028700265,,80,61.43202295957296,0.5730253625270206,COMPLETE
345,345,0.2836562018076649,2023-06-13 12:31:03.134911,2023-06-13 12:31:12.116280,0 days 00:00:08.981369,8.19033933604148,,0.6331660936889776,7,Depthwise,96.76137458153217,0.03639937649548507,,83,58.40364753404921,0.5893089810730181,COMPLETE
346,346,0.3073869120450258,2023-06-13 12:31:12.117134,2023-06-13 12:31:14.578850,0 days 00:00:02.461716,6.400952795302646,,0.7230895444137284,7,Depthwise,29.055912785495988,0.2980959813151822,,87,62.10175934067658,0.6124283014244017,COMPLETE
347,347,0.2849597271194674,2023-06-13 12:31:14.579572,2023-06-13 12:31:22.624896,0 days 00:00:08.045324,8.91821900886381,,0.7406909508444797,7,Depthwise,37.48010413880807,0.03142024846566208,,81,55.49931406499981,0.5832513485981975,COMPLETE
348,348,0.28447214100506973,2023-06-13 12:31:22.625630,2023-06-13 12:31:30.320231,0 days 00:00:07.694601,4.123737043032608,,0.7309123418490006,7,Depthwise,65.13926449224566,0.04067519566498931,,79,60.123399803001284,0.6001237894459529,COMPLETE
349,349,0.3022883232175667,2023-06-13 12:31:30.320968,2023-06-13 12:31:33.249191,0 days 00:00:02.928223,13.680837941412417,,0.7499923930104302,7,Depthwise,16.004907010150674,0.1810829558153854,,77,47.735950142317584,0.6287891680138827,COMPLETE
