,number,value,datetime_start,datetime_complete,duration,params_alpha,params_booster,params_colsample_bytree,params_gamma,params_grow_policy,params_lambda,params_learning_rate,params_max_depth,params_min_child_weight,params_subsample,state
168,168,0.25637811272612687,2023-06-21 19:22:09.861894,2023-06-21 19:22:14.335638,0 days 00:00:04.473744,0.003640634739563812,gbtree,0.6139317568594206,6.593894280436087e-07,lossguide,0.09231050964126929,0.038857679315356164,3,4,0.41146538622354173,COMPLETE
169,169,0.2565190863559683,2023-06-21 19:22:14.336417,2023-06-21 19:22:18.184652,0 days 00:00:03.848235,0.0007835372754892858,gbtree,0.7029455770116518,9.16610230235658e-08,lossguide,0.00038330340779917603,0.04837680355367753,3,3,0.4917880357360472,COMPLETE
170,170,0.2600065063847327,2023-06-21 19:22:18.185465,2023-06-21 19:22:23.815825,0 days 00:00:05.630360,0.0011720555877210391,gbtree,0.6038688673643877,1.289813542925713e-05,lossguide,0.1859527711344005,0.02786136117931535,4,5,0.47087517154773306,COMPLETE
171,171,0.25467511000282755,2023-06-21 19:22:23.816606,2023-06-21 19:22:28.944122,0 days 00:00:05.127516,0.0004540948763755278,gbtree,0.6476889880191063,2.027852945446746e-06,lossguide,0.05939153938938172,0.034463611037839285,9,4,0.4637732453431601,COMPLETE
172,172,0.2642444012133531,2023-06-21 19:22:28.944911,2023-06-21 19:22:32.107289,0 days 00:00:03.162378,0.00023482836430508737,gbtree,0.6681428487529971,1.866577579382835e-06,lossguide,0.05118396919480933,0.06091790342696228,8,4,0.44847142180244276,COMPLETE
173,173,0.25642489071027946,2023-06-21 19:22:32.108063,2023-06-21 19:22:36.819190,0 days 00:00:04.711127,0.0005414159514475165,gbtree,0.6279678924978397,1.095859296893337e-06,lossguide,0.017968098167587217,0.03662266673474824,3,4,0.43912285313594623,COMPLETE
174,174,0.27356631187399544,2023-06-21 19:22:36.819973,2023-06-21 19:22:40.786342,0 days 00:00:03.966369,0.0004437150823184275,gbtree,0.6457747329588894,2.3180374595280735e-06,lossguide,0.03136408546974753,0.04672792941788334,7,10,0.463761181508235,COMPLETE
175,175,0.2633375334825403,2023-06-21 19:22:40.787128,2023-06-21 19:22:46.104377,0 days 00:00:05.317249,0.00016242839498313645,gbtree,0.6784597221635396,5.553648138534424e-06,lossguide,0.011681353415688892,0.031239541325287203,3,4,0.509514376643024,COMPLETE
176,176,0.26104216593394275,2023-06-21 19:22:46.105154,2023-06-21 19:22:58.621782,0 days 00:00:12.516628,0.0003049400973030536,gbtree,0.6501292437367664,1.5355038714389197e-06,lossguide,0.0027644967563531064,0.008748533394822077,9,4,0.4772789939943535,COMPLETE
177,177,0.2621871815114482,2023-06-21 19:22:58.622575,2023-06-21 19:23:06.265654,0 days 00:00:07.643079,0.001513129334912933,gbtree,0.6257429883015991,8.763280994370926e-07,lossguide,0.05911595540145726,0.01792258237836156,3,5,0.6662462697694224,COMPLETE
178,178,0.2627317079908528,2023-06-21 19:23:06.266556,2023-06-21 19:23:12.805630,0 days 00:00:06.539074,0.0007701432078554947,gbtree,0.6366154420802266,3.526692894143813e-06,lossguide,0.13454723005518732,0.022664936256909553,3,4,0.586700206109037,COMPLETE
179,179,0.26123545325274994,2023-06-21 19:23:12.806457,2023-06-21 19:23:17.539089,0 days 00:00:04.732632,0.00042374629972329617,gbtree,0.5874099689659614,5.552475128878586e-07,lossguide,0.6152447898152199,0.04146406776347904,8,4,0.4545586967773884,COMPLETE
180,180,0.2666095949058556,2023-06-21 19:23:17.539865,2023-06-21 19:23:20.089775,0 days 00:00:02.549910,0.0022168332788836086,gbtree,0.6624824517000414,9.628864768912969e-06,depthwise,0.07499347828411149,0.06947057695564562,3,5,0.4873238879577421,COMPLETE
181,181,0.25527526789280264,2023-06-21 19:23:20.091363,2023-06-21 19:23:25.022841,0 days 00:00:04.931478,0.0005339814261178374,gbtree,0.6500229744538712,1.7627729364630991e-06,lossguide,0.07835077041127884,0.03393510540003692,3,4,0.4662610215815755,COMPLETE
182,182,0.2633885033685915,2023-06-21 19:23:25.024604,2023-06-21 19:23:39.596283,0 days 00:00:14.571679,0.000606601443287352,gbtree,0.6147784728439099,2.675202900517383e-06,lossguide,0.04203620294360831,0.007022253342984807,10,4,0.4692976455953595,COMPLETE
183,183,0.26305627862454345,2023-06-21 19:23:39.597081,2023-06-21 19:23:45.322329,0 days 00:00:05.725248,0.00025935580293390975,gbtree,0.6410573784243476,1.3432477555269517e-06,lossguide,0.11134496499212537,0.027685134659810835,9,4,0.43779100923562825,COMPLETE
184,184,0.25884992576881627,2023-06-21 19:23:45.323111,2023-06-21 19:23:49.849751,0 days 00:00:04.526640,0.0008961518044595997,gbtree,0.6576071815638939,3.297955150664643e-07,lossguide,0.2928448823468803,0.03473437398850746,3,4,0.45366519969395597,COMPLETE
185,185,0.2610194636856133,2023-06-21 19:23:49.850525,2023-06-21 19:23:53.734064,0 days 00:00:03.883539,0.00021018764787471947,gbtree,0.6866167032333771,9.82244532255421e-07,lossguide,0.7619541899968506,0.054455742632186756,6,3,0.49640364721616786,COMPLETE
186,186,0.26266156000812907,2023-06-21 19:23:53.734838,2023-06-21 19:23:57.559497,0 days 00:00:03.824659,0.00036726938320106266,gbtree,0.574255130321612,1.9599324601836173e-06,lossguide,0.02222423062196919,0.041650817627268924,3,4,0.4230459339940879,COMPLETE
187,187,0.2563913083999945,2023-06-21 19:23:57.560273,2023-06-21 19:24:02.717167,0 days 00:00:05.156894,0.0013175843139106224,gbtree,0.6315636551951007,7.004580475050484e-07,depthwise,0.0324599038321997,0.03361045053577196,3,4,0.4787227217479415,COMPLETE
188,188,0.25351790530112545,2023-06-21 19:24:02.717947,2023-06-21 19:24:05.504192,0 days 00:00:02.786245,0.0005502149940606334,gbtree,0.6030426380786654,4.274554599330523e-07,lossguide,0.07041685719172534,0.05844886322985565,3,4,0.46292985979790185,COMPLETE
189,189,0.2552210759027293,2023-06-21 19:24:05.505810,2023-06-21 19:24:08.284959,0 days 00:00:02.779149,0.0001291904307142392,gbtree,0.6030468099926699,4.373380941666435e-06,depthwise,0.07214466683406916,0.060227811095981985,3,4,0.44839086667421924,COMPLETE
190,190,0.26473106195075374,2023-06-21 19:24:08.285732,2023-06-21 19:24:11.060151,0 days 00:00:02.774419,0.00014051869708375578,gbtree,0.5980452758744442,4.896001986903311e-06,lossguide,0.08052377725697962,0.07594819609849744,3,4,0.4388965499594016,COMPLETE
191,191,0.25837661771318027,2023-06-21 19:24:11.060940,2023-06-21 19:24:14.635848,0 days 00:00:03.574908,0.0001082496082275803,gbtree,0.6129951591229778,3.571918615335029e-06,depthwise,0.055313704181298946,0.05780494709602385,3,4,0.44590763287370766,COMPLETE
192,192,0.2621516890038558,2023-06-21 19:24:14.636610,2023-06-21 19:24:34.436595,0 days 00:00:19.799985,0.0004855404149675185,gbtree,0.5835615301079059,2.584999097301554e-06,depthwise,0.1273387906214898,0.0037222310136513807,3,4,0.4672355615643707,COMPLETE
193,193,0.2588161867141201,2023-06-21 19:24:34.437410,2023-06-21 19:24:37.067409,0 days 00:00:02.629999,0.0002986802758821329,gbtree,0.6021132057141,7.04693612054029e-06,depthwise,0.17277487636997702,0.06351240176194016,3,4,0.4819142037759345,COMPLETE
194,194,0.26074554549457835,2023-06-21 19:24:37.068172,2023-06-21 19:24:41.587042,0 days 00:00:04.518870,6.49615914072782e-05,gbtree,0.5666169210873613,1.402283710770979e-05,depthwise,0.41861063652602815,0.04815968677293072,3,4,0.46163793171984074,COMPLETE
195,195,0.270183610650587,2023-06-21 19:24:41.587846,2023-06-21 19:24:45.090678,0 days 00:00:03.502832,0.00016073339239659328,gbtree,0.5398415307367789,1.5337734243798157e-06,depthwise,0.9766827214858056,0.05356874870566388,10,4,0.40078827994486754,COMPLETE
196,196,0.26118805005505147,2023-06-21 19:24:45.091470,2023-06-21 19:24:47.313183,0 days 00:00:02.221713,0.00021692408149946878,gbtree,0.6510477032817164,3.064433499392209e-05,depthwise,0.08759668283967131,0.07757512512535587,3,4,0.4296166602891594,COMPLETE
197,197,0.2618462214289214,2023-06-21 19:24:47.313957,2023-06-21 19:24:50.795526,0 days 00:00:03.481569,0.0004892748661030064,gbtree,0.6135263635345445,1.140007537793894e-06,lossguide,0.04572490588778776,0.06153809529023743,3,3,0.4496766622410066,COMPLETE
198,198,0.2627494330798445,2023-06-21 19:24:50.796301,2023-06-21 19:24:54.694959,0 days 00:00:03.898658,0.0010274652913789882,gbtree,0.5922201832579838,5.732822796699018e-07,lossguide,0.24393003530246873,0.045783645660937615,4,4,0.5579257069058197,COMPLETE
199,199,0.2555615114285139,2023-06-21 19:24:54.695856,2023-06-21 19:24:57.662054,0 days 00:00:02.966198,0.0006140939784362947,gbtree,0.6379738663585645,3.881520893221099e-06,depthwise,0.6437410250555248,0.06927248516505104,3,4,0.4658405893777498,COMPLETE
200,200,0.2664315574784119,2023-06-21 19:24:57.662858,2023-06-21 19:25:00.308295,0 days 00:00:02.645437,0.0006387980181265303,gbtree,0.67273780186605,4.340673515305008e-06,depthwise,0.5875265019976185,0.06925764009739009,3,4,0.770082759309075,COMPLETE
201,201,0.2896863876192154,2023-06-21 19:25:00.309077,2023-06-21 19:25:23.947435,0 days 00:00:23.638358,0.0003698452363990119,gbtree,0.6390777249227174,2.107561454293653e-06,depthwise,0.684985108884706,0.00160739117249545,3,4,0.7124937586860237,COMPLETE
202,202,0.25856243112713173,2023-06-21 19:25:23.948151,2023-06-21 19:25:26.232592,0 days 00:00:02.284441,0.0006901295625864178,gbtree,0.6273790090096283,3.3688700549653017e-06,depthwise,0.4549432401424118,0.08301323523686091,3,4,0.4682068594370733,COMPLETE
203,203,0.2556539268006634,2023-06-21 19:25:26.233430,2023-06-21 19:25:29.350860,0 days 00:00:03.117430,2.853397440153873e-05,gbtree,0.6462468484136021,7.115723206252629e-06,depthwise,0.31501980038654953,0.056934221516374346,3,4,0.4530834764027769,COMPLETE
204,204,0.2618501830455556,2023-06-21 19:25:29.351620,2023-06-21 19:25:38.109012,0 days 00:00:08.757392,0.0014286207460097674,gbtree,0.6073669221883305,1.6112797436242375e-06,depthwise,0.06360374178638951,0.013156995260195523,3,2,0.4717698015789043,COMPLETE
205,205,0.2553071164007844,2023-06-21 19:25:38.109806,2023-06-21 19:25:41.628836,0 days 00:00:03.519030,0.0003031928801406091,gbtree,0.6572504147977178,8.844859608623187e-07,depthwise,0.949424765425099,0.06645659409876446,3,4,0.4874144155133142,COMPLETE
206,206,0.2636205079491552,2023-06-21 19:25:41.629601,2023-06-21 19:25:44.195561,0 days 00:00:02.565960,0.00020340290418874313,gbtree,0.6611078323366668,8.538857373969569e-07,lossguide,0.9300084510873644,0.09273646609873712,3,4,0.4855626736515524,COMPLETE
207,207,0.26939327078199693,2023-06-21 19:25:44.196353,2023-06-21 19:25:47.117823,0 days 00:00:02.921470,0.0002905014911220597,gbtree,0.6364853363115315,5.291928326122111e-07,depthwise,0.5728642348327916,0.06910474220599644,3,4,0.8234651022074179,COMPLETE
208,208,0.25755904768703775,2023-06-21 19:25:47.118616,2023-06-21 19:25:51.322071,0 days 00:00:04.203455,2.631062457796383e-08,gbtree,0.653622353253428,2.0825551184356271e-07,lossguide,0.9616981661688427,0.05171046008253569,3,4,0.439068739053383,COMPLETE
209,209,0.25540301360736234,2023-06-21 19:25:51.322917,2023-06-21 19:25:54.748295,0 days 00:00:03.425378,0.00011269197846646669,gbtree,0.5520302587949005,2.320729568628763e-06,lossguide,0.4414921921838323,0.061716378235689075,3,3,0.4580329131930192,COMPLETE
210,210,0.2692194161615251,2023-06-21 19:25:54.749077,2023-06-21 19:25:57.687587,0 days 00:00:02.938510,9.506263275328459e-05,gbtree,0.5434196987531107,2.1164301963539493e-05,lossguide,0.39746488082103487,0.05997945638566296,3,2,0.45446282970474905,COMPLETE
211,211,0.2567892341541768,2023-06-21 19:25:57.689205,2023-06-21 19:26:00.571146,0 days 00:00:02.881941,0.00011425963796037667,gbtree,0.6671939362998102,2.6558863418517265e-06,lossguide,0.655860889991957,0.06808016334519733,3,3,0.46174192589085233,COMPLETE
212,212,0.27173134436985763,2023-06-21 19:26:00.571904,2023-06-21 19:26:03.062778,0 days 00:00:02.490874,5.2629536444980634e-05,gbtree,0.5498123816352798,2.1965892826648757e-06,lossguide,0.2188047587555216,0.0780772653100007,3,4,0.47740487051229147,COMPLETE
213,213,0.2600547949315373,2023-06-21 19:26:03.063557,2023-06-21 19:26:07.455443,0 days 00:00:04.391886,0.0003735913927549074,gbtree,0.5554400725830531,1.3769789270134676e-06,lossguide,0.0001329505954312157,0.04950977062893968,3,3,0.4456132783402215,COMPLETE
214,214,0.25429101512794633,2023-06-21 19:26:07.456231,2023-06-21 19:26:10.754043,0 days 00:00:03.297812,0.00016405200638462014,gbtree,0.6250979684504304,4.717270434396103e-06,lossguide,0.7037407362030065,0.06517453445057525,3,4,0.4647263626027213,COMPLETE
215,215,0.25839199467836327,2023-06-21 19:26:10.754902,2023-06-21 19:26:13.944705,0 days 00:00:03.189803,0.00014494902169096772,gbtree,0.620651257844171,9.2388619615119e-06,lossguide,0.4422771657283433,0.059730265572488804,3,4,0.42166267390424483,COMPLETE
216,216,0.2679682658718067,2023-06-21 19:26:13.945511,2023-06-21 19:26:18.787206,0 days 00:00:04.841695,7.456093940210487e-05,gbtree,0.5190515874580305,7.48202898242676e-07,lossguide,0.16504924243950092,0.042111498406002215,3,2,0.8533150742152187,COMPLETE
217,217,0.2619261122512659,2023-06-21 19:26:18.788888,2023-06-21 19:26:21.286540,0 days 00:00:02.497652,0.0001933453766123681,gbtree,0.5688354468155736,4.561926128438474e-06,lossguide,0.9852602003924006,0.08458289267594206,3,4,0.5000485663239815,COMPLETE
218,218,0.26268699559928743,2023-06-21 19:26:21.287323,2023-06-21 19:26:24.741250,0 days 00:00:03.453927,3.715509523959387e-05,gbtree,0.6484413597161935,1.037277318085066e-06,lossguide,0.28472919890669063,0.05223217843567323,3,4,0.542481250453702,COMPLETE
219,219,0.2634317912600037,2023-06-21 19:26:24.742024,2023-06-21 19:26:29.134212,0 days 00:00:04.392188,0.0001243309170439499,gbtree,0.5300576551564256,0.028858210518165797,lossguide,8.334539572828061e-05,0.037584687523089376,3,4,0.4360185393724788,COMPLETE
220,220,0.2562181056853448,2023-06-21 19:26:29.135013,2023-06-21 19:26:33.784763,0 days 00:00:04.649750,0.0056561941250862485,gbtree,0.624316639488058,4.265448890431425e-07,lossguide,0.5063173988979126,0.045815031376892766,3,3,0.45658152953131775,COMPLETE
221,221,0.2583590264033849,2023-06-21 19:26:33.785549,2023-06-21 19:26:37.350362,0 days 00:00:03.564813,1.3357713324372778e-05,gbtree,0.6355877946218137,3.6965017371143684e-06,depthwise,0.6721389430076711,0.06460765191774943,3,4,0.4684785660585445,COMPLETE
222,222,0.2554946190597423,2023-06-21 19:26:37.351220,2023-06-21 19:26:40.569893,0 days 00:00:03.218673,0.0004921154334437595,gbtree,0.6395876467219976,6.028456417302961e-06,lossguide,0.6759071009612877,0.07203001854837544,3,4,0.47337918541373564,COMPLETE
223,223,0.2611710801022253,2023-06-21 19:26:40.570663,2023-06-21 19:26:44.418856,0 days 00:00:03.848193,0.0002711433790471399,gbtree,0.6544579929730273,6.053995069634936e-06,lossguide,0.3892402774018172,0.05808186718189967,3,4,0.47922540422015003,COMPLETE
224,224,0.26755510868252325,2023-06-21 19:26:44.419570,2023-06-21 19:26:47.042703,0 days 00:00:02.623133,0.0005478929289787104,gbtree,0.7269708795327542,1.0597595580828355e-05,lossguide,0.7170604822368652,0.07471796173799178,3,4,0.45028106730458156,COMPLETE
225,225,0.2556180115044016,2023-06-21 19:26:47.043505,2023-06-21 19:26:49.528839,0 days 00:00:02.485334,0.0003883906446426682,gbtree,0.6815773509968306,2.608390453650086e-06,lossguide,0.03589672095703314,0.0844302208438235,3,4,0.49014087188137717,COMPLETE
226,226,0.2691640906877907,2023-06-21 19:26:49.529535,2023-06-21 19:26:52.782591,0 days 00:00:03.253056,0.0009436923488756921,gbtree,0.4213113102684917,1.4355432145747024e-06,lossguide,0.10680635049758182,0.06402222125767665,3,5,0.4609818021584576,COMPLETE
227,227,0.2699510188124766,2023-06-21 19:26:52.783375,2023-06-21 19:26:54.899265,0 days 00:00:02.115890,0.00020620959290805474,gbtree,0.6166953823542415,1.5323312798096136e-05,lossguide,3.202782772860594e-05,0.09945307406872446,3,4,0.5205701754358454,COMPLETE
228,228,0.2726713206740055,2023-06-21 19:26:54.900038,2023-06-21 19:26:59.046111,0 days 00:00:04.146073,0.000292811403817415,gbtree,0.4904592222778693,5.629968657316753e-06,lossguide,0.07538908969742072,0.05560204306178841,3,4,0.6252168085009173,COMPLETE
229,229,0.25981567380339626,2023-06-21 19:26:59.046887,2023-06-21 19:27:04.603273,0 days 00:00:05.556386,0.0020393316244065656,gbtree,0.64316250743429,1.7842831855347528e-06,lossguide,0.9496064655786953,0.03133455709098669,3,3,0.4746895297848059,COMPLETE
230,230,0.25823326905578786,2023-06-21 19:27:04.604142,2023-06-21 19:27:09.251161,0 days 00:00:04.647019,0.00041187736547472655,gbtree,0.5827666803751107,0.00021592081829282145,lossguide,0.4881607809475296,0.04476147970525333,3,5,0.4458941456878019,COMPLETE
231,231,0.26057978552372707,2023-06-21 19:27:09.253146,2023-06-21 19:27:12.162169,0 days 00:00:02.909023,0.0006013250007490855,gbtree,0.6336284889452468,3.2224581576211854e-06,depthwise,0.6947975995615634,0.07273449540776494,3,4,0.464873326533461,COMPLETE
232,232,0.2568253700973368,2023-06-21 19:27:12.162937,2023-06-21 19:27:14.963516,0 days 00:00:02.800579,0.0008382921380583225,gbtree,0.643818985481369,4.638934065006888e-06,depthwise,0.6435831048972092,0.06970807309620562,3,4,0.4677223152997462,COMPLETE
233,233,0.26056889267534067,2023-06-21 19:27:14.964281,2023-06-21 19:27:17.739959,0 days 00:00:02.775678,0.0005574450643127473,gbtree,0.6264718770398003,2.4581824722267835e-05,lossguide,0.37391517689421605,0.06553671662596747,3,4,0.4836250915408309,COMPLETE
234,234,0.25905861227842125,2023-06-21 19:27:17.740814,2023-06-21 19:27:20.521382,0 days 00:00:02.780568,0.2093931541615825,gbtree,0.6698924952112763,2.4814491001576658e-06,lossguide,0.9932153500399875,0.0786881067416041,3,4,0.4582303205787314,COMPLETE
235,235,0.2589964168785743,2023-06-21 19:27:20.522188,2023-06-21 19:27:31.202015,0 days 00:00:10.679827,0.0010061999834448327,gbtree,0.434064901180705,8.082701260245112e-06,depthwise,0.0008304853301062483,0.009985525060732074,3,4,0.4333124048985086,COMPLETE
236,236,0.25936632335699256,2023-06-21 19:27:31.202823,2023-06-21 19:27:35.001724,0 days 00:00:03.798901,0.00015779545292434648,gbtree,0.6552032323034689,5.187090573768495e-05,lossguide,0.05592089889859112,0.05187158760984435,3,4,0.4740871115228478,COMPLETE
237,237,0.26269023564786825,2023-06-21 19:27:35.002510,2023-06-21 19:27:40.140720,0 days 00:00:05.138210,0.00041700267658627613,gbtree,0.6321618204581262,0.6428210530549108,lossguide,0.49054178245959085,0.036810741532237054,3,2,0.5754763916553851,COMPLETE
238,238,0.2568359580681716,2023-06-21 19:27:40.141508,2023-06-21 19:27:54.649924,0 days 00:00:14.508416,0.003541440152058542,gbtree,0.6049875760163956,7.09084292440285e-07,depthwise,2.094335836204347e-06,0.0064356991640508844,3,4,0.4550077542711953,COMPLETE
239,239,0.2559746958490306,2023-06-21 19:27:54.650717,2023-06-21 19:28:00.323671,0 days 00:00:05.672954,8.923984684915766e-05,gbtree,0.7007124168345789,3.857707392101163e-07,lossguide,0.027782561939009097,0.029294663478457536,3,4,0.4439246054767966,COMPLETE
240,240,0.2566339164619182,2023-06-21 19:28:00.325425,2023-06-21 19:28:03.305982,0 days 00:00:02.980557,0.0002473890747242833,gbtree,0.9911147561355111,3.626730537666068e-06,depthwise,0.20908692929519979,0.06380557802398132,3,5,0.4877876191396642,COMPLETE
241,241,0.258479529142387,2023-06-21 19:28:03.306774,2023-06-21 19:28:09.497884,0 days 00:00:06.191110,0.0006623402729553584,gbtree,0.6179445614263743,1.1034213087676398e-06,depthwise,0.040901138228199324,0.025018096500390677,4,4,0.5105676984706986,COMPLETE
242,242,0.2589791434572249,2023-06-21 19:28:09.498759,2023-06-21 19:28:14.622929,0 days 00:00:05.124170,0.0005106476350046576,gbtree,0.5991287763998813,1.6642580160275945e-06,depthwise,0.02118722296660479,0.032000490610972696,3,4,0.4991886586758769,COMPLETE
243,243,0.26000285551370655,2023-06-21 19:28:14.623732,2023-06-21 19:28:20.372929,0 days 00:00:05.749197,0.0013399573778510349,gbtree,0.6385371439335125,4.874182637291639e-07,depthwise,0.013951201912434956,0.027410401549426835,3,4,0.4714186064732747,COMPLETE
244,244,0.2547963696816277,2023-06-21 19:28:20.373715,2023-06-21 19:28:25.443124,0 days 00:00:05.069409,0.0007813735689366935,gbtree,0.6144510799660149,1.034473886538599e-06,depthwise,0.6842149386134246,0.03935642407732045,3,4,0.4644017709560628,COMPLETE
245,245,0.25369833435756917,2023-06-21 19:28:25.443914,2023-06-21 19:28:29.751928,0 days 00:00:04.308014,0.0008566079234959387,gbtree,0.8966491396028317,8.533789864231375e-07,depthwise,0.6908282093062734,0.04166162773205025,3,4,0.46048601004321066,COMPLETE
246,246,0.2616905037353625,2023-06-21 19:28:29.752734,2023-06-21 19:28:34.326274,0 days 00:00:04.573540,0.000858249133076967,gbtree,0.5608643855664788,9.675313700052198e-07,lossguide,0.3112356979124618,0.0396418443093039,5,4,0.44988858563698875,COMPLETE
247,247,0.2609314143280756,2023-06-21 19:28:34.327188,2023-06-21 19:28:52.134543,0 days 00:00:17.807355,0.0019054556369011864,gbtree,0.5758270807509299,6.31522057434225e-07,depthwise,0.6139361264352046,0.005217387752412185,3,4,0.46157523513007737,COMPLETE
248,248,0.2671665022621614,2023-06-21 19:28:52.135372,2023-06-21 19:28:56.603459,0 days 00:00:04.468087,0.0012424584662496661,gbtree,0.8177939181705376,2.7789262930938653e-07,lossguide,0.7343134401724625,0.04575835724166571,3,4,0.6026666859313994,COMPLETE
249,249,0.27264281549928254,2023-06-21 19:28:56.604329,2023-06-21 19:29:02.291898,0 days 00:00:05.687569,0.0003153107697832454,gbtree,0.9424289865072556,9.38206459991448e-07,depthwise,0.0014601243042716159,0.03533670500337074,3,4,0.9318325999563034,COMPLETE
250,250,0.2597753533259066,2023-06-21 19:29:02.292696,2023-06-21 19:29:06.090191,0 days 00:00:03.797495,0.0008495083130286935,gbtree,0.7595060289609028,1.9498393456598686e-06,lossguide,0.10486367906148122,0.05101703273494566,3,2,0.44288476638476154,COMPLETE
251,251,0.465173381338395,2023-06-21 19:29:06.090983,2023-06-21 19:29:28.521512,0 days 00:00:22.430529,4.5724379422023664e-05,gbtree,0.8636904835287204,6.925169900818949e-07,lossguide,0.9759882545759375,0.00030837764454277135,3,9,0.4788001764694215,COMPLETE
