,number,value,datetime_start,datetime_complete,duration,params_alpha,params_booster,params_colsample_bytree,params_gamma,params_grow_policy,params_lambda,params_learning_rate,params_max_depth,params_min_child_weight,params_subsample,state
672,672,0.28784947541339606,2023-06-21 20:29:45.959858,2023-06-21 20:30:09.600946,0 days 00:00:23.641088,3.440078008363289e-05,gbtree,0.7156315344031118,2.6921184693700856e-06,lossguide,1.2661192444317382e-07,0.0016762874747901766,3,3,0.7451833569209784,COMPLETE
673,673,0.27901712367843773,2023-06-21 20:30:09.601862,2023-06-21 20:30:15.282027,0 days 00:00:05.680165,0.0008840490727795325,gbtree,0.8252933348322649,1.2251359930955387e-06,depthwise,0.02001357049139035,0.03209370864859318,5,4,0.9470478235053099,COMPLETE
674,674,0.2551922805813366,2023-06-21 20:30:15.282933,2023-06-21 20:30:17.935498,0 days 00:00:02.652565,1.6994939886631472e-06,gbtree,0.6436967527637689,4.15711593749647e-06,lossguide,1.8513223257891172e-05,0.07029787692527473,10,4,0.4694629641916212,COMPLETE
675,675,0.27439694131085457,2023-06-21 20:30:17.936375,2023-06-21 20:30:20.745274,0 days 00:00:02.808899,1.7104800328256982e-07,gbtree,0.6481677963627654,8.750215398345169e-07,lossguide,0.7297271832020258,0.08064915628921736,9,3,0.6949514962555633,COMPLETE
676,676,0.2768742309412307,2023-06-21 20:30:20.746160,2023-06-21 20:30:23.236661,0 days 00:00:02.490501,9.192556775289928e-07,gbtree,0.6394715743373028,0.0004868888120925501,lossguide,6.957330501958164e-06,0.07478712198812011,10,4,0.7879633962396813,COMPLETE
677,677,0.2752916691128467,2023-06-21 20:30:23.237838,2023-06-21 20:30:25.963693,0 days 00:00:02.725855,1.004950854293102e-06,gbtree,0.6594621314085086,0.9789056174637497,lossguide,0.00014363977640354395,0.06802010191738567,10,4,0.7853826942500288,COMPLETE
678,678,0.2636855176462032,2023-06-21 20:30:25.964597,2023-06-21 20:30:38.396130,0 days 00:00:12.431533,1.9354040481299027e-06,gbtree,0.6843602743631338,0.007401136063062181,lossguide,4.203171413386776e-05,0.009504944255049544,9,4,0.4735402551632407,COMPLETE
679,679,0.3541791780268164,2023-06-21 20:30:38.396963,2023-06-21 20:31:06.043900,0 days 00:00:27.646937,1.1906514949421492e-05,gbtree,0.6472011085057515,4.0044451742278975e-06,lossguide,0.00011077569729571974,0.0006248881323127292,4,4,0.6414255787276447,COMPLETE
680,680,0.5503602695926566,2023-06-21 20:31:06.044713,2023-06-21 20:31:45.235850,0 days 00:00:39.191137,1.5272589569239151e-06,gbtree,0.6350391972261886,5.176080391158223e-07,lossguide,4.410558846945871e-05,0.00013702105519897438,9,4,0.49176708953036663,COMPLETE
681,681,0.2751186117707664,2023-06-21 20:31:45.236666,2023-06-21 20:31:49.879526,0 days 00:00:04.642860,3.1848573678193073e-06,gbtree,0.4394965721541115,1.7171250432390976e-05,lossguide,2.088186446623564e-06,0.0460197120569996,10,4,0.8679787948353385,COMPLETE
682,682,0.2642362284439787,2023-06-21 20:31:49.880434,2023-06-21 20:31:54.735285,0 days 00:00:04.854851,7.260309605195988e-06,gbtree,0.6727613021742693,0.0016473576880995237,lossguide,9.813648443391263e-06,0.03746948197777347,10,6,0.46740311857191413,COMPLETE
683,683,0.2658660391528757,2023-06-21 20:31:54.736180,2023-06-21 20:32:17.147251,0 days 00:00:22.411071,3.648326761274718e-06,gbtree,0.5065404142650616,0.036483041245365416,lossguide,0.39703490564919,0.003873222627483073,7,3,0.47650040382097386,COMPLETE
684,684,0.26604746392485973,2023-06-21 20:32:17.148197,2023-06-21 20:32:19.351870,0 days 00:00:02.203673,2.391035743063796e-07,gbtree,0.6588061020860463,3.18190500181486e-07,lossguide,0.5570474638275327,0.08903420593231764,9,4,0.5004256086963786,COMPLETE
685,685,0.28084403817899456,2023-06-21 20:32:19.352756,2023-06-21 20:32:23.963575,0 days 00:00:04.610819,8.426180825594268e-07,gbtree,0.856036402606398,3.0863111851161565e-05,lossguide,0.997606196486997,0.06825316756528749,10,5,0.9651994274405417,COMPLETE
686,686,0.26065612708986413,2023-06-21 20:32:23.964469,2023-06-21 20:32:29.527130,0 days 00:00:05.562661,5.630539263997874e-06,gbtree,0.6248369839799974,0.0034367027709819166,lossguide,1.643249573173505e-05,0.02847266527307574,10,4,0.5383162447493333,COMPLETE
687,687,0.31674738462774216,2023-06-21 20:32:29.528122,2023-06-21 20:33:02.701634,0 days 00:00:33.173512,0.004962079194604499,gbtree,0.9661893633889744,0.08861769418046668,lossguide,9.924443938506108e-05,0.0010498291661898726,10,4,0.45785337026810363,COMPLETE
688,688,0.26410884162566145,2023-06-21 20:33:02.703593,2023-06-21 20:33:05.422299,0 days 00:00:02.718706,0.0006014262891982491,gbtree,0.8118484734829085,0.5641071083264225,lossguide,1.2590449836037328e-05,0.056856743992097045,8,6,0.48620919308068805,COMPLETE
689,689,0.2676696474772806,2023-06-21 20:33:05.423190,2023-06-21 20:33:09.404702,0 days 00:00:03.981512,0.0013604716846459218,gbtree,0.7294473853500473,0.011378350494574975,lossguide,0.00023056862630426356,0.04997385047103711,9,3,0.46557816672174346,COMPLETE
690,690,0.2557367350193617,2023-06-21 20:33:09.405637,2023-06-21 20:33:13.895345,0 days 00:00:04.489708,7.848252246655072e-07,gbtree,0.896354582065112,2.314502160050449e-06,lossguide,1.4255483773628604e-06,0.042419698765498774,10,4,0.4470847476276706,COMPLETE
691,691,0.25900438882726434,2023-06-21 20:33:13.896238,2023-06-21 20:33:18.431961,0 days 00:00:04.535723,0.0024361031333499975,gbtree,0.7968792946096714,0.009585886076223963,lossguide,4.793160893915626e-06,0.0330674353117077,3,4,0.4194662825060003,COMPLETE
692,692,0.2664648984712589,2023-06-21 20:33:18.432874,2023-06-21 20:33:41.979547,0 days 00:00:23.546673,4.623074127318441e-06,gbtree,0.6411712807283537,0.0009323447258981102,lossguide,1.049172564441436e-06,0.0029888935908117292,4,3,0.4773494591532584,COMPLETE
693,693,0.2695770440993714,2023-06-21 20:33:41.980487,2023-06-21 20:33:48.932836,0 days 00:00:06.952349,0.009902564459644254,gbtree,0.6519396907186298,0.052930612956383905,lossguide,8.71802022896333e-05,0.025222551786670527,3,4,0.8993987091401612,COMPLETE
694,694,0.27004829119836016,2023-06-21 20:33:48.933817,2023-06-21 20:33:51.480361,0 days 00:00:02.546544,3.9288502296478854e-07,gbtree,0.8784707938028559,0.0044504653396108314,lossguide,2.6163015067414645e-05,0.07031071898081048,6,4,0.4344948424415438,COMPLETE
695,695,0.26955075480054264,2023-06-21 20:33:51.481252,2023-06-21 20:33:55.739775,0 days 00:00:04.258523,2.4149056560825124e-05,gbtree,0.9281786002550154,0.0003372992487998152,lossguide,6.511711206799285e-05,0.05492502945765539,3,4,0.9813515630000536,COMPLETE
696,696,0.2683847289529704,2023-06-21 20:33:55.740678,2023-06-21 20:33:58.075083,0 days 00:00:02.334405,0.0007276594853487725,gbtree,0.8333489614061206,1.0640834501905708e-06,lossguide,4.4784987304702156e-05,0.08515124967555535,3,4,0.672342059788262,COMPLETE
697,697,0.26038968990963546,2023-06-21 20:33:58.075984,2023-06-21 20:34:00.823495,0 days 00:00:02.747511,0.003183678746115569,gbtree,0.6908855460055923,8.538171832625231e-05,lossguide,6.046316762162757e-07,0.0636131825231621,3,3,0.4561199531529875,COMPLETE
698,698,0.25891750848545636,2023-06-21 20:34:00.824403,2023-06-21 20:34:04.632599,0 days 00:00:03.808196,0.00039121869085381397,gbtree,0.7526878412628499,7.245880149612274e-07,lossguide,0.0008405258558713023,0.04326875296661304,3,4,0.40017370188964574,COMPLETE
699,699,0.26136650229728614,2023-06-21 20:34:04.633512,2023-06-21 20:34:14.129548,0 days 00:00:09.496036,3.792173593773722e-07,gbtree,0.48843998628049823,0.018363089139990588,lossguide,0.2688288698728759,0.011557111447318826,3,4,0.5234608014961528,COMPLETE
700,700,0.2571819186113637,2023-06-21 20:34:14.130509,2023-06-21 20:34:18.861547,0 days 00:00:04.731038,1.3673668421903925e-06,gbtree,0.6315231824880178,4.755664423107527e-06,lossguide,2.854515619495004e-05,0.037007050707864905,3,5,0.46911891364788105,COMPLETE
701,701,0.25998970915070596,2023-06-21 20:34:18.862457,2023-06-21 20:34:33.657581,0 days 00:00:14.795124,1.5112253413483317e-06,gbtree,0.6135461846445175,0.04425213116802328,lossguide,1.877203488311612e-05,0.006349797658799391,3,4,0.48790744913119766,COMPLETE
702,702,0.39458551040980544,2023-06-21 20:34:33.658400,2023-06-21 20:34:56.108396,0 days 00:00:22.449996,0.027775515579244226,gbtree,0.6697454029167951,0.002410696376066135,depthwise,2.9839215929413495e-06,0.0005210267988443512,3,3,0.4455751562153474,COMPLETE
703,703,0.3285240303584514,2023-06-21 20:34:56.109277,2023-06-21 20:35:17.919626,0 days 00:00:21.810349,0.051210460639120096,gbtree,0.5466142206797583,0.16446424925820963,lossguide,6.012503576110256e-06,0.000981236026014771,3,4,0.46047206186853307,COMPLETE
704,704,0.25946919958909986,2023-06-21 20:35:17.920480,2023-06-21 20:35:24.851346,0 days 00:00:06.930866,6.6792678788827e-05,gbtree,0.6415645907706984,0.08553085865716878,depthwise,0.40550227767697605,0.01994562158455725,3,5,0.5029941820077489,COMPLETE
705,705,0.2710961795049056,2023-06-21 20:35:24.852249,2023-06-21 20:35:28.479548,0 days 00:00:03.627299,2.5552341716958465e-06,gbtree,0.5263598785779162,1.525580858985234e-06,lossguide,0.005672186837836026,0.051513581239034954,10,4,0.6514057358331615,COMPLETE
706,706,0.47840536854913385,2023-06-21 20:35:28.480450,2023-06-21 20:35:55.437167,0 days 00:00:26.956717,0.0005458371731963133,gbtree,0.7698728070395798,9.36677191092272e-06,depthwise,0.0003099492199766561,0.00025116131099300616,4,4,0.436102803448274,COMPLETE
707,707,0.2647441519849433,2023-06-21 20:35:55.437974,2023-06-21 20:35:58.012722,0 days 00:00:02.574748,0.001771776387999697,gbtree,0.6214413332296114,3.349450777165422e-06,lossguide,0.01084455674815929,0.07620559632172078,3,4,0.47674388576067006,COMPLETE
708,708,0.3342412641699679,2023-06-21 20:35:58.013624,2023-06-21 20:36:20.546308,0 days 00:00:22.532684,4.447447090107414e-08,gbtree,0.7209261622521842,4.4270099448575144e-07,lossguide,0.6857012006278891,0.0009284932693142517,3,3,0.44771785012795823,COMPLETE
709,709,0.5297218429127637,2023-06-21 20:36:20.547383,2023-06-21 20:36:44.928801,0 days 00:00:24.381418,0.606501599460546,gbtree,0.7846716668860042,0.0005740526683513803,depthwise,1.4251376806618157e-05,0.00016751880710477935,3,4,0.714627036359697,COMPLETE
710,710,0.2568345665990471,2023-06-21 20:36:44.929791,2023-06-21 20:36:50.064541,0 days 00:00:05.134750,0.09403693099772195,gbtree,0.6546578849296334,2.1352098865905863e-07,lossguide,0.24803063754528756,0.030453474306712358,3,4,0.46481913932282737,COMPLETE
711,711,0.3335615760093387,2023-06-21 20:36:50.065447,2023-06-21 20:37:19.181530,0 days 00:00:29.116083,5.927546772234362e-07,gbtree,0.9481967681410141,6.259176271956078e-06,depthwise,0.002032481082481043,0.0007540307195316974,4,4,0.5932597292928458,COMPLETE
712,712,0.27382324551864795,2023-06-21 20:37:19.182345,2023-06-21 20:37:40.449367,0 days 00:00:21.267022,1.6952174161030472e-07,gbtree,0.5868966242740459,1.829615807681378e-06,lossguide,0.5314281195349092,0.002480075285109496,3,3,0.42982345487183615,COMPLETE
713,713,0.2735333425166404,2023-06-21 20:37:40.450186,2023-06-21 20:37:45.385307,0 days 00:00:04.935121,0.0065122085634120985,gbtree,0.7014677813154525,0.008044469749520812,depthwise,0.9814692002947526,0.061069838311938775,3,4,0.9875800412539294,COMPLETE
714,714,0.26284544156838485,2023-06-21 20:37:45.387190,2023-06-21 20:37:52.220505,0 days 00:00:06.833315,1.548492257897303e-05,gbtree,0.6346605590579313,6.907377076063992e-07,lossguide,0.3660342408446239,0.022520878021650162,3,4,0.6625725998932759,COMPLETE
715,715,0.26033804227267415,2023-06-21 20:37:52.221491,2023-06-21 20:38:21.080909,0 days 00:00:28.859418,0.2782230923244102,gbtree,0.6086295472535987,0.10459014532948006,depthwise,0.0003915869519535924,0.005423918077554766,3,4,0.6019813889797198,COMPLETE
716,716,0.25881216589072825,2023-06-21 20:38:21.081953,2023-06-21 20:38:25.402938,0 days 00:00:04.320985,9.49786516452192e-06,gbtree,0.6654086472905043,1.4969977174488013e-08,lossguide,0.7164510637412156,0.04543273097630968,3,4,0.6164066180098879,COMPLETE
717,717,0.2661739535385393,2023-06-21 20:38:25.403878,2023-06-21 20:38:29.991621,0 days 00:00:04.587743,1.9948318140252093e-06,gbtree,0.6236682173203962,1.256036631430378e-05,depthwise,1.6471811594563118e-07,0.040109982612504605,3,3,0.6072264409918265,COMPLETE
718,718,0.2553352926727542,2023-06-21 20:38:29.993499,2023-06-21 20:38:37.277059,0 days 00:00:07.283560,0.00031749704410847856,gbtree,0.41861587459047533,0.048780230540316896,lossguide,0.031126132782992793,0.017478032954122327,3,5,0.4525819499145775,COMPLETE
719,719,0.2864311629654294,2023-06-21 20:38:37.278823,2023-06-21 20:39:07.377560,0 days 00:00:30.098737,0.0008647446573975977,gbtree,0.8720775432659892,0.025727353358486634,lossguide,0.18622731409487137,0.001856347580388678,5,4,0.819004238528066,COMPLETE
720,720,0.2675964962553738,2023-06-21 20:39:07.380239,2023-06-21 20:39:10.216160,0 days 00:00:02.835921,4.9779981152369656e-05,gbtree,0.9152637748961723,1.264438704818587e-06,depthwise,2.5748515169415403e-07,0.06860675613213013,3,4,0.48998997848044407,COMPLETE
721,721,0.258787141260072,2023-06-21 20:39:10.217073,2023-06-21 20:39:13.094952,0 days 00:00:02.877879,3.5963112006810485e-05,gbtree,0.7354521688663312,0.3843482180901034,lossguide,7.756798895907452e-05,0.05393690962993255,3,4,0.5430584286767853,COMPLETE
722,722,0.45989580074749564,2023-06-21 20:39:13.095840,2023-06-21 20:39:36.382169,0 days 00:00:23.286329,0.01472433578911989,gbtree,0.8091105565505428,2.6543837668403335e-06,depthwise,0.9922870727861224,0.00030654003845302955,3,4,0.518101768083453,COMPLETE
723,723,0.2688214619265085,2023-06-21 20:39:36.383148,2023-06-21 20:39:40.873647,0 days 00:00:04.490499,0.0012636472159760514,gbtree,0.6476521258885202,1.0652933960669816e-07,lossguide,5.6518971247505954e-05,0.04824053245834802,3,9,0.5493060315649243,COMPLETE
724,724,0.27057641223798545,2023-06-21 20:39:40.874557,2023-06-21 20:39:43.168246,0 days 00:00:02.293689,0.15660992255878195,gbtree,0.888934990006049,0.07824406004155082,depthwise,1.0234448944455158e-05,0.092564707031644,3,3,0.47246666313745705,COMPLETE
725,725,0.25964020072311284,2023-06-21 20:39:43.169156,2023-06-21 20:39:48.386303,0 days 00:00:05.217147,2.007879056371089e-08,gbtree,0.6795006789775568,0.002395890331919024,lossguide,1.8845827802634217e-05,0.03455642435757608,9,4,0.4553939017711067,COMPLETE
726,726,0.2643161059698782,2023-06-21 20:39:48.387215,2023-06-21 20:39:50.909112,0 days 00:00:02.521897,0.00023328565234213047,gbtree,0.5732769333930189,0.0007386810135735771,depthwise,0.4982192490166994,0.07777949451504011,3,4,0.8322152838460186,COMPLETE
727,727,0.2710750214386279,2023-06-21 20:39:50.909997,2023-06-21 20:39:53.733220,0 days 00:00:02.823223,0.0005124033858359635,gbtree,0.6336527270290521,9.372240470349128e-07,lossguide,0.0039717825423210605,0.06292648215022871,4,3,0.6263861771799554,COMPLETE
728,728,0.26928063342173436,2023-06-21 20:39:53.734123,2023-06-21 20:40:03.401992,0 days 00:00:09.667869,8.681501321247941e-05,gbtree,0.6134802713547411,0.00038147769856191905,lossguide,0.0002285423231764787,0.014215954957249621,3,4,0.9231750717100295,COMPLETE
729,729,0.25990236577395076,2023-06-21 20:40:03.402916,2023-06-21 20:40:08.488850,0 days 00:00:05.085934,0.0021993176077552182,gbtree,0.6541459833569854,2.2641500767290704e-05,depthwise,0.00017734043720362574,0.02709694085156173,3,5,0.4228865064498675,COMPLETE
730,730,0.4674056251825826,2023-06-21 20:40:08.489791,2023-06-21 20:40:40.121377,0 days 00:00:31.631586,8.31706671616971e-08,gbtree,0.6010943421315852,3.8030402574605675e-07,lossguide,0.0013644652048384325,0.00028136461222011655,6,4,0.4408983585849598,COMPLETE
731,731,0.2626306514657557,2023-06-21 20:40:40.122325,2023-06-21 20:41:00.244878,0 days 00:00:20.122553,0.00014670833796612628,gbtree,0.9342238634885153,4.1448355037419596e-05,depthwise,2.7838296139709675e-06,0.00410892846173291,3,4,0.4793140143235147,COMPLETE
732,732,0.3984314607501949,2023-06-21 20:41:00.246705,2023-06-21 20:41:23.416595,0 days 00:00:23.169890,0.0003654711227260854,gbtree,0.8548345979783532,3.2164895742734456e-06,lossguide,6.086793560286326e-07,0.0004891173501327843,3,4,0.41101676438456586,COMPLETE
733,733,0.263211733950113,2023-06-21 20:41:23.417442,2023-06-21 20:41:38.813678,0 days 00:00:15.396236,0.0007875787112878347,gbtree,0.562114179324899,5.510783352777077e-07,depthwise,0.12014104252822937,0.00708733787912066,7,4,0.6942738098356038,COMPLETE
734,734,0.2525835183185232,2023-06-21 20:41:38.814613,2023-06-21 20:41:41.669825,0 days 00:00:02.855212,1.1613390255365139e-06,gbtree,0.7583219594221297,4.959700442053539e-06,lossguide,0.31664798224530466,0.056301903274264216,3,4,0.4624825772716752,COMPLETE
735,735,0.2602457478779578,2023-06-21 20:41:41.670644,2023-06-21 20:41:44.531804,0 days 00:00:02.861160,1.7631081554486485e-06,gbtree,0.7611712002925883,8.845423562819481e-06,lossguide,0.3089648688163206,0.055849008555292075,10,4,0.6366952963555768,COMPLETE
736,736,0.27186013014935817,2023-06-21 20:41:44.532745,2023-06-21 20:41:47.228102,0 days 00:00:02.695357,3.5044858091181795e-07,gbtree,0.7501267232204765,1.2253849375378309e-05,depthwise,0.5409054381608315,0.06905844037900354,3,3,0.7875678126608501,COMPLETE
737,737,0.3033795445808524,2023-06-21 20:41:47.229060,2023-06-21 20:42:09.624822,0 days 00:00:22.395762,1.0143974420184488e-06,gbtree,0.7366742038881589,5.645262916882272e-06,lossguide,0.4003711307102882,0.001317047642587649,3,6,0.49491052195647106,COMPLETE
738,738,0.2659182913389386,2023-06-21 20:42:09.625760,2023-06-21 20:42:11.741566,0 days 00:00:02.115806,1.0252793509754078e-06,gbtree,0.7146104542100066,0.0002278148365155683,depthwise,0.6991245807590728,0.09989882084030675,8,4,0.46412744228500097,COMPLETE
739,739,0.26754797739447445,2023-06-21 20:42:11.742528,2023-06-21 20:42:14.416151,0 days 00:00:02.673623,3.8671948656240485e-06,gbtree,0.7272454436855262,0.1209949683573414,lossguide,0.30157406917330515,0.05848237346739073,3,4,0.7510475077010582,COMPLETE
740,740,0.2675654917800962,2023-06-21 20:42:14.417071,2023-06-21 20:42:27.927059,0 days 00:00:13.509988,2.134543285324003e-06,gbtree,0.8240587875566666,0.03493833774945811,lossguide,3.940955430388203e-08,0.00886938258535789,3,3,0.7702393580480392,COMPLETE
741,741,0.25899180745073075,2023-06-21 20:42:27.927905,2023-06-21 20:42:31.917945,0 days 00:00:03.990040,6.672893922793185e-07,gbtree,0.7404569719544676,0.009971074412992529,depthwise,2.7664215162430476e-05,0.04783834194015946,3,5,0.4841541199567338,COMPLETE
742,742,0.2664613407786737,2023-06-21 20:42:31.918773,2023-06-21 20:42:34.541597,0 days 00:00:02.622824,1.499938883839812e-06,gbtree,0.7784523657815897,6.584656038884806e-06,lossguide,0.003398391630526464,0.06213935123374033,3,4,0.5053657845352514,COMPLETE
743,743,0.260967248037729,2023-06-21 20:42:34.542507,2023-06-21 20:42:37.083979,0 days 00:00:02.541472,1.4039968458715301e-06,gbtree,0.7598751580923822,2.603766948083217e-07,depthwise,0.731428784639256,0.08218821076936947,4,4,0.46941990368617076,COMPLETE
744,744,0.25103694664410875,2023-06-21 20:42:37.084920,2023-06-21 20:42:39.929652,0 days 00:00:02.844732,4.167232286637963e-07,gbtree,0.7043459333479516,0.27890740009544635,lossguide,1.6888616736015635e-06,0.052066869115197915,3,4,0.45967495655965523,COMPLETE
745,745,0.2571245773951331,2023-06-21 20:42:39.930570,2023-06-21 20:42:44.022134,0 days 00:00:04.091564,2.738891895569606e-07,gbtree,0.7294893956984884,0.00011219658916052773,depthwise,0.0005148603267715908,0.04543153337841922,3,4,0.45196950906619565,COMPLETE
746,746,0.27111122856010944,2023-06-21 20:42:44.023047,2023-06-21 20:42:48.096470,0 days 00:00:04.073423,5.260592805262723e-08,gbtree,0.6996411121533712,0.058482537290242574,lossguide,1.2616011368862186e-08,0.05198544351531628,3,7,0.9423886376746304,COMPLETE
747,747,0.2609871081612176,2023-06-21 20:42:48.097469,2023-06-21 20:42:52.439262,0 days 00:00:04.341793,2.4801910885259122e-05,gbtree,0.6776588397113856,0.4879396885622847,depthwise,1.729892870957131e-08,0.04237341540017665,3,3,0.44114886749010973,COMPLETE
748,748,0.26045461363973466,2023-06-21 20:42:52.440260,2023-06-21 20:42:55.924095,0 days 00:00:03.483835,1.0203962400240472e-07,gbtree,0.7162055690102073,0.32060796326114566,lossguide,0.4652484475126775,0.05642953428542705,3,4,0.5848980867351884,COMPLETE
749,749,0.2618301454367072,2023-06-21 20:42:55.925838,2023-06-21 20:43:13.697945,0 days 00:00:17.772107,6.476844609547941e-08,gbtree,0.6917179380996477,4.117315676966928e-05,lossguide,2.3672795711257367e-07,0.004813961144214875,3,4,0.4586433349901693,COMPLETE
750,750,0.39782289667793885,2023-06-21 20:43:13.698787,2023-06-21 20:43:36.509121,0 days 00:00:22.810334,4.2851695641275476e-07,gbtree,0.8033121212542678,0.08131768318182316,depthwise,7.598819656916416e-07,0.0004839814383696382,3,5,0.4597018206721344,COMPLETE
751,751,0.2642611093121373,2023-06-21 20:43:36.509972,2023-06-21 20:43:56.845820,0 days 00:00:20.335848,4.037819937322329e-07,gbtree,0.6934988392553343,0.0158959462316678,lossguide,0.00249016023464303,0.0034154891593509173,3,3,0.43071881676157725,COMPLETE
752,752,0.43884415607898747,2023-06-21 20:43:56.846669,2023-06-21 20:44:19.770348,0 days 00:00:22.923679,1.0814105125015852e-07,gbtree,0.7192611310434608,0.14056054008773125,depthwise,0.011574295379295916,0.00035762699018010186,3,4,0.4779405766150703,COMPLETE
753,753,0.2721256344531993,2023-06-21 20:44:19.771179,2023-06-21 20:44:23.884127,0 days 00:00:04.112948,4.3479298416031805e-07,gbtree,0.9100997241157209,0.02951666690621909,lossguide,8.671037677145994e-08,0.05083575761534126,3,4,0.8123198674937899,COMPLETE
754,754,0.2671450500676857,2023-06-21 20:44:23.885027,2023-06-21 20:44:29.265183,0 days 00:00:05.380156,4.090422577683205e-05,gbtree,0.706272104266621,0.003548697160909009,depthwise,0.0004336196207394641,0.03884607783625342,3,4,0.9645484359763656,COMPLETE
755,755,0.2682343003874173,2023-06-21 20:44:29.266109,2023-06-21 20:44:32.456542,0 days 00:00:03.190433,1.6633601948279616e-07,gbtree,0.6223395968145733,1.7351133254742077e-05,lossguide,1.3174333480400848e-07,0.05199117415745426,3,4,0.4464614785654271,COMPLETE
