,number,value,datetime_start,datetime_complete,duration,params_alpha,params_booster,params_colsample_bytree,params_gamma,params_grow_policy,params_lambda,params_learning_rate,params_max_depth,params_min_child_weight,params_subsample,state
420,420,0.2534931959410022,2023-06-21 19:49:23.376047,2023-06-21 19:49:25.540541,0 days 00:00:02.164494,2.7402135544011886e-05,gbtree,0.6323801882914484,2.7893355587901074e-06,lossguide,0.7091527150772119,0.08044120433655683,3,3,0.46905448839580977,COMPLETE
421,421,0.2583988749876271,2023-06-21 19:49:25.541362,2023-06-21 19:49:28.073279,0 days 00:00:02.531917,1.7092315209192025e-05,gbtree,0.5904047152684858,5.41731111475551e-06,lossguide,0.6857119325069542,0.09981003692925705,3,2,0.7455791947972275,COMPLETE
422,422,0.26593855415601864,2023-06-21 19:49:28.074094,2023-06-21 19:49:30.378166,0 days 00:00:02.304072,3.415536852260175e-05,gbtree,0.619843443638004,3.454674600073791e-06,depthwise,0.5538440262034907,0.08212346382790757,6,3,0.47238509355752295,COMPLETE
423,423,0.27164461626171077,2023-06-21 19:49:30.379000,2023-06-21 19:49:34.348154,0 days 00:00:03.969154,5.424637057078356e-05,gbtree,0.6385122393356075,3.3821672118529887e-07,lossguide,0.9888029497455791,0.07334771561316827,3,3,0.9894387184445902,COMPLETE
424,424,0.2797973214903029,2023-06-21 19:49:34.349031,2023-06-21 19:49:36.871102,0 days 00:00:02.522071,6.578802782998911e-05,gbtree,0.760864891140419,1.63249931987278e-05,lossguide,0.3786289462197977,0.08138678896309903,3,2,0.5975459703070112,COMPLETE
425,425,0.2587631303638576,2023-06-21 19:49:36.871933,2023-06-21 19:49:39.561806,0 days 00:00:02.689873,2.2797932078213367e-05,gbtree,0.6577479825429804,9.685679235082948e-06,depthwise,0.7059387087605259,0.06865755481585688,3,2,0.4642156619602775,COMPLETE
426,426,0.26796323796106236,2023-06-21 19:49:39.562654,2023-06-21 19:49:41.804482,0 days 00:00:02.241828,3.7738234875528617e-05,gbtree,0.6280309353156798,0.0003814117470102555,lossguide,0.2665295334813427,0.08713674027039485,4,3,0.629255732520812,COMPLETE
427,427,0.2622623831199749,2023-06-21 19:49:41.805317,2023-06-21 19:49:44.331957,0 days 00:00:02.526640,3.147855323408515e-05,gbtree,0.6103081098392757,2.6130980931368752e-06,depthwise,0.0036705121318141905,0.0594339648579048,3,3,0.4808382306570397,COMPLETE
428,428,0.25979433731928986,2023-06-21 19:49:44.332821,2023-06-21 19:49:47.298733,0 days 00:00:02.965912,0.0001503761001565647,gbtree,0.9779393415107913,1.875479284586256e-06,lossguide,0.48169274780577,0.052511627647026354,3,4,0.41818364474123615,COMPLETE
429,429,0.2546997719903897,2023-06-21 19:49:47.299561,2023-06-21 19:49:50.140001,0 days 00:00:02.840440,0.0002756761279340654,gbtree,0.7183848818861239,5.598018043046114e-07,depthwise,0.6793202358804858,0.06663207673827454,3,3,0.45351710885145313,COMPLETE
430,430,0.27127190807648105,2023-06-21 19:49:50.140832,2023-06-21 19:49:52.868439,0 days 00:00:02.727607,0.06923426898770231,gbtree,0.710883391074235,5.463060283407836e-07,lossguide,0.1453879185609871,0.0739320457454169,3,3,0.7929251284813932,COMPLETE
431,431,0.26263766888030854,2023-06-21 19:49:52.869275,2023-06-21 19:49:55.009553,0 days 00:00:02.140278,0.008740834113608997,gbtree,0.7299081811880683,3.144705974028552e-08,depthwise,0.23693619964080997,0.08979255363639545,3,3,0.45190403564252085,COMPLETE
432,432,0.2654447163379924,2023-06-21 19:49:55.010361,2023-06-21 19:49:57.656157,0 days 00:00:02.645796,1.8326049195022036e-05,gbtree,0.908953469335719,4.670519003106763e-07,lossguide,0.36144651653460436,0.06321717258027586,3,3,0.437802510502719,COMPLETE
433,433,0.35121866238553284,2023-06-21 19:49:57.657005,2023-06-21 19:50:20.462167,0 days 00:00:22.805162,1.2552087408861825e-05,gbtree,0.7258955741298025,2.6587879703919865e-07,depthwise,0.6537639790862277,0.0007737028979308385,3,3,0.450043538433961,COMPLETE
434,434,0.30108112683184274,2023-06-21 19:50:20.462992,2023-06-21 19:50:44.003592,0 days 00:00:23.540600,8.094226377645004e-06,gbtree,0.9210852038564792,5.014290892074121e-06,lossguide,1.3049840996849768e-05,0.0013601974664182274,3,3,0.46529150017536114,COMPLETE
435,435,0.2617455500051937,2023-06-21 19:50:44.004373,2023-06-21 19:50:47.249098,0 days 00:00:03.244725,9.75618148260531e-05,gbtree,0.6000468123580661,7.182851354154009e-07,depthwise,3.3059432556332184e-06,0.04814039963145845,3,2,0.4237774794562272,COMPLETE
436,436,0.34338642047834084,2023-06-21 19:50:47.249960,2023-06-21 19:51:09.962265,0 days 00:00:22.712305,0.0027725827023111645,gbtree,0.6919090046389379,1.372854113814319e-07,lossguide,0.0005025401180097663,0.0008199987664855544,3,3,0.4351480804364294,COMPLETE
437,437,0.26061947103443034,2023-06-21 19:51:09.963126,2023-06-21 19:51:26.745947,0 days 00:00:16.782821,0.0009186311427122639,gbtree,0.8344677855036677,0.012216276159505575,lossguide,0.46811815229593723,0.005582250082152909,3,3,0.4574559442601641,COMPLETE
438,438,0.3720598783087698,2023-06-21 19:51:26.746694,2023-06-21 19:51:51.334506,0 days 00:00:24.587812,0.00024171050612951348,gbtree,0.9431308618790327,2.3869233635947186e-05,depthwise,6.892241876089289e-06,0.0006024126986569314,3,2,0.47173106849150204,COMPLETE
439,439,0.2602570628398969,2023-06-21 19:51:51.335369,2023-06-21 19:51:54.887259,0 days 00:00:03.551890,0.001678690703052185,gbtree,0.8066155067610787,0.00016374555001640094,lossguide,0.0001056149029814875,0.05577011470123577,3,3,0.4001878612895342,COMPLETE
440,440,0.25823252406558894,2023-06-21 19:51:54.888083,2023-06-21 19:51:59.106412,0 days 00:00:04.218329,0.0004987603812291209,gbtree,0.7710384146843113,6.908460637205761e-06,depthwise,0.010770696324616804,0.043013928703145285,4,4,0.4461109767820456,COMPLETE
441,441,0.2656404957254012,2023-06-21 19:51:59.107242,2023-06-21 19:52:11.500316,0 days 00:00:12.393074,2.415193885500488e-05,gbtree,0.5899591527684218,0.03511490807742701,lossguide,0.10973192173182576,0.01003993223380617,3,4,0.9032895205316279,COMPLETE
442,442,0.2588639836254143,2023-06-21 19:52:11.501074,2023-06-21 19:52:27.360498,0 days 00:00:15.859424,5.3875734758809725e-05,gbtree,0.5334719317489293,1.850081416398209e-07,depthwise,0.7122369981059689,0.006018624109074644,3,4,0.46088066938395983,COMPLETE
443,443,0.264371134229935,2023-06-21 19:52:27.362341,2023-06-21 19:52:30.006333,0 days 00:00:02.643992,0.004212941445891033,gbtree,0.6759554576406702,0.2685645566214446,lossguide,6.493474558203441e-05,0.06784396850456002,3,3,0.5802789794344991,COMPLETE
444,444,0.2824264813860257,2023-06-21 19:52:30.007158,2023-06-21 19:52:53.303061,0 days 00:00:23.295903,2.0925761819208218e-06,gbtree,0.9550051737673845,1.2383839453024564e-06,depthwise,0.4038683926217963,0.0018649095679789097,3,4,0.47357592581459196,COMPLETE
445,445,0.25804664789369797,2023-06-21 19:52:53.303820,2023-06-21 19:52:57.935264,0 days 00:00:04.631444,0.03936643825060568,gbtree,0.891053522526604,3.0094489477720503e-06,lossguide,0.18437351367284513,0.03302827788401659,7,6,0.4427740918445001,COMPLETE
446,446,0.25857859848008435,2023-06-21 19:52:57.936118,2023-06-21 19:53:00.184180,0 days 00:00:02.248062,0.02926503709698042,gbtree,0.6142983779780661,6.077604560715193e-05,lossguide,0.7392476287061668,0.07718639245569879,3,4,0.5348791874518182,COMPLETE
447,447,0.28322174958808505,2023-06-21 19:53:00.185016,2023-06-21 19:53:30.453155,0 days 00:00:30.268139,0.01397631444980704,gbtree,0.7017039866105893,3.116165648321125e-07,depthwise,0.268132585258842,0.0029377167994319425,10,2,0.7210683806625265,COMPLETE
448,448,0.2585271823219173,2023-06-21 19:53:30.454008,2023-06-21 19:53:33.122870,0 days 00:00:02.668862,0.00014403002836506766,gbtree,0.6406824165446768,1.0562723288524492e-05,lossguide,4.740687291656172e-05,0.056373113693743974,5,4,0.49657278251019144,COMPLETE
449,449,0.2791072149559781,2023-06-21 19:53:33.123628,2023-06-21 19:53:55.473381,0 days 00:00:22.349753,0.0007316765831976432,gbtree,0.6268334643726462,1.9447371925982806e-06,depthwise,0.5156422261118264,0.001979532889809926,3,4,0.6611892353580643,COMPLETE
450,450,0.2602088418190635,2023-06-21 19:53:55.474163,2023-06-21 19:53:59.556752,0 days 00:00:04.082589,0.0011466723935433536,gbtree,0.7891320795339818,4.511905400823915e-06,lossguide,2.6752646390683617e-07,0.03731139857454793,4,4,0.45455949235121795,COMPLETE
451,451,0.261269482590775,2023-06-21 19:53:59.557681,2023-06-21 19:54:02.357800,0 days 00:00:02.800119,0.0003005195730476314,gbtree,0.5119167561944967,1.144346406404966e-06,depthwise,0.9934622631252946,0.04928255242156538,3,3,0.41289445013372467,COMPLETE
452,452,0.27011294780773504,2023-06-21 19:54:02.358636,2023-06-21 19:54:04.124417,0 days 00:00:01.765781,0.00019229769740108924,gbtree,0.7531174590625392,4.6414140003610787e-07,lossguide,1.1298797581410374e-06,0.09947928167204895,3,3,0.4301744211674855,COMPLETE
453,453,0.26438354789321067,2023-06-21 19:54:04.125254,2023-06-21 19:54:09.702391,0 days 00:00:05.577137,8.875844262316854e-05,gbtree,0.8648284673926997,3.995641567043466e-05,depthwise,5.03833264898036e-07,0.029164636896268203,3,4,0.6398790987403341,COMPLETE
454,454,0.2606216292514572,2023-06-21 19:54:09.703132,2023-06-21 19:54:15.570290,0 days 00:00:05.867158,0.0004399405474257151,gbtree,0.8063555425645407,3.002080035632527e-06,lossguide,0.028864987405252594,0.023479770595695386,3,4,0.47952847354956907,COMPLETE
455,455,0.2604476464540641,2023-06-21 19:54:15.571143,2023-06-21 19:54:28.384417,0 days 00:00:12.813274,0.0007403263712288819,gbtree,0.9640694299730561,6.705074026156901e-07,lossguide,0.0773356676342343,0.007259253591023014,3,4,0.46622845188415124,COMPLETE
456,456,0.2598783957782517,2023-06-21 19:54:28.385386,2023-06-21 19:54:42.096318,0 days 00:00:13.710932,0.0020407318641998927,gbtree,0.7231359800269732,1.370453773507124e-05,depthwise,0.0009187881011462909,0.006475600979724875,3,4,0.45104994680757876,COMPLETE
457,457,0.2666482263866538,2023-06-21 19:54:42.097083,2023-06-21 19:54:45.438212,0 days 00:00:03.341129,0.00024251559473233603,gbtree,0.8948634779245498,1.5078035425398375e-06,lossguide,0.5620889067709508,0.06756041072059717,3,4,0.5126808947281783,COMPLETE
458,458,0.2726478228318895,2023-06-21 19:54:45.439038,2023-06-21 19:54:48.641370,0 days 00:00:03.202332,0.00012026935660566906,gbtree,0.9295263859984727,6.496246018047941e-06,depthwise,0.14134323588208347,0.05883098890142755,3,2,0.7932410389466364,COMPLETE
459,459,0.26240389776716433,2023-06-21 19:54:48.642222,2023-06-21 19:55:09.454196,0 days 00:00:20.811974,0.0012543289194541295,gbtree,0.6455854906216589,0.00010635858320171393,lossguide,0.3114253996515652,0.00345945068400572,3,3,0.48681219938847925,COMPLETE
460,460,0.2698409035385486,2023-06-21 19:55:09.455045,2023-06-21 19:55:14.561490,0 days 00:00:05.106445,7.252713172460111e-05,gbtree,0.5985805774978974,0.0005638350795986305,depthwise,3.5311407000159474e-05,0.0429331924636727,3,4,0.9687768847795907,COMPLETE
461,461,0.26546230207732524,2023-06-21 19:55:14.562332,2023-06-21 19:55:16.845358,0 days 00:00:02.283026,0.0060394338026641785,gbtree,0.8595330408522543,9.50551110343198e-07,lossguide,1.3848355183418226e-06,0.08134109369945274,3,5,0.7010753286272537,COMPLETE
462,462,0.26037290929259427,2023-06-21 19:55:16.846264,2023-06-21 19:55:20.848878,0 days 00:00:04.002614,0.000518485894083172,gbtree,0.8715926040988935,2.081901499772392e-06,depthwise,0.697506582455315,0.0492524928074704,4,4,0.5249027751661414,COMPLETE
463,463,0.26235721914967414,2023-06-21 19:55:20.850719,2023-06-21 19:55:25.654988,0 days 00:00:04.804269,0.0003661644968515442,gbtree,0.6162204941044565,4.054810611521032e-07,lossguide,0.43135099608789107,0.03544864009582432,3,4,0.43829450248968566,COMPLETE
464,464,0.2664060224571105,2023-06-21 19:55:25.655857,2023-06-21 19:55:28.187966,0 days 00:00:02.532109,0.18290989895309934,gbtree,0.8348524591847795,2.239410689495039e-07,lossguide,1.92669290047387e-05,0.06244649212001803,3,4,0.46539377207073035,COMPLETE
465,465,0.2705673140435527,2023-06-21 19:55:28.188845,2023-06-21 19:55:31.915240,0 days 00:00:03.726395,0.00019048256026014748,gbtree,0.8172462785264344,1.571773389417666e-08,depthwise,0.015375866170602574,0.05393627394922198,3,3,0.7751448131123395,COMPLETE
466,466,0.26705859858183617,2023-06-21 19:55:31.919222,2023-06-21 19:55:34.362638,0 days 00:00:02.443416,5.982594011007162e-07,gbtree,0.8466312081886563,3.5619776950028774e-06,lossguide,0.004718380316731507,0.07292438999407691,3,9,0.6212942068320372,COMPLETE
467,467,0.259732732425673,2023-06-21 19:55:34.363482,2023-06-21 19:55:43.379951,0 days 00:00:09.016469,0.0008786486307323242,gbtree,0.6326631199122804,8.380988214315814e-07,depthwise,0.007894493319902912,0.012186890844572555,3,6,0.4541215228196333,COMPLETE
468,468,0.2600718009573229,2023-06-21 19:55:43.380929,2023-06-21 19:55:47.626575,0 days 00:00:04.245646,3.7532618754684804e-05,gbtree,0.6631404832475605,0.06872962412039231,lossguide,0.0006418945045449466,0.04134283394047473,6,4,0.4251077649383378,COMPLETE
469,469,0.2576521997069562,2023-06-21 19:55:47.627425,2023-06-21 19:55:58.425257,0 days 00:00:10.797832,0.0005971798568731448,gbtree,0.45578515798694524,0.0026772837404739607,depthwise,0.9979136413799002,0.010946888109886843,3,4,0.4712938000167436,COMPLETE
470,470,0.270067448227197,2023-06-21 19:55:58.426125,2023-06-21 19:56:03.872602,0 days 00:00:05.446477,0.00293606473848773,gbtree,0.6799333072500668,0.015743012297815596,lossguide,0.10098095697283886,0.030620359081522178,3,2,0.7487389307805832,COMPLETE
471,471,0.2718377738268377,2023-06-21 19:56:03.873456,2023-06-21 19:56:27.285787,0 days 00:00:23.412331,0.0002869873601761527,gbtree,0.8412019736982044,9.854207501510191e-08,depthwise,0.5914330155288694,0.002943841793952771,3,4,0.7193020182128215,COMPLETE
472,472,0.2592283100365889,2023-06-21 19:56:27.287544,2023-06-21 19:56:35.193423,0 days 00:00:07.905879,0.0016226282425577192,gbtree,0.784565780002629,0.0002486693025510997,lossguide,0.21020368985579133,0.016167414558849787,3,4,0.48021088084685315,COMPLETE
473,473,0.26224394827580383,2023-06-21 19:56:35.194288,2023-06-21 19:56:39.032907,0 days 00:00:03.838619,0.07861172769756695,gbtree,0.7638682116487854,2.7442224530547577e-06,depthwise,0.0478499153480457,0.0470856945892096,3,4,0.6083476495009543,COMPLETE
474,474,0.2646323227374549,2023-06-21 19:56:39.033767,2023-06-21 19:56:58.346486,0 days 00:00:19.312719,0.015829455345839155,gbtree,0.8736467149753238,1.4428914675091276e-08,lossguide,0.3513885453927702,0.004625266198381476,4,3,0.4436734512096102,COMPLETE
475,475,0.2641952893192219,2023-06-21 19:56:58.347267,2023-06-21 19:57:00.500751,0 days 00:00:02.153484,1.4001207588353936e-07,gbtree,0.7912965322306114,1.482669868109908e-06,lossguide,0.03710598663777352,0.08532578166165253,3,5,0.6800157931656323,COMPLETE
476,476,0.2595983690036431,2023-06-21 19:57:00.501591,2023-06-21 19:57:03.289837,0 days 00:00:02.788246,0.007698676492364723,gbtree,0.7798562815342336,4.533084112184583e-06,depthwise,0.001243839189448037,0.06321497567580019,8,4,0.46015125421126435,COMPLETE
477,477,0.27009390033337083,2023-06-21 19:57:03.290588,2023-06-21 19:57:24.745457,0 days 00:00:21.454869,1.0107867655110836e-05,gbtree,0.5005113866442359,8.851668858202814e-06,lossguide,0.06254314382331819,0.0025065275192223276,3,4,0.5885605437062345,COMPLETE
478,478,0.29674406477687176,2023-06-21 19:57:24.746321,2023-06-21 19:57:47.347397,0 days 00:00:22.601076,0.029874732339591408,gbtree,0.8272738690331434,6.42762271368098e-07,depthwise,0.6667257829833888,0.0014566900468702291,3,4,0.4927912493048219,COMPLETE
479,479,0.2604146458501981,2023-06-21 19:57:47.348394,2023-06-21 19:58:07.176600,0 days 00:00:19.828206,5.000766388603856e-05,gbtree,0.5859568429562746,2.4614876418741523e-05,lossguide,0.13744246497901486,0.003947593877352292,3,4,0.5039129269079423,COMPLETE
480,480,0.2592866003890596,2023-06-21 19:58:07.177502,2023-06-21 19:58:09.889821,0 days 00:00:02.712319,0.00012430415500257183,gbtree,0.649959897361086,1.0374084503512901e-06,depthwise,0.40778424039041344,0.0544770833714083,3,2,0.46954872878633175,COMPLETE
481,481,0.26627158023792385,2023-06-21 19:58:09.890665,2023-06-21 19:58:14.832757,0 days 00:00:04.942092,0.00040954691160988887,gbtree,0.6084619937712539,1.9543804529398547e-06,lossguide,0.020408790200962087,0.03747399413648576,3,4,0.7557886596623,COMPLETE
482,482,0.39594968580354467,2023-06-21 19:58:14.833626,2023-06-21 19:58:38.122103,0 days 00:00:23.288477,0.12245839650966713,gbtree,0.953801955179277,0.0013403336072358102,depthwise,0.0016782214640463891,0.00048721110134011374,3,4,0.44932097084970885,COMPLETE
483,483,0.2599645651586735,2023-06-21 19:58:38.122957,2023-06-21 19:58:43.973930,0 days 00:00:05.850973,0.2452619516821757,gbtree,0.5396435247037471,1.5652311483726238e-05,lossguide,0.7467870133575549,0.02594082583297111,3,3,0.41144703697256757,COMPLETE
484,484,0.25984029181710566,2023-06-21 19:58:43.974790,2023-06-21 19:58:46.238232,0 days 00:00:02.263442,7.753373524217497e-05,gbtree,0.6224890144816526,4.545618769284801e-07,lossguide,0.08602752279258966,0.07458070151672046,3,5,0.43548458108251376,COMPLETE
485,485,0.2626716130300884,2023-06-21 19:58:46.239097,2023-06-21 19:58:50.550494,0 days 00:00:04.311397,0.0008357435858801338,gbtree,0.6381809500195641,6.447640296172398e-06,depthwise,1.0790497585282492e-07,0.044114483828856646,3,6,0.7656882867833941,COMPLETE
486,486,0.27079622410965193,2023-06-21 19:58:50.551345,2023-06-21 19:58:53.051899,0 days 00:00:02.500554,0.0002145523194424133,gbtree,0.6660204243287744,7.41369550058382e-05,lossguide,0.0004032694454104076,0.0669700113223451,5,4,0.4776774720019152,COMPLETE
487,487,0.285150623501457,2023-06-21 19:58:53.052756,2023-06-21 19:59:19.199234,0 days 00:00:26.146478,0.8589474508988778,gbtree,0.9828302765369223,3.490912581104546e-07,depthwise,1.4298019687489326e-07,0.0018295155872626863,4,4,0.459363280246892,COMPLETE
488,488,0.26525076000518616,2023-06-21 19:59:19.199995,2023-06-21 19:59:33.298557,0 days 00:00:14.098562,0.0012169190702783126,gbtree,0.7194071052357933,0.38595075272061896,lossguide,0.2591981289660189,0.008418119922188876,3,4,0.7827308974384254,COMPLETE
489,489,0.27270595234719325,2023-06-21 19:59:33.299453,2023-06-21 19:59:54.774324,0 days 00:00:21.474871,5.586079648782329e-08,gbtree,0.6282659506770394,0.025102138555133,depthwise,0.20485623634634445,0.002576826777898245,3,3,0.4459455248343797,COMPLETE
490,490,0.2598371402064492,2023-06-21 19:59:54.775265,2023-06-21 19:59:59.645549,0 days 00:00:04.870284,2.8763048493378525e-05,gbtree,0.6494286913656823,0.06249799822072732,lossguide,0.000136326423214017,0.03228758659037912,3,4,0.48985205684420363,COMPLETE
491,491,0.268651080681746,2023-06-21 19:59:59.646394,2023-06-21 20:00:02.404106,0 days 00:00:02.757712,0.0005844862116794822,gbtree,0.5210212878400469,2.554841483470985e-06,depthwise,0.0032213996406607794,0.05739391524859625,3,2,0.8273061281541838,COMPLETE
492,492,0.25642813464717745,2023-06-21 20:00:02.404955,2023-06-21 20:00:04.190182,0 days 00:00:01.785227,0.00034803114005957966,gbtree,0.6076339369498824,0.00014852549833025908,lossguide,0.5160766223029893,0.08892537939943468,3,4,0.42739673766347586,COMPLETE
493,493,0.2559285330495685,2023-06-21 20:00:04.191020,2023-06-21 20:00:11.038786,0 days 00:00:06.847766,0.0001458758303324296,gbtree,0.7926574614311179,4.368326480786976e-06,lossguide,0.7710033955982454,0.022140539253133473,3,4,0.5549429035938414,COMPLETE
494,494,0.2503769701191559,2023-06-21 20:00:11.039559,2023-06-21 20:00:14.055458,0 days 00:00:03.015899,1.7814281281876703e-05,gbtree,0.7358973361243204,1.289455089584182e-06,depthwise,0.9861815147638625,0.04852037673141225,3,4,0.4623323000801181,COMPLETE
495,495,0.2552935064970821,2023-06-21 20:00:14.056361,2023-06-21 20:00:17.829688,0 days 00:00:03.773327,1.89525165466757e-05,gbtree,0.7346932196493104,5.97639981341547e-07,depthwise,0.9274768308519642,0.0508160220110404,9,4,0.45774400833588536,COMPLETE
496,496,0.257233947086126,2023-06-21 20:00:17.830460,2023-06-21 20:00:20.919621,0 days 00:00:03.089161,2.459265349003217e-05,gbtree,0.7038355414511828,1.1397591734207887e-06,depthwise,0.44932307638489943,0.06251414453017405,3,4,0.47632095554152915,COMPLETE
497,497,0.25791316282918614,2023-06-21 20:00:20.920555,2023-06-21 20:00:32.228365,0 days 00:00:11.307810,0.004350476068521681,gbtree,0.6996214599050612,7.632328132047482e-08,depthwise,0.5948978658740202,0.009728675649584049,3,4,0.44121585869610097,COMPLETE
498,498,0.2870138063142203,2023-06-21 20:00:32.229255,2023-06-21 20:00:55.298964,0 days 00:00:23.069709,1.292903524674316e-05,gbtree,0.6896258198698737,3.469473702746713e-05,depthwise,0.32281151226947863,0.0016652506943252191,3,4,0.5455962329270573,COMPLETE
499,499,0.4939712263814564,2023-06-21 20:00:55.299867,2023-06-21 20:01:18.680505,0 days 00:00:23.380638,1.9133035376593068e-05,gbtree,0.7162340857334711,1.4524075772885366e-06,depthwise,0.9701733609711113,0.00023815911018568436,3,4,0.5758176942592138,COMPLETE
500,500,0.2561791301683031,2023-06-21 20:01:18.681302,2023-06-21 20:01:22.507376,0 days 00:00:03.826074,4.6965630918910806e-05,gbtree,0.5664223081525228,1.1316289884037503e-05,depthwise,2.004840876936924e-06,0.045732752977527845,3,4,0.4638300623333949,COMPLETE
501,501,0.2668878269507439,2023-06-21 20:01:22.508331,2023-06-21 20:01:24.837528,0 days 00:00:02.329197,6.127386172717958e-06,gbtree,0.7468168469533448,5.213235352773487e-05,depthwise,0.6912328950299143,0.07337298592247182,3,8,0.4520008557992332,COMPLETE
502,502,0.25717790808708935,2023-06-21 20:01:24.838313,2023-06-21 20:01:27.891140,0 days 00:00:03.052827,0.009896607583682217,gbtree,0.5512864165838066,7.788246922537547e-07,depthwise,0.48483484774345914,0.05108335923610481,4,3,0.4722798530986424,COMPLETE
503,503,0.2634549218136811,2023-06-21 20:01:27.892003,2023-06-21 20:01:31.668339,0 days 00:00:03.776336,1.638935630984183e-05,gbtree,0.4852361056843992,2.1020844425058016e-07,depthwise,0.32740506391903373,0.05638751561724764,3,4,0.6934865617235743,COMPLETE
