,number,value,datetime_start,datetime_complete,duration,params_bagging_temperature,params_boosting_type,params_colsample_bylevel,params_depth,params_grow_policy,params_l2_leaf_reg,params_learning_rate,params_max_leaves,params_min_data_in_leaf,params_random_strength,params_subsample,state
173,173,0.2881164232883276,2023-06-13 12:02:17.073463,2023-06-13 12:02:26.143522,0 days 00:00:09.070059,19.40968669912977,,0.677329209597186,7,Depthwise,50.15923124764598,0.025831824417631807,,91,70.82900955904408,0.5603426530780438,COMPLETE
174,174,0.28464886148239876,2023-06-13 12:02:26.144286,2023-06-13 12:02:35.702646,0 days 00:00:09.558360,19.705861102339014,,0.6748159975582795,7,Depthwise,56.50258810627116,0.025953721984827392,,91,71.02768244071486,0.5598923810589296,COMPLETE
175,175,0.28575227762296823,2023-06-13 12:02:35.703470,2023-06-13 12:02:44.048871,0 days 00:00:08.345401,16.83621322545587,,0.6787627114730174,7,Depthwise,57.07457523695991,0.03112031754166963,,91,68.75598154288372,0.5603229813335245,COMPLETE
176,176,0.28609537535198337,2023-06-13 12:02:44.049598,2023-06-13 12:02:52.796137,0 days 00:00:08.746539,17.62102675149558,,0.6807767699198671,7,Depthwise,68.68176905096456,0.031368125354073455,,91,68.95353713103246,0.5645304723631497,COMPLETE
177,177,0.2870606390101068,2023-06-13 12:02:52.796873,2023-06-13 12:03:02.707277,0 days 00:00:09.910404,17.701274023418996,,0.6832865915436689,7,Depthwise,95.50141649359432,0.029927777134306464,,90,69.14216152549506,0.5686683822621201,COMPLETE
178,178,0.28825128196150623,2023-06-13 12:03:02.708021,2023-06-13 12:03:11.286989,0 days 00:00:08.578968,17.318448057923526,,0.6833463966560901,7,Depthwise,59.079313046705565,0.030108890820554936,,91,69.79498540950748,0.5675871951964092,COMPLETE
179,179,0.2860919096325363,2023-06-13 12:03:11.287690,2023-06-13 12:03:18.773035,0 days 00:00:07.485345,17.203321788693856,,0.6806005048170611,7,Depthwise,55.48951672283884,0.03460793145858675,,90,69.9444480137336,0.5623089701017585,COMPLETE
180,180,0.28703905956452724,2023-06-13 12:03:18.773729,2023-06-13 12:03:26.183216,0 days 00:00:07.409487,16.39231910142923,,0.6826546859803762,7,Depthwise,43.02304376172541,0.033664456673431015,,89,69.17556771776206,0.5675796701455551,COMPLETE
181,181,0.2891703275842904,2023-06-13 12:03:26.183931,2023-06-13 12:03:49.246166,0 days 00:00:23.062235,17.22932954778276,,0.6849414846429783,7,Depthwise,49.175078224685926,0.03433995772446256,,17,69.74036217189733,0.5626561809506283,COMPLETE
182,182,0.28699526823944776,2023-06-13 12:03:49.246916,2023-06-13 12:03:57.742902,0 days 00:00:08.495986,14.564612172042416,,0.6815100450585809,7,Depthwise,66.60554020152296,0.033599656744701986,,90,68.63013375625569,0.5788736480783702,COMPLETE
183,183,0.2849050365940758,2023-06-13 12:03:57.743668,2023-06-13 12:04:06.649392,0 days 00:00:08.905724,12.838063543893398,,0.7014559825012684,7,Depthwise,81.69134407343495,0.03333493376409429,,90,67.328478697864,0.586596656387057,COMPLETE
184,184,0.2794633374131808,2023-06-13 12:04:06.650123,2023-06-13 12:04:15.907553,0 days 00:00:09.257430,13.892134593801524,,0.6991359760215524,7,Depthwise,91.64547499402416,0.03389858662350838,,90,67.74415956358786,0.5877421865719481,COMPLETE
185,185,0.28615468161694013,2023-06-13 12:04:15.908266,2023-06-13 12:04:25.475373,0 days 00:00:09.567107,14.714100727629727,,0.6986276049748292,7,Depthwise,93.52921248541624,0.032176845233152146,,85,67.33520059581069,0.5880133202668691,COMPLETE
186,186,0.2874690553400145,2023-06-13 12:04:25.476108,2023-06-13 12:04:34.812909,0 days 00:00:09.336801,14.008847671191507,,0.695704838658377,7,Depthwise,95.3073440350465,0.03370534170217244,,90,67.45218338891196,0.5834455428727648,COMPLETE
187,187,0.28247915216006686,2023-06-13 12:04:34.813620,2023-06-13 12:04:44.040685,0 days 00:00:09.227065,13.43977533429272,,0.6974721073759419,7,Depthwise,99.72619733371504,0.03360145229468832,,85,68.28151983675623,0.5952067470801528,COMPLETE
188,188,0.2842657398869888,2023-06-13 12:04:44.041406,2023-06-13 12:04:52.156539,0 days 00:00:08.115133,14.967039639944165,,0.7012391238674709,7,Depthwise,69.15229082814054,0.03693948413357872,,84,67.61954027275799,0.5932100126175314,COMPLETE
189,189,0.28498330728022303,2023-06-13 12:04:52.157273,2023-06-13 12:05:00.219414,0 days 00:00:08.062141,14.104428111377626,,0.6975365244316105,7,Depthwise,74.27972636248802,0.036852073608283464,,85,67.11476220993474,0.5967930268833792,COMPLETE
190,190,0.27980464166933483,2023-06-13 12:05:00.220153,2023-06-13 12:05:08.074897,0 days 00:00:07.854744,13.920913002106237,,0.7047019121311295,7,Depthwise,75.16393296728754,0.03866529881310207,,85,67.263573783295,0.5977380650397308,COMPLETE
191,191,0.2830319563894947,2023-06-13 12:05:08.075597,2023-06-13 12:05:16.581320,0 days 00:00:08.505723,14.539001654991093,,0.7042831254077125,7,Depthwise,96.57745253248075,0.03918312938042909,,81,67.67070089091159,0.5955826816693196,COMPLETE
192,192,0.28097810083816144,2023-06-13 12:05:16.582034,2023-06-13 12:05:24.857618,0 days 00:00:08.275584,14.173175222652699,,0.6998606084756637,7,Depthwise,70.38126070319873,0.03861464652434952,,81,66.44645573620393,0.5979977523481343,COMPLETE
193,193,0.28570454107362864,2023-06-13 12:05:24.858332,2023-06-13 12:05:33.108469,0 days 00:00:08.250137,13.261390107655025,,0.7061828481438558,7,Depthwise,72.85484310735686,0.03764646966449671,,81,65.37758573588485,0.5987292774150467,COMPLETE
194,194,0.2869470294853065,2023-06-13 12:05:33.109169,2023-06-13 12:05:41.111826,0 days 00:00:08.002657,12.128927976326706,,0.7058123068021565,7,Depthwise,73.49682198479152,0.039517344207490084,,82,65.94753461828658,0.5966503814739955,COMPLETE
195,195,0.2806974229268403,2023-06-13 12:05:41.112566,2023-06-13 12:05:48.856834,0 days 00:00:07.744268,12.10000591064382,,0.7071471961323225,7,Depthwise,80.31810556353022,0.039286891128843315,,81,65.11695644023865,0.601261087699689,COMPLETE
196,196,0.2819533143682411,2023-06-13 12:05:48.857580,2023-06-13 12:05:57.621223,0 days 00:00:08.763643,11.172956810513925,,0.7118380415708051,7,Depthwise,75.74288865155182,0.038696121275046916,,79,63.20491945372416,0.6007526569914506,COMPLETE
197,197,0.28319425897150435,2023-06-13 12:05:57.621932,2023-06-13 12:06:06.401876,0 days 00:00:08.779944,10.639745215123076,,0.7120473536330749,7,Depthwise,85.47942851107696,0.038968742503098106,,78,64.16995702108449,0.6012221211281662,COMPLETE
198,198,0.2815674288228022,2023-06-13 12:06:06.402574,2023-06-13 12:06:14.795633,0 days 00:00:08.393059,9.859494184010344,,0.7136156152727584,7,Depthwise,93.09431745980157,0.039836698080533944,,79,64.35333473814443,0.6034933771085242,COMPLETE
199,199,0.2818146387037212,2023-06-13 12:06:14.796335,2023-06-13 12:06:22.710662,0 days 00:00:07.914327,10.860783675583974,,0.7149247617579866,7,Depthwise,74.01122759542572,0.04101142461031796,,79,64.09654640551473,0.6032221390107522,COMPLETE
200,200,0.28320066741963307,2023-06-13 12:06:22.711410,2023-06-13 12:06:30.810116,0 days 00:00:08.098706,10.343115616361242,,0.7119644023399708,7,Depthwise,93.29638546591981,0.0427544487934459,,78,64.08744848293746,0.6089462668942013,COMPLETE
201,201,0.281238552055551,2023-06-13 12:06:30.810895,2023-06-13 12:06:39.624941,0 days 00:00:08.814046,10.189917543515822,,0.7141526567638294,7,Depthwise,99.9747154831126,0.04240603765931544,,78,64.08730925819678,0.607183905687586,COMPLETE
202,202,0.28533278984179933,2023-06-13 12:06:39.625683,2023-06-13 12:06:47.898151,0 days 00:00:08.272468,10.934921107094034,,0.7201768825968101,7,Depthwise,96.21038584187225,0.04137849863283552,,78,63.54572983426484,0.6120997549816884,COMPLETE
203,203,0.2828666109998999,2023-06-13 12:06:47.898894,2023-06-13 12:06:56.117862,0 days 00:00:08.218968,10.08637756167384,,0.7164760140369387,7,Depthwise,97.69425741860132,0.044003303912814484,,78,63.75708794623084,0.6111365177287006,COMPLETE
204,204,0.27898591819020313,2023-06-13 12:06:56.118644,2023-06-13 12:07:04.847232,0 days 00:00:08.728588,10.38392588862136,,0.7183467030632233,7,Depthwise,96.27278531390782,0.04202968906136457,,78,63.84672394872903,0.6162449617759023,COMPLETE
205,205,0.2838889560153715,2023-06-13 12:07:04.848025,2023-06-13 12:07:12.911507,0 days 00:00:08.063482,10.72414248275645,,0.714006734942307,7,Depthwise,92.52183750476877,0.044269896897787195,,78,63.6086801118433,0.6160834411881014,COMPLETE
206,206,0.2826524273498451,2023-06-13 12:07:12.912290,2023-06-13 12:07:20.713217,0 days 00:00:07.800927,10.052581423215312,,0.7179323304808929,7,Depthwise,92.0799203633206,0.04519150891819448,,78,62.926554290111305,0.6121635828885633,COMPLETE
207,207,0.2935112764706712,2023-06-13 12:07:20.714020,2023-06-13 12:11:10.542088,0 days 00:03:49.828068,10.471718372750724,Ordered,0.7258950057231222,7,SymmetricTree,88.7099931906376,0.045804535815041694,,78,63.121092789574924,0.6224412151291641,COMPLETE
208,208,0.28051308052455476,2023-06-13 12:11:10.542821,2023-06-13 12:11:18.565711,0 days 00:00:08.022890,9.549637738640886,,0.724952417473683,7,Depthwise,90.52107858712151,0.045345049310828625,,79,63.6835679334866,0.6144097714388729,COMPLETE
209,209,0.28130367646857996,2023-06-13 12:11:18.566455,2023-06-13 12:11:26.008954,0 days 00:00:07.442499,9.020629802619073,,0.7283522399536024,7,Depthwise,90.37870773215339,0.04671100862713979,,76,61.944735239865096,0.6184931735187369,COMPLETE
210,210,0.27906836573005106,2023-06-13 12:11:26.009737,2023-06-13 12:11:33.877607,0 days 00:00:07.867870,7.356501251255182,,0.7273719108997491,7,Depthwise,98.46597467885545,0.04554840755028104,,80,61.73743759347432,0.6259931974402047,COMPLETE
211,211,0.2827456257541094,2023-06-13 12:11:33.878382,2023-06-13 12:11:41.891639,0 days 00:00:08.013257,8.780690639413269,,0.724174610620501,7,Depthwise,98.98755060869462,0.04785636767101785,,80,61.34645673092478,0.6241885826437605,COMPLETE
212,212,0.28138874402153935,2023-06-13 12:11:41.892387,2023-06-13 12:11:49.576883,0 days 00:00:07.684496,8.6786729445828,,0.7293802607533546,7,Depthwise,95.34934213647422,0.0471673809470706,,80,60.72666515944273,0.6267005018457609,COMPLETE
213,213,0.28016024849569593,2023-06-13 12:11:49.577580,2023-06-13 12:11:57.265343,0 days 00:00:07.687763,8.897118255361985,,0.7293947043020313,7,Depthwise,97.26870298572538,0.049750972825752235,,80,61.39989257635258,0.6287058995991466,COMPLETE
214,214,0.2821790690292321,2023-06-13 12:11:57.266061,2023-06-13 12:12:05.353941,0 days 00:00:08.087880,7.736744074262432,,0.7301674385936212,7,Depthwise,98.18712840143957,0.047323953465626685,,79,60.90909791035,0.6254987213496574,COMPLETE
215,215,0.2889870852929739,2023-06-13 12:12:05.354644,2023-06-13 12:12:11.732614,0 days 00:00:06.377970,7.826799365373523,,0.73421635220666,7,Depthwise,35.84770632418497,0.048605876255099136,,80,60.76508422334569,0.6258613744715735,COMPLETE
216,216,0.2827642101914044,2023-06-13 12:12:11.733310,2023-06-13 12:12:19.370766,0 days 00:00:07.637456,8.070153207972552,,0.7388514115061483,6,Depthwise,94.26972689007395,0.05266224392131825,,76,60.94502480903021,0.6361844396219132,COMPLETE
217,217,0.28192963244563746,2023-06-13 12:12:19.371503,2023-06-13 12:12:26.551746,0 days 00:00:07.180243,7.856296909623378,,0.7382658530613135,6,Depthwise,96.75115266770426,0.051986919379723225,,76,61.28589880889699,0.6298076300816665,COMPLETE
218,218,0.2804298928122607,2023-06-13 12:12:26.552518,2023-06-13 12:12:32.712663,0 days 00:00:06.160145,6.911582565544873,,0.7399839360639534,6,Depthwise,40.59623380472333,0.050292023637372535,,75,60.824196738972134,0.6355391368179182,COMPLETE
219,219,0.28081379587239585,2023-06-13 12:12:32.713396,2023-06-13 12:12:39.047223,0 days 00:00:06.333827,7.64331744640166,,0.7376643480419376,7,Depthwise,39.520528646569325,0.05159834620060107,,75,61.28609865113049,0.6304987383533611,COMPLETE
220,220,0.2853235138072781,2023-06-13 12:12:39.047955,2023-06-13 12:12:44.779752,0 days 00:00:05.731797,6.336404997914036,,0.7414268688514095,6,Depthwise,34.059334427218886,0.05154033729692104,,75,60.80073560046634,0.6374620528307686,COMPLETE
221,221,0.2827137342804081,2023-06-13 12:12:44.780459,2023-06-13 12:12:50.465463,0 days 00:00:05.685004,8.219525378277574,,0.7381597895070767,6,Depthwise,36.283797916646584,0.05349149331472378,,75,59.10515806027102,0.6371536121285719,COMPLETE
222,222,0.28516701852132353,2023-06-13 12:12:50.466163,2023-06-13 12:12:56.593702,0 days 00:00:06.127539,8.147012782477988,,0.7405656820342585,7,Depthwise,34.44862978740263,0.053717746174804015,,76,59.12944647885915,0.6412788546841883,COMPLETE
223,223,0.28719104981693244,2023-06-13 12:12:56.594449,2023-06-13 12:13:02.242293,0 days 00:00:05.647844,3.7960267467773168,,0.7532096778369859,6,Depthwise,55.19167744547819,0.056701369535843794,,76,59.372081244123066,0.6253333546196409,COMPLETE
224,224,0.2834471717605572,2023-06-13 12:13:02.243072,2023-06-13 12:13:07.692995,0 days 00:00:05.449923,8.024289941718752,,0.7481730997216038,6,Depthwise,35.88441817404132,0.05809126186949859,,80,61.671918134580395,0.655292905483422,COMPLETE
225,225,0.2805854297751329,2023-06-13 12:13:07.693794,2023-06-13 12:13:13.972750,0 days 00:00:06.278956,4.794423750105299,,0.7326514868620261,6,Depthwise,57.48852091155905,0.04934405799498539,,80,57.529047274208054,0.6338356546719933,COMPLETE
226,226,0.28263875139025907,2023-06-13 12:13:13.973479,2023-06-13 12:13:20.240563,0 days 00:00:06.267084,4.423639504452684,,0.7287074015136745,6,Depthwise,56.569804085147496,0.04822146529060196,,80,58.552572867449186,0.6513904604422321,COMPLETE
227,227,0.2829653142855032,2023-06-13 12:13:20.241299,2023-06-13 12:13:25.653450,0 days 00:00:05.412151,5.407555758429419,,0.7612285725134852,6,Depthwise,51.022617418478525,0.06075778439658796,,82,58.527956694947804,0.6548611473762924,COMPLETE
228,228,0.2825859467850453,2023-06-13 12:13:25.654154,2023-06-13 12:13:31.761663,0 days 00:00:06.107509,3.567834326814328,,0.7301058319364836,6,Depthwise,33.36604065106232,0.048405878483903375,,74,57.01217874191762,0.6110697013787078,COMPLETE
229,229,0.2835005100062762,2023-06-13 12:13:31.762381,2023-06-13 12:13:37.960791,0 days 00:00:06.198410,4.297650158312373,,0.7303883221245457,6,Depthwise,56.11718613807596,0.04654362673270804,,80,57.97494021053774,0.612762301597453,COMPLETE
230,230,0.2862670870506745,2023-06-13 12:13:37.961530,2023-06-13 12:13:42.910410,0 days 00:00:04.948880,2.5313534075578907,,0.7598648425389246,6,Depthwise,34.152567746679104,0.06467992038858086,,77,56.59174536440207,0.6056974994572267,COMPLETE
231,231,0.2818752811333732,2023-06-13 12:13:42.911221,2023-06-13 12:13:48.704689,0 days 00:00:05.793468,6.415215229597663,,0.7307344037358885,6,Depthwise,36.260889656925556,0.049650472160162815,,73,56.33117063672245,0.6316604391241231,COMPLETE
232,232,0.2841491669719423,2023-06-13 12:13:48.705493,2023-06-13 12:13:55.496608,0 days 00:00:06.791115,5.960779782666575,,0.7259074243980226,6,Depthwise,57.339087381571524,0.04838792584683056,,73,55.867986162712235,0.6262060226641569,COMPLETE
233,233,0.30584040704901505,2023-06-13 12:13:55.497441,2023-06-13 12:14:00.943842,0 days 00:00:05.446401,6.4823236776931275,,0.7211521712993407,6,Depthwise,0.06248038877232583,0.041953986807006925,,82,62.4646750383878,0.6497436206203141,COMPLETE
234,234,0.2809277643739533,2023-06-13 12:14:00.944820,2023-06-13 12:14:07.686483,0 days 00:00:06.741663,3.325100656328482,,0.7540234840876527,6,Depthwise,56.475995275745,0.048535127068434714,,74,65.89685797388036,0.6162205564413004,COMPLETE
235,235,0.2837070557831844,2023-06-13 12:14:07.687325,2023-06-13 12:14:13.747988,0 days 00:00:06.060663,2.780686168190893,,0.7515432979567849,6,Depthwise,33.82591908044231,0.05026711740498747,,74,65.65408121300354,0.6248202109286848,COMPLETE
236,236,0.2848725137854873,2023-06-13 12:14:13.748791,2023-06-13 12:14:21.225470,0 days 00:00:07.476679,0.42756991070802286,,0.7322369057974196,6,Depthwise,58.959968943691315,0.042108929914250054,,80,65.38318189089807,0.6377304287898131,COMPLETE
237,237,0.286644779192971,2023-06-13 12:14:21.226268,2023-06-13 12:14:26.474051,0 days 00:00:05.247783,5.37090756227378,,0.762265517331832,6,Depthwise,55.6021721438871,0.0655153438231041,,83,61.45021480029184,0.6622218450978972,COMPLETE
238,238,0.28328898363657024,2023-06-13 12:14:26.474865,2023-06-13 12:14:32.469326,0 days 00:00:05.994461,6.493872671544784,,0.7707649447054471,6,Depthwise,31.416937443574742,0.05007037572902589,,74,56.832409384227965,0.6065273934700887,COMPLETE
239,239,0.2872324406485818,2023-06-13 12:14:32.470064,2023-06-13 12:14:38.325720,0 days 00:00:05.855656,3.817639027068961,,0.7312242971838385,6,Depthwise,56.4917076268631,0.05802965257821432,,76,65.32890697606065,0.6215875869613682,COMPLETE
240,240,0.2810040980789689,2023-06-13 12:14:38.326495,2023-06-13 12:14:45.092620,0 days 00:00:06.766125,1.832090826313845,,0.7427988680260235,6,Depthwise,39.46386861716402,0.04078154423756766,,79,61.926595125413854,0.5825447566133699,COMPLETE
241,241,0.28008837728012487,2023-06-13 12:14:45.093328,2023-06-13 12:14:52.212527,0 days 00:00:07.119199,1.2271389989601662,,0.738764076667172,6,Depthwise,57.55097489464349,0.04104611808451544,,79,61.96324922324194,0.6028487125182941,COMPLETE
242,242,0.2861528096861112,2023-06-13 12:14:52.213315,2023-06-13 12:14:58.856151,0 days 00:00:06.642836,1.5874941091182149,,0.745191371225274,6,Depthwise,31.841817191963077,0.03931220581740165,,77,62.45248915132085,0.5816715260435585,COMPLETE
243,243,0.27870920837842145,2023-06-13 12:14:58.856896,2023-06-13 12:15:06.201850,0 days 00:00:07.344954,12.316560556986794,,0.7466017082263611,6,Depthwise,62.880725898046386,0.04144731979709192,,79,64.88072485909456,0.6032422013108345,COMPLETE
244,244,0.2828173326088178,2023-06-13 12:15:06.202670,2023-06-13 12:15:13.312195,0 days 00:00:07.109525,12.132508260852646,,0.7703731996510859,6,Depthwise,65.69740502802705,0.04278099661262723,,79,64.57452905427084,0.5935635103208297,COMPLETE
245,245,0.2833291401845041,2023-06-13 12:15:13.312973,2023-06-13 12:15:21.198206,0 days 00:00:07.885233,9.128811337944938,,0.7485316072660841,6,Depthwise,64.81687545940567,0.03779098967400279,,82,60.42168445501069,0.5994938665634749,COMPLETE
246,246,0.2822227221269602,2023-06-13 12:15:21.198964,2023-06-13 12:15:29.889966,0 days 00:00:08.691002,0.222556783473975,,0.7156178597967756,7,Depthwise,98.35711132254788,0.042456459502874945,,79,62.45695309196925,0.6315875962928494,COMPLETE
247,247,0.2989332216994439,2023-06-13 12:15:29.890711,2023-06-13 12:18:47.892291,0 days 00:03:18.001580,0.32389732743935085,Ordered,0.7150724356084166,7,SymmetricTree,54.575587472858324,0.042769293502070406,,79,62.24298290576694,0.6301775051807721,COMPLETE
248,248,0.28378520710747474,2023-06-13 12:18:47.893035,2023-06-13 12:18:55.275236,0 days 00:00:07.382201,6.902389324868742,,0.7367053908509695,6,Depthwise,99.70193041212198,0.05521473992675087,,77,64.7576661398192,0.6204535350833195,COMPLETE
249,249,0.27936478089468453,2023-06-13 12:18:55.276020,2023-06-13 12:19:02.854143,0 days 00:00:07.578123,12.1098361421091,,0.7170916995272172,7,Depthwise,42.82731762224558,0.03925714627688878,,82,62.8177168969804,0.6382108959021796,COMPLETE
250,250,0.28053272912053484,2023-06-13 12:19:02.854992,2023-06-13 12:19:10.559850,0 days 00:00:07.704858,9.055542762999309,,0.7493311617563805,7,Depthwise,30.165341929897885,0.037610464504582275,,82,60.47633586691672,0.6458790473284304,COMPLETE
251,251,0.28367475896774386,2023-06-13 12:19:10.560609,2023-06-13 12:19:17.597134,0 days 00:00:07.036525,11.090959112326674,,0.7504797088614346,6,Depthwise,36.47199162349376,0.038017472362791946,,82,65.55860523491445,0.6396848828335673,COMPLETE
252,252,0.2903366253504253,2023-06-13 12:19:17.597939,2023-06-13 12:19:24.401158,0 days 00:00:06.803219,11.974847528066002,,0.7678416742573635,7,Depthwise,25.672195799820614,0.03747234887370688,,82,63.575624763978134,0.584635029347651,COMPLETE
253,253,0.2865657297192365,2023-06-13 12:19:24.402012,2023-06-13 12:19:32.029990,0 days 00:00:07.627978,9.240973421061687,,0.7813616700651033,7,Depthwise,50.91890814311778,0.04067783768848468,,84,59.562456170777,0.6632697319681655,COMPLETE
254,254,0.28759107446249593,2023-06-13 12:19:32.030778,2023-06-13 12:19:38.181864,0 days 00:00:06.151086,12.06183485807752,,0.7120180073126449,6,Depthwise,36.27533378588546,0.045460277230537006,,81,65.76525059005844,0.6118801245905072,COMPLETE
255,255,0.2830017881094814,2023-06-13 12:19:38.182692,2023-06-13 12:19:43.353700,0 days 00:00:05.171008,9.218725137832328,,0.7414963502874716,7,Depthwise,18.39237048265401,0.06301134308613277,,76,62.44692342265569,0.6430190245369057,COMPLETE
256,256,0.285916380201979,2023-06-13 12:19:43.354481,2023-06-13 12:19:49.077828,0 days 00:00:05.723347,6.386427312995484,,0.7193345972589835,7,Depthwise,43.3363661104498,0.055818759835248366,,80,55.53674732536003,0.6104051063814336,COMPLETE
257,257,0.3308707542997311,2023-06-13 12:19:49.078669,2023-06-13 12:19:54.332115,0 days 00:00:05.253446,5.532256769137291,,0.7511206999917274,7,Depthwise,0.002137865943813268,0.04124129136241841,,77,60.029339999590874,0.5801717093798523,COMPLETE
258,258,0.28106442225984796,2023-06-13 12:19:54.332922,2023-06-13 12:20:01.208152,0 days 00:00:06.875230,12.020368811111975,,0.70364332568209,6,Depthwise,61.8615961503507,0.05088437976876895,,71,64.15860967553917,0.6702967657465222,COMPLETE
259,259,0.29558169473861595,2023-06-13 12:20:01.208971,2023-06-13 12:20:06.248793,0 days 00:00:05.039822,9.112583127027543,,0.7018102730710044,6,Depthwise,0.9877786580602682,0.053508114552422756,,72,66.23517742122557,0.6668013038562093,COMPLETE
260,260,0.2856865369002529,2023-06-13 12:20:06.249634,2023-06-13 12:20:11.893921,0 days 00:00:05.644287,2.3173063619398495,,0.7394884600375663,6,Depthwise,24.674401476885162,0.05011372858932451,,83,54.51677212473119,0.6433445988100405,COMPLETE
261,261,0.2842793387261972,2023-06-13 12:20:11.894725,2023-06-13 12:20:19.057406,0 days 00:00:07.162681,12.77445517531282,,0.7819043408321694,6,Depthwise,41.06804120861062,0.045471747407719934,,71,60.284527038117126,0.6773021867304596,COMPLETE
