,number,value,datetime_start,datetime_complete,duration,params_alpha,params_booster,params_colsample_bytree,params_gamma,params_grow_policy,params_lambda,params_learning_rate,params_max_depth,params_min_child_weight,params_subsample,state
336,336,0.2625457371060506,2023-06-21 19:38:53.597619,2023-06-21 19:38:56.306249,0 days 00:00:02.708630,0.00014761133316863105,gbtree,0.8435015941610691,4.048878717312571e-06,depthwise,0.00047653364408875234,0.056128389992072605,3,3,0.4605162246729525,COMPLETE
337,337,0.271361786218921,2023-06-21 19:38:56.307040,2023-06-21 19:39:05.258214,0 days 00:00:08.951174,0.004310550512139257,gbtree,0.9939488045664728,1.776203161426298e-06,lossguide,0.3152562162893727,0.016706018654894485,3,4,0.8086245841490097,COMPLETE
338,338,0.2605572478209521,2023-06-21 19:39:05.259014,2023-06-21 19:39:08.836335,0 days 00:00:03.577321,7.095887149385268e-05,gbtree,0.5977231725811462,2.617730845009181e-06,depthwise,0.05680360027234743,0.04464084474897027,3,6,0.4304356945644927,COMPLETE
339,339,0.27266777323481844,2023-06-21 19:39:08.837060,2023-06-21 19:39:11.066507,0 days 00:00:02.229447,0.00017510820671561817,gbtree,0.6529266323302273,0.0005433630541895445,lossguide,0.024170048244603122,0.09287119689978955,4,4,0.4490356802657208,COMPLETE
340,340,0.2636634472673796,2023-06-21 19:39:11.067391,2023-06-21 19:39:13.888389,0 days 00:00:02.820998,0.438919361905162,gbtree,0.7936780043247869,9.848668623586388e-07,lossguide,0.45895930054425343,0.06257516273928217,3,4,0.4834019542866867,COMPLETE
341,341,0.25806387878728926,2023-06-21 19:39:13.889217,2023-06-21 19:39:18.000381,0 days 00:00:04.111164,2.8765543503220802e-05,gbtree,0.6688016629269621,3.176254489203202e-07,depthwise,0.008746721005761285,0.03538295780779002,3,5,0.46241097175842977,COMPLETE
342,342,0.2616353568996525,2023-06-21 19:39:18.001201,2023-06-21 19:39:19.946969,0 days 00:00:01.945768,0.006123180853574425,gbtree,0.5587997197453352,0.00021986648803890498,lossguide,0.035959227411316914,0.0798309944900209,3,4,0.4388760797676629,COMPLETE
343,343,0.25950870504061835,2023-06-21 19:39:19.947772,2023-06-21 19:39:23.822358,0 days 00:00:03.874586,9.78388369269069e-05,gbtree,0.6317315619533748,1.7947686827281206e-05,lossguide,2.9676795164516653e-06,0.049674032698568744,9,4,0.4675734682520684,COMPLETE
344,344,0.2573364776877713,2023-06-21 19:39:23.823163,2023-06-21 19:39:28.059342,0 days 00:00:04.236179,0.0018195866795937161,gbtree,0.6085223357539058,7.01532922253927e-07,depthwise,0.014163707597804396,0.04163972057680555,3,4,0.4556016281282631,COMPLETE
345,345,0.26234398706501305,2023-06-21 19:39:28.061547,2023-06-21 19:39:30.536720,0 days 00:00:02.475173,0.0011059817073923043,gbtree,0.9280415456378499,1.4780319517884492e-06,lossguide,0.5668874146847225,0.07037481759165205,3,3,0.5127549534837941,COMPLETE
346,346,0.2556853224455657,2023-06-21 19:39:30.537525,2023-06-21 19:39:36.426002,0 days 00:00:05.888477,0.002696491147124251,gbtree,0.9009610221887284,1.0455370331638843e-05,depthwise,0.07302465125180238,0.022611418456213492,3,4,0.484230718944832,COMPLETE
347,347,0.26473693058438247,2023-06-21 19:39:36.426831,2023-06-21 19:39:39.273069,0 days 00:00:02.846238,0.0006848855672761563,gbtree,0.8448599450039798,4.6474165396997455e-06,lossguide,0.2901352380235419,0.05513689011585965,3,2,0.5863643096144523,COMPLETE
348,348,0.25859638322257555,2023-06-21 19:39:39.273879,2023-06-21 19:39:44.531764,0 days 00:00:05.257885,0.02531660561072123,gbtree,0.6424087305823529,4.437313231201587e-07,lossguide,0.7003748602918347,0.02904504874179899,3,5,0.5437455054506956,COMPLETE
349,349,0.2602509859407914,2023-06-21 19:39:44.532574,2023-06-21 19:39:49.005770,0 days 00:00:04.473196,0.00034382880719519975,gbtree,0.6234105743922953,2.1921577789499813e-07,depthwise,0.04742852927019959,0.03837599052566173,5,4,0.44553134024178903,COMPLETE
350,350,0.26308256904980826,2023-06-21 19:39:49.006608,2023-06-21 19:39:52.204064,0 days 00:00:03.197456,0.00021039548913232676,gbtree,0.6588157599720407,1.2097526433013486e-07,lossguide,0.9858400567926032,0.06182711709094795,3,4,0.6510455466853275,COMPLETE
351,351,0.3849839614006873,2023-06-21 19:39:52.204879,2023-06-21 19:40:14.590392,0 days 00:00:22.385513,0.0008201543643923945,gbtree,0.8735401055774846,2.3641540046917614e-06,lossguide,0.1876795742691388,0.0005569983655399158,3,5,0.40974825648206037,COMPLETE
352,352,0.2573000033128236,2023-06-21 19:40:14.591135,2023-06-21 19:40:19.551711,0 days 00:00:04.960576,0.0004115340408883045,gbtree,0.5959948950946017,2.5855691015560127e-05,depthwise,0.10959027530413927,0.03404481461745058,3,4,0.42931513245262976,COMPLETE
353,353,0.2712735704752855,2023-06-21 19:40:19.552521,2023-06-21 19:40:43.732707,0 days 00:00:24.180186,0.0002502950200878994,gbtree,0.5811949809831359,1.0920752002398708e-06,lossguide,0.01924652045191537,0.002566313833476036,4,3,0.47202925428725334,COMPLETE
354,354,0.5766589026927083,2023-06-21 19:40:43.733548,2023-06-21 19:41:15.916500,0 days 00:00:32.182952,0.009636749057212401,gbtree,0.6131175424653478,6.456811937680792e-07,depthwise,0.0035409832882111656,0.00010332834689648948,6,4,0.5598097125083308,COMPLETE
355,355,0.2637871252479879,2023-06-21 19:41:15.917367,2023-06-21 19:41:20.111863,0 days 00:00:04.194496,0.00013848663801644157,gbtree,0.9167413151761119,0.00013841090876943717,lossguide,0.5068087976197732,0.045633046745835015,3,4,0.6305645557382766,COMPLETE
356,356,0.43156070518486517,2023-06-21 19:41:20.113786,2023-06-21 19:41:43.554297,0 days 00:00:23.440511,0.0006160396376832679,gbtree,0.647461249066763,1.6722476924216264e-06,lossguide,0.34751448219941167,0.0003771456910241299,3,6,0.8337374623755891,COMPLETE
357,357,0.279922920644611,2023-06-21 19:41:43.555245,2023-06-21 19:41:45.741408,0 days 00:00:02.186163,0.0012412953989996286,gbtree,0.5689547422016112,4.1808151150592256e-05,depthwise,0.07152644146534073,0.07435178138326988,8,2,0.4966520877980891,COMPLETE
358,358,0.25223809928521185,2023-06-21 19:41:45.742241,2023-06-21 19:41:48.590638,0 days 00:00:02.848397,8.467785474824071e-05,gbtree,0.6319356387097392,6.235153158108282e-06,lossguide,0.6913684323628776,0.05339427149466943,3,4,0.4543411882855585,COMPLETE
359,359,0.2667635079701047,2023-06-21 19:41:48.591454,2023-06-21 19:41:52.166058,0 days 00:00:03.574604,6.257823422278907e-05,gbtree,0.6327916707851784,7.68758295566483e-06,lossguide,3.093208167571735e-05,0.0527586566270859,3,4,0.634833696195172,COMPLETE
360,360,0.2652760748079799,2023-06-21 19:41:52.166896,2023-06-21 19:41:54.924599,0 days 00:00:02.757703,8.147860779111001e-05,gbtree,0.6255265340166203,5.708282070125642e-06,depthwise,0.7219973855146182,0.0622605009407062,10,4,0.461109073967726,COMPLETE
361,361,0.3218928778194236,2023-06-21 19:41:54.925421,2023-06-21 19:42:17.536062,0 days 00:00:22.610641,0.00010182655150625802,gbtree,0.6421244681397354,3.443966613940953e-06,lossguide,0.0018867178999061338,0.0009790536263402756,3,4,0.6045271124185094,COMPLETE
362,362,0.2582344405788311,2023-06-21 19:42:17.536818,2023-06-21 19:42:20.005368,0 days 00:00:02.468550,4.634792085967307e-05,gbtree,0.6699017031386164,1.2548676747984875e-05,lossguide,0.5296603345032063,0.08725492273878854,3,4,0.9795264488900475,COMPLETE
363,363,0.25746836781848886,2023-06-21 19:42:20.006097,2023-06-21 19:42:22.901255,0 days 00:00:02.895158,1.3159692126787898e-08,gbtree,0.6202751233733751,4.826690948468946e-06,depthwise,0.24410004840382282,0.049593658107543036,3,4,0.4749543772813399,COMPLETE
364,364,0.2580383050279395,2023-06-21 19:42:22.902080,2023-06-21 19:42:25.420042,0 days 00:00:02.517962,2.4443833711022483e-05,gbtree,0.6539543658478428,2.8715366125512603e-06,lossguide,0.9894874172994093,0.07217009310203865,3,4,0.4402131506737933,COMPLETE
365,365,0.2622802865483961,2023-06-21 19:42:25.420765,2023-06-21 19:42:34.385978,0 days 00:00:08.965213,0.00015679652825568746,gbtree,0.6953885275194265,9.711264609207523e-06,lossguide,0.41247757489879355,0.014199158423701055,3,4,0.6845901274237627,COMPLETE
366,366,0.26114453983093755,2023-06-21 19:42:34.386813,2023-06-21 19:42:37.895312,0 days 00:00:03.508499,0.00023386033545989647,gbtree,0.7130956691319661,3.883342740887617e-06,depthwise,0.6829313603374757,0.05735052010655126,4,4,0.6618938425221603,COMPLETE
367,367,0.2570344548579892,2023-06-21 19:42:37.896210,2023-06-21 19:42:41.903185,0 days 00:00:04.006975,0.0004116911344358999,gbtree,0.6338477980000319,7.761588338826924e-06,lossguide,0.13581654952019476,0.04487003187644583,3,3,0.45370916717117954,COMPLETE
368,368,0.2689648920391358,2023-06-21 19:42:41.904007,2023-06-21 19:42:43.807957,0 days 00:00:01.903950,0.00012138487344681776,gbtree,0.9061048282167817,1.7372601217087657e-08,depthwise,0.5756470455453722,0.0986912480330008,3,4,0.6181700403292233,COMPLETE
369,369,0.266603162365426,2023-06-21 19:42:43.808769,2023-06-21 19:42:46.424086,0 days 00:00:02.615317,3.880792243021889e-05,gbtree,0.46595519529483004,2.3085313522432973e-06,lossguide,0.36298909382131106,0.06430375137279042,3,4,0.8711429679273259,COMPLETE
370,370,0.26453894958473184,2023-06-21 19:42:46.424911,2023-06-21 19:42:50.532751,0 days 00:00:04.107840,8.674745372201927e-05,gbtree,0.9754318665669719,1.334631626412884e-06,lossguide,0.7713749915001941,0.05324468559992481,3,2,0.48842040691152644,COMPLETE
371,371,0.26298835685032906,2023-06-21 19:42:50.533584,2023-06-21 19:42:54.415005,0 days 00:00:03.881421,0.00027828543836254995,gbtree,0.7551576277414526,8.786683871043432e-05,depthwise,5.072643270885897e-05,0.04076705608838107,3,3,0.40099147320565,COMPLETE
372,372,0.2628431183099416,2023-06-21 19:42:54.415816,2023-06-21 19:42:56.846105,0 days 00:00:02.430289,0.0005510381755464264,gbtree,0.6814015053577431,0.002057540698529643,lossguide,0.21600780113511564,0.07834341759001785,3,4,0.4640098776774091,COMPLETE
373,373,0.2653522899522366,2023-06-21 19:42:56.846911,2023-06-21 19:42:59.579911,0 days 00:00:02.733000,6.260994147412148e-05,gbtree,0.8931655564263183,8.92303493664374e-07,lossguide,0.9868601184340449,0.06588754367640524,3,4,0.42569627973372215,COMPLETE
374,374,0.25622672474146296,2023-06-21 19:42:59.580722,2023-06-21 19:43:03.568450,0 days 00:00:03.987728,0.00016827973698407874,gbtree,0.5267315046165926,1.867268473573944e-05,depthwise,0.4872235693997988,0.04737614168561288,3,4,0.4463599191300921,COMPLETE
375,375,0.2629879738095782,2023-06-21 19:43:03.569271,2023-06-21 19:43:10.644781,0 days 00:00:07.075510,0.0003915314022431998,gbtree,0.6084521502424928,1.8103607588565284e-06,lossguide,0.09980770177441119,0.020563969174416087,3,4,0.7377998120466426,COMPLETE
376,376,0.2607253057036589,2023-06-21 19:43:10.645604,2023-06-21 19:43:13.430700,0 days 00:00:02.785096,1.3403866216050887e-07,gbtree,0.6442966628225308,0.00029834747422526135,depthwise,0.04855240846181628,0.05676048210142913,5,4,0.4804687597132389,COMPLETE
377,377,0.26604097465842647,2023-06-21 19:43:13.431542,2023-06-21 19:43:18.167995,0 days 00:00:04.736453,1.726842244815862e-05,gbtree,0.8089282003760644,0.01029918588974848,lossguide,0.2986173781154873,0.038146615848845815,4,4,0.5035122440538546,COMPLETE
378,378,0.2617942988675299,2023-06-21 19:43:18.168827,2023-06-21 19:43:36.050374,0 days 00:00:17.881547,0.0009016634736228791,gbtree,0.6608444839504198,0.17260686685213728,lossguide,0.6720231503101959,0.00533014065935616,3,3,0.46763356781038945,COMPLETE
379,379,0.27918174280294084,2023-06-21 19:43:36.051242,2023-06-21 19:43:38.563858,0 days 00:00:02.512616,0.003496056879402242,gbtree,0.40279062138595,5.764074447284013e-06,depthwise,0.15761161992502284,0.07039926198556816,7,4,0.43681000013842763,COMPLETE
380,380,0.270814204037052,2023-06-21 19:43:38.564666,2023-06-21 19:43:40.647028,0 days 00:00:02.082362,0.00030237995097525614,gbtree,0.6257640689651603,3.52875398546015e-06,lossguide,0.41708364730436015,0.08575730400055272,3,4,0.4558901689948998,COMPLETE
381,381,0.2649638104277982,2023-06-21 19:43:40.647845,2023-06-21 19:43:46.401119,0 days 00:00:05.753274,0.0006292369933333694,gbtree,0.7401226032566729,2.8555877244948504e-07,lossguide,0.03313376381937978,0.026390482035387852,3,4,0.5954460319432008,COMPLETE
382,382,0.25192278117914113,2023-06-21 19:43:46.401960,2023-06-21 19:43:49.267430,0 days 00:00:02.865470,0.013541206377485434,gbtree,0.6398619942648129,1.1322989178273487e-06,depthwise,0.07181713399151542,0.05038186651633758,3,4,0.4729105957713717,COMPLETE
383,383,0.26222331743777166,2023-06-21 19:43:49.268250,2023-06-21 19:43:53.876972,0 days 00:00:04.608722,0.0026305027400803207,gbtree,0.6500482620611512,1.8208084279812281e-06,depthwise,0.07688681832924846,0.03288116836455944,3,4,0.4805872836254202,COMPLETE
384,384,0.2741354116103741,2023-06-21 19:43:53.877789,2023-06-21 19:43:58.469297,0 days 00:00:04.591508,0.011698203295978008,gbtree,0.6402040269476524,1.2031210224885671e-06,depthwise,0.1209529284792147,0.042235417138359814,3,4,0.7071921407285844,COMPLETE
385,385,0.26041756768273355,2023-06-21 19:43:58.470124,2023-06-21 19:44:15.818310,0 days 00:00:17.348186,0.007161123854624184,gbtree,0.8827455614305811,2.5487125080961407e-06,depthwise,0.06992021891786376,0.004876668364961157,3,4,0.4939503926105123,COMPLETE
386,386,0.2597347975985995,2023-06-21 19:44:15.819037,2023-06-21 19:44:18.112663,0 days 00:00:02.293626,0.021251345016357902,gbtree,0.6314784804934583,5.1167668396915655e-05,depthwise,6.033361489410179e-08,0.06084300157182719,3,3,0.470490888973223,COMPLETE
387,387,0.2596386304495229,2023-06-21 19:44:18.113493,2023-06-21 19:44:21.699874,0 days 00:00:03.586381,0.005104523515419236,gbtree,0.6699659738477065,2.6189899189586467e-08,depthwise,0.004955131990398059,0.04810868158030742,3,4,0.5505813837042318,COMPLETE
388,388,0.263392024176018,2023-06-21 19:44:21.700744,2023-06-21 19:44:30.073934,0 days 00:00:08.373190,0.0017213116211344506,gbtree,0.6155980418532754,0.00017578802560261903,depthwise,0.2253226977656106,0.01630524818199584,4,10,0.7271032507134982,COMPLETE
389,389,0.2658944693852264,2023-06-21 19:44:30.074768,2023-06-21 19:44:39.398587,0 days 00:00:09.323819,0.01869236021145819,gbtree,0.6537775359417918,9.604029549173168e-07,depthwise,0.057133492249352526,0.01307086661691649,3,4,0.776683517110676,COMPLETE
390,390,0.25930252886693,2023-06-21 19:44:39.399410,2023-06-21 19:44:54.946398,0 days 00:00:15.546988,0.00011127744495367014,gbtree,0.4968672190769156,1.3886731756703504e-05,depthwise,0.7072742954967419,0.007031764437764164,3,4,0.675878853840786,COMPLETE
391,391,0.27152631484817596,2023-06-21 19:44:54.947159,2023-06-21 19:44:59.652176,0 days 00:00:04.705017,0.05559426843736061,gbtree,0.9365645965138198,2.825386772930721e-06,depthwise,0.09674426917084061,0.036210882129857395,3,2,0.642995478499075,COMPLETE
392,392,0.26276715139195056,2023-06-21 19:44:59.653826,2023-06-21 19:45:18.620656,0 days 00:00:18.966830,0.005384943879239555,gbtree,0.6398029288186062,1.4989972329927242e-07,depthwise,0.00020561360131592492,0.0040197235007488,3,4,0.4842520528994291,COMPLETE
393,393,0.25257171018100993,2023-06-21 19:45:18.621517,2023-06-21 19:45:22.092100,0 days 00:00:03.470583,0.00020947546661358852,gbtree,0.6227481845457631,4.92603391438794e-06,depthwise,0.4919633573682548,0.05288843363879627,3,4,0.46429303333400146,COMPLETE
394,394,0.2618090530244095,2023-06-21 19:45:22.092926,2023-06-21 19:45:26.070779,0 days 00:00:03.977853,0.02018961650944833,gbtree,0.6171753890958018,7.259814181407294e-06,depthwise,6.980434946265546e-07,0.051195756510349785,3,4,0.6851386186463714,COMPLETE
395,395,0.26217520164427727,2023-06-21 19:45:26.071734,2023-06-21 19:45:30.185613,0 days 00:00:04.113879,0.00022516949568189348,gbtree,0.605455206239523,4.740047584027531e-06,depthwise,1.2566185120020372e-08,0.041616249442378725,3,4,0.5084355178967159,COMPLETE
396,396,0.26160302675642216,2023-06-21 19:45:30.186437,2023-06-21 19:45:35.154093,0 days 00:00:04.967656,0.006721998712005658,gbtree,0.6262015682977836,2.8537266782573502e-05,depthwise,0.00028315750475076617,0.03238615538116683,3,4,0.534648103647189,COMPLETE
397,397,0.2793019029306623,2023-06-21 19:45:35.154843,2023-06-21 19:45:37.391035,0 days 00:00:02.236192,0.0003339693701399926,gbtree,0.6597720750007336,8.718097271264868e-06,depthwise,0.0009364644944821304,0.07822179176756672,3,4,0.7124143144444993,COMPLETE
398,398,0.2597916845222892,2023-06-21 19:45:37.391856,2023-06-21 19:45:41.480023,0 days 00:00:04.088167,0.38621153879748027,gbtree,0.6339797708053376,5.462916234645998e-06,depthwise,0.5523558288761009,0.05747348122638378,3,4,0.47268434598056963,COMPLETE
399,399,0.2565496580336261,2023-06-21 19:45:41.480848,2023-06-21 19:45:45.775642,0 days 00:00:04.294794,0.014584472813220986,gbtree,0.6794925773813807,4.395504315221624e-07,depthwise,0.28752936073630203,0.043914425330731165,3,4,0.44757548256949986,COMPLETE
400,400,0.2569120521471549,2023-06-21 19:45:45.776545,2023-06-21 19:45:50.674617,0 days 00:00:04.898072,0.0723526476309108,gbtree,0.9646281199765024,6.809970472010745e-07,depthwise,0.16254077397784714,0.02852951540722982,3,4,0.4191300614023643,COMPLETE
401,401,0.26286445764534316,2023-06-21 19:45:50.675451,2023-06-21 19:46:11.684326,0 days 00:00:21.008875,0.015877750326474396,gbtree,0.6459202981892344,1.174792643614693e-05,depthwise,0.7694959157854653,0.0032934565065472128,3,4,0.49175957456697184,COMPLETE
402,402,0.2585044441694016,2023-06-21 19:46:11.685090,2023-06-21 19:46:24.142189,0 days 00:00:12.457099,0.0009887985851344378,gbtree,0.6202559438758006,1.3745032091341703e-06,depthwise,0.3747451732683268,0.008892939277383256,3,4,0.5171885093485172,COMPLETE
403,403,0.2559507240587526,2023-06-21 19:46:24.143027,2023-06-21 19:46:27.709784,0 days 00:00:03.566757,0.009551627068168186,gbtree,0.6063301112950635,3.9642400819294705e-06,depthwise,0.00010412349730087276,0.05004985085807454,3,4,0.4603623802216943,COMPLETE
404,404,0.49923961480107654,2023-06-21 19:46:27.710649,2023-06-21 19:46:51.559729,0 days 00:00:23.849080,4.609314801356026e-06,gbtree,0.665584295314126,1.9362478657601723e-06,depthwise,0.050162040377937984,0.00022125550927312596,3,4,0.6516994914431642,COMPLETE
405,405,0.2573136549613438,2023-06-21 19:46:51.560496,2023-06-21 19:46:57.658438,0 days 00:00:06.097942,0.010252338055818142,gbtree,0.6321614241305962,0.0005332570780775722,depthwise,0.9967664965311005,0.02448212074772752,4,4,0.46820895038830684,COMPLETE
406,406,0.25895930905420733,2023-06-21 19:46:57.659262,2023-06-21 19:47:00.238845,0 days 00:00:02.579583,0.035883981212253495,gbtree,0.6501875237920601,2.0276797573846882e-05,depthwise,0.5641193302011779,0.06892657770742092,3,4,0.4349219243088603,COMPLETE
407,407,0.2583959272048446,2023-06-21 19:47:00.239649,2023-06-21 19:47:04.373917,0 days 00:00:04.134268,1.0687596006036656e-05,gbtree,0.995465961763141,9.739337192606167e-07,depthwise,0.00016585006710268237,0.03945409479643895,3,4,0.47993990450559354,COMPLETE
408,408,0.2761052590287392,2023-06-21 19:47:04.374731,2023-06-21 19:47:29.399988,0 days 00:00:25.025257,0.02726777220246794,gbtree,0.5968746794216248,7.251294742626828e-05,depthwise,0.0946402255718316,0.002247094404470084,8,4,0.45398805095786415,COMPLETE
409,409,0.3112098025483503,2023-06-21 19:47:29.400934,2023-06-21 19:47:51.846399,0 days 00:00:22.445465,0.0002042186521642974,gbtree,0.6179416668829157,5.299895237447339e-07,lossguide,0.9955077433969798,0.0011717810208655376,3,4,0.6961045001357061,COMPLETE
410,410,0.26466569575117604,2023-06-21 19:47:51.847167,2023-06-21 19:47:54.746482,0 days 00:00:02.899315,0.12117640508987153,gbtree,0.6889121114047094,6.56945305115332e-08,depthwise,0.0004185172943662251,0.05456044635978613,3,7,0.4446412299739367,COMPLETE
411,411,0.2577855634778589,2023-06-21 19:47:54.747310,2023-06-21 19:48:04.754692,0 days 00:00:10.007382,0.000500073071179225,gbtree,0.6410449107494952,7.16582116141804e-06,lossguide,0.18194979787051963,0.011598827919167538,3,4,0.4661553100772016,COMPLETE
412,412,0.2628302478461271,2023-06-21 19:48:04.755657,2023-06-21 19:48:09.819851,0 days 00:00:05.064194,0.048704285870818105,gbtree,0.6278904445172104,3.79018226571649e-06,depthwise,0.4887901549136754,0.03789167706597702,3,4,0.6113783037097502,COMPLETE
413,413,0.26232897600245314,2023-06-21 19:48:09.820690,2023-06-21 19:48:23.049506,0 days 00:00:13.228816,0.0007290607458393487,gbtree,0.6539728332350353,3.537594279832735e-05,lossguide,0.0015559208344311504,0.008001709353178529,9,4,0.5006736843450086,COMPLETE
414,414,0.2612786855759664,2023-06-21 19:48:23.050353,2023-06-21 19:48:26.871296,0 days 00:00:03.820943,0.0020345304829328804,gbtree,0.6067144342431511,0.0014536742396525613,lossguide,0.3164965425771647,0.046112849145281215,5,4,0.47991138747395207,COMPLETE
415,415,0.2565457365034926,2023-06-21 19:48:26.872118,2023-06-21 19:48:33.475377,0 days 00:00:06.603259,0.10143775084198511,gbtree,0.7059308095560213,0.00010763464474639269,depthwise,0.0021597983558360235,0.020035503552854196,4,4,0.45798381877860833,COMPLETE
416,416,0.25940503460680847,2023-06-21 19:48:33.476225,2023-06-21 19:48:36.211809,0 days 00:00:02.735584,0.003541869150968786,gbtree,0.6708971975177361,1.4495764967327976e-06,lossguide,0.06674887925434587,0.062221646957525883,3,4,0.43093687990780327,COMPLETE
417,417,0.25820756579372217,2023-06-21 19:48:36.212634,2023-06-21 19:48:42.779844,0 days 00:00:06.567210,0.0003557259665843179,gbtree,0.7730706226916435,8.169216984903039e-07,depthwise,0.00668261243925787,0.017365973450835605,3,4,0.4447439298753846,COMPLETE
418,418,0.2624823770230815,2023-06-21 19:48:42.781513,2023-06-21 19:49:04.034006,0 days 00:00:21.252493,0.00016864215790506962,gbtree,0.858656455310741,0.00025665620352189494,lossguide,0.002278333932377033,0.00375896813228263,3,4,0.568517822646538,COMPLETE
419,419,0.26127658605367704,2023-06-21 19:49:04.034755,2023-06-21 19:49:23.375178,0 days 00:00:19.340423,0.0013298725475304595,gbtree,0.8207241101408468,0.9651237696957271,depthwise,0.042386777046227654,0.004405587175036578,3,4,0.4898315226124111,COMPLETE
