,number,value,datetime_start,datetime_complete,duration,params_alpha,params_booster,params_colsample_bytree,params_gamma,params_grow_policy,params_lambda,params_learning_rate,params_max_depth,params_min_child_weight,params_subsample,state
840,840,0.26420451476865875,2023-06-21 20:59:08.995397,2023-06-21 20:59:12.695756,0 days 00:00:03.700359,0.443021911296002,gbtree,0.7213027284717473,0.009365980601926567,depthwise,0.9993373444799978,0.06079609171454899,3,7,0.7322234196240116,COMPLETE
841,841,0.2661880624081922,2023-06-21 20:59:12.696740,2023-06-21 20:59:15.424501,0 days 00:00:02.727761,0.6047876826185348,gbtree,0.7133919706826958,0.002020270706974285,depthwise,0.4383861997802883,0.07505463392473602,3,4,0.6938839199552678,COMPLETE
842,842,0.25927345445012634,2023-06-21 20:59:15.425450,2023-06-21 20:59:19.616992,0 days 00:00:04.191542,0.39286162529506635,gbtree,0.6863296024255247,0.0012467013123192135,depthwise,0.5986969137364045,0.05120784257970633,3,4,0.5330197554227805,COMPLETE
843,843,0.26532723630568494,2023-06-21 20:59:19.617939,2023-06-21 20:59:22.375389,0 days 00:00:02.757450,0.5793129972552707,gbtree,0.6997017642498023,0.004450056346513934,depthwise,0.31651238515935126,0.06668637758611258,5,2,0.41402745745385905,COMPLETE
844,844,0.5356969273303619,2023-06-21 20:59:22.376324,2023-06-21 20:59:48.932352,0 days 00:00:26.556028,0.058128766185328314,gbtree,0.7133394908043023,0.0017680279599831272,depthwise,0.17431839331805554,0.0001590539306039882,4,4,0.4587673190992436,COMPLETE
845,845,0.2622891654142136,2023-06-21 20:59:48.933322,2023-06-21 20:59:51.261314,0 days 00:00:02.327992,0.11568945400529164,gbtree,0.9255693541894314,0.0035841967936327914,depthwise,0.7688247875548058,0.08399166273315158,3,4,0.4767065431339075,COMPLETE
846,846,0.26033307208795603,2023-06-21 20:59:51.262254,2023-06-21 20:59:53.932930,0 days 00:00:02.670676,0.36351681454647833,gbtree,0.7308464394811238,0.00405766571886475,depthwise,0.48185945298220306,0.05758973705512512,3,3,0.4614658846176338,COMPLETE
847,847,0.2622477254384565,2023-06-21 20:59:53.933893,2023-06-21 20:59:56.889331,0 days 00:00:02.955438,0.4813298317522009,gbtree,0.6769191034355175,0.011132891866828448,depthwise,0.2624800156842963,0.05117907005481267,3,4,0.4311299467556484,COMPLETE
848,848,0.26046381560947085,2023-06-21 20:59:56.891324,2023-06-21 21:00:12.117258,0 days 00:00:15.225934,0.7432786161719811,gbtree,0.7174514913143676,2.8466244704546853e-05,depthwise,5.351440094855602e-08,0.007019792274414778,3,3,0.49435111082854644,COMPLETE
849,849,0.2610623407562494,2023-06-21 21:00:12.118198,2023-06-21 21:00:15.359567,0 days 00:00:03.241369,0.16153949141508805,gbtree,0.6773551118106789,0.015506248674217264,depthwise,0.9921746316484982,0.06778451751950149,3,4,0.44926990708397824,COMPLETE
850,850,0.26774975519543065,2023-06-21 21:00:15.360555,2023-06-21 21:00:20.633761,0 days 00:00:05.273206,0.3161480751605212,gbtree,0.7071247724161345,1.4218485397157342e-05,depthwise,0.6269138606139115,0.04764919978174144,4,4,0.8218544894415016,COMPLETE
851,851,0.2710215697255304,2023-06-21 21:00:20.634733,2023-06-21 21:00:24.365167,0 days 00:00:03.730434,0.1549033312824654,gbtree,0.9755091027553853,0.006692029289146944,depthwise,0.1391572843139924,0.05928458247202673,3,4,0.9541280997794962,COMPLETE
852,852,0.26354671910916666,2023-06-21 21:00:24.366128,2023-06-21 21:00:26.629265,0 days 00:00:02.263137,0.005643786918056263,gbtree,0.6894287981372723,0.020619528530016484,depthwise,0.0005335596878804997,0.07832393499642948,3,4,0.626582200721765,COMPLETE
853,853,0.2613016050414733,2023-06-21 21:00:26.630220,2023-06-21 21:00:30.713512,0 days 00:00:04.083292,0.2918300975463642,gbtree,0.9507578646493816,0.001212711740264207,depthwise,0.009738802724535409,0.05711756506038135,3,4,0.4738635522997659,COMPLETE
854,854,0.26450427944981464,2023-06-21 21:00:30.714450,2023-06-21 21:00:33.010390,0 days 00:00:02.295940,0.0063435957416919445,gbtree,0.48210818560320584,1.859659541291231e-05,depthwise,0.0056794540783978945,0.06828809426577655,3,3,0.4619565774422735,COMPLETE
855,855,0.2610968698485556,2023-06-21 21:00:33.011354,2023-06-21 21:00:35.438098,0 days 00:00:02.426744,0.9872863392292733,gbtree,0.5073446184009895,0.010519640822721311,depthwise,1.0227121871281044e-08,0.09149339482512521,3,4,0.43593780989481556,COMPLETE
856,856,0.2628347759855394,2023-06-21 21:00:35.439034,2023-06-21 21:00:39.453234,0 days 00:00:04.014200,0.9802541607355768,gbtree,0.697173733818742,0.7942304587746868,depthwise,2.101027461965709e-06,0.04968340070266525,3,2,0.4843689432107213,COMPLETE
857,857,0.2710478275515969,2023-06-21 21:00:39.454184,2023-06-21 21:01:01.294385,0 days 00:00:21.840201,0.02982498637945844,gbtree,0.7402375226408793,1.1733678778372288e-05,depthwise,0.0010680787409213304,0.002510293549884906,3,4,0.4474440581632787,COMPLETE
858,858,0.2554689245801274,2023-06-21 21:01:01.295386,2023-06-21 21:01:10.918722,0 days 00:00:09.623336,0.02019847448268577,gbtree,0.6658748038920613,3.352694254588196e-05,depthwise,0.3781545557581098,0.011966608229650936,3,4,0.4262438338305768,COMPLETE
859,859,0.30175148335300583,2023-06-21 21:01:10.919582,2023-06-21 21:01:34.509720,0 days 00:00:23.590138,0.048387244844072655,gbtree,0.7103274119433266,4.786061247799528e-05,depthwise,0.004860147327777293,0.0012892963292550025,3,3,0.7184498466566769,COMPLETE
860,860,0.5262858833886641,2023-06-21 21:01:34.510726,2023-06-21 21:01:57.750959,0 days 00:00:23.240233,0.004648359388231406,gbtree,0.7263309756464937,0.0004963613396486065,depthwise,0.6924882539030124,0.00018222383582561404,3,4,0.5081577061021666,COMPLETE
861,861,0.2609877519419737,2023-06-21 21:01:57.751814,2023-06-21 21:02:10.913626,0 days 00:00:13.161812,0.7561204800476293,gbtree,0.9149659394342464,0.019184266502262962,depthwise,0.9977425240725873,0.009133987303337766,3,4,0.4676837302154235,COMPLETE
862,862,0.27000934263126514,2023-06-21 21:02:10.914562,2023-06-21 21:02:15.667411,0 days 00:00:04.752849,0.2376051957324579,gbtree,0.7696659300972875,0.003177228857262696,depthwise,0.001495012596936385,0.042648202932828505,3,3,0.6816987474548316,COMPLETE
863,863,0.2708144315109664,2023-06-21 21:02:15.668367,2023-06-21 21:02:18.000858,0 days 00:00:02.332491,0.16229671484205724,gbtree,0.4486269710028783,0.15047786616475023,depthwise,3.653730891835601e-07,0.07629175076007684,3,4,0.4544604073814869,COMPLETE
864,864,0.2551008606226182,2023-06-21 21:02:18.001799,2023-06-21 21:02:29.188974,0 days 00:00:11.187175,0.597920019404423,gbtree,0.6846171898725227,0.03869628779930908,depthwise,0.3843844957816711,0.010342831986224675,3,4,0.41517896117073927,COMPLETE
865,865,0.2692021064478613,2023-06-21 21:02:29.189955,2023-06-21 21:02:32.764695,0 days 00:00:03.574740,0.2543963917571309,gbtree,0.577540210718377,9.611217208665007e-06,lossguide,0.24343252128580736,0.06054373030196202,3,4,0.6478489827693507,COMPLETE
866,866,0.25962222215153424,2023-06-21 21:02:32.765638,2023-06-21 21:02:37.143064,0 days 00:00:04.377426,0.0467955833192418,gbtree,0.6623101423469213,0.9986609811717743,depthwise,0.5311504098999756,0.052778758308083554,4,4,0.5697823611068085,COMPLETE
867,867,0.26363834152475296,2023-06-21 21:02:37.143994,2023-06-21 21:02:39.973162,0 days 00:00:02.829168,0.054413193968578674,gbtree,0.7408804629509727,0.008414655318530523,lossguide,0.013209200791269093,0.06484747110099838,3,3,0.8994916135185769,COMPLETE
868,868,0.26134401368575194,2023-06-21 21:02:39.974135,2023-06-21 21:02:56.614694,0 days 00:00:16.640559,0.019222237746837467,gbtree,0.9458395918038917,0.0007096817375914618,depthwise,0.14995632180527824,0.0053959858554332935,3,4,0.4420532809847899,COMPLETE
869,869,0.26875815571388095,2023-06-21 21:02:56.615681,2023-06-21 21:03:18.899674,0 days 00:00:22.283993,0.6068342440909108,gbtree,0.7255616435676263,0.00015783853965394153,lossguide,4.947614093303288e-08,0.003017300772713861,3,2,0.48770116869379526,COMPLETE
870,870,0.2664999730246354,2023-06-21 21:03:18.900658,2023-06-21 21:03:23.280807,0 days 00:00:04.380149,0.07628584754985267,gbtree,0.4905486767516278,0.0019150302416155883,depthwise,9.221376261384554e-08,0.04513521474871565,3,3,0.8635747461293503,COMPLETE
871,871,0.34897686835331093,2023-06-21 21:03:23.281742,2023-06-21 21:03:45.533329,0 days 00:00:22.251587,0.10284021519924384,gbtree,0.9234763649487308,1.4659729771001907e-05,lossguide,7.569278636583636e-07,0.0007910160007046159,3,9,0.4736778643004722,COMPLETE
872,872,0.26232406667111247,2023-06-21 21:03:45.534340,2023-06-21 21:04:05.491830,0 days 00:00:19.957490,0.09656748012828495,gbtree,0.46948042004427504,0.0015338826826496457,depthwise,1.7735690972046862e-08,0.003943443094185341,3,4,0.45758366152918956,COMPLETE
873,873,0.2607453745264735,2023-06-21 21:04:05.492819,2023-06-21 21:04:08.034959,0 days 00:00:02.542140,0.007255033834393957,gbtree,0.9567666427883199,0.006300849443792146,depthwise,0.6791275083602478,0.07361620822985093,3,4,0.4480406909768392,COMPLETE
874,874,0.32322382830863644,2023-06-21 21:04:08.036607,2023-06-21 21:04:30.876331,0 days 00:00:22.839724,0.9951984098543722,gbtree,0.6380081180036091,0.0039728055719381785,lossguide,0.00018682530324889775,0.0010446493648701258,3,4,0.4994187091565348,COMPLETE
875,875,0.27012217717231696,2023-06-21 21:04:30.877305,2023-06-21 21:04:33.099550,0 days 00:00:02.222245,0.04485328910191121,gbtree,0.6985608299466624,2.3581219492037298e-05,depthwise,4.130313321408143e-05,0.08631149001283044,3,4,0.4663824998476677,COMPLETE
876,876,0.2614041122320207,2023-06-21 21:04:33.100502,2023-06-21 21:04:35.003276,0 days 00:00:01.902774,0.01054735321258702,gbtree,0.9836145741346605,0.0008656492224135329,lossguide,0.09184598673763882,0.09994882563421588,4,4,0.4389624769649613,COMPLETE
877,877,0.2574246966900678,2023-06-21 21:04:35.004226,2023-06-21 21:04:37.636616,0 days 00:00:02.632390,0.029121850467881193,gbtree,0.7536553489222294,0.03454653295759779,depthwise,2.1978041278903778e-07,0.057170686778977166,3,3,0.4814456937703315,COMPLETE
878,878,0.26301637426487273,2023-06-21 21:04:37.637552,2023-06-21 21:04:41.702585,0 days 00:00:04.065033,0.5831345113531877,gbtree,0.420312825582214,6.363207522233833e-05,lossguide,3.4149067379465863e-06,0.048719068026153715,5,4,0.4279657383712168,COMPLETE
879,879,0.26415404285130945,2023-06-21 21:04:41.703530,2023-06-21 21:05:02.451929,0 days 00:00:20.748399,0.06773429161222591,gbtree,0.651262137009234,7.92264825165075e-06,depthwise,0.4568960145219673,0.004347456393786636,3,4,0.7070159765060748,COMPLETE
880,880,0.3602062111420458,2023-06-21 21:05:02.452925,2023-06-21 21:05:26.533987,0 days 00:00:24.081062,0.03669275579665948,gbtree,0.9889394448861342,0.013847788034574806,lossguide,1.5576747052637278e-05,0.0006613621434880699,3,4,0.4591471477081099,COMPLETE
881,881,0.2595338399508959,2023-06-21 21:05:26.534883,2023-06-21 21:05:29.273665,0 days 00:00:02.738782,0.18007359373119397,gbtree,0.6725057907259893,0.004423144660660451,depthwise,0.2292404450318207,0.06601404413782898,3,3,0.47237943517294495,COMPLETE
882,882,0.2565314778369834,2023-06-21 21:05:29.274608,2023-06-21 21:05:33.421951,0 days 00:00:04.147343,0.26087951034959944,gbtree,0.5867834792162354,2.288047720032079e-05,lossguide,0.7194440031592679,0.05419031224983108,8,4,0.4525078205306628,COMPLETE
883,883,0.26154520888251725,2023-06-21 21:05:33.422941,2023-06-21 21:05:37.539797,0 days 00:00:04.116856,0.01222092037380105,gbtree,0.619680121213915,1.908424472416662e-08,depthwise,0.9869324857019337,0.04292502704924066,3,3,0.5535783847848958,COMPLETE
884,884,0.27177914175202667,2023-06-21 21:05:37.541577,2023-06-21 21:05:39.995530,0 days 00:00:02.453953,0.0030779741375361125,gbtree,0.6333358146415378,1.0844244770445111e-08,depthwise,7.388768339949493e-06,0.0804623809188971,3,4,0.656400700593161,COMPLETE
885,885,0.27827511506214914,2023-06-21 21:05:39.996477,2023-06-21 21:05:42.849231,0 days 00:00:02.852754,0.01799122885685851,gbtree,0.7735036955156861,0.11466582853115591,lossguide,0.33894716098138183,0.062178928988004145,3,2,0.9073354085125902,COMPLETE
886,886,0.25812599081421134,2023-06-21 21:05:42.850171,2023-06-21 21:05:56.385470,0 days 00:00:13.535299,0.014680138133866082,gbtree,0.596221085471988,0.0002876918995957917,depthwise,0.0018281869241864935,0.007677774593162659,3,4,0.5142931431955894,COMPLETE
887,887,0.27032811082343144,2023-06-21 21:05:56.386468,2023-06-21 21:06:00.148485,0 days 00:00:03.762017,0.19744774352566108,gbtree,0.648599228483661,0.25648465326907494,lossguide,1.1655504308903304e-06,0.04888231292253349,3,4,0.7987690472194429,COMPLETE
888,888,0.2626526530620532,2023-06-21 21:06:00.149450,2023-06-21 21:06:02.993683,0 days 00:00:02.844233,0.46092686441014663,gbtree,0.7089443920185561,0.013052919504948262,depthwise,0.0008207448480961101,0.06992116094878977,7,4,0.489880395163856,COMPLETE
889,889,0.2706439907539293,2023-06-21 21:06:02.994713,2023-06-21 21:06:08.309612,0 days 00:00:05.314899,0.12965327642450236,gbtree,0.8209079626420006,0.07196024838218854,lossguide,0.059663322367234345,0.04292772337731534,3,4,0.939765918875822,COMPLETE
890,890,0.26777486422738844,2023-06-21 21:06:08.311295,2023-06-21 21:06:11.752313,0 days 00:00:03.441018,0.03464855156474229,gbtree,0.7356363365110906,0.6381468961393845,depthwise,0.5214864428143247,0.05684567892156142,4,3,0.5351654199990628,COMPLETE
891,891,0.2650252477794915,2023-06-21 21:06:11.753279,2023-06-21 21:06:32.216922,0 days 00:00:20.463643,0.008146189087273478,gbtree,0.6598630476357505,3.716239293891658e-05,lossguide,0.3265926347943634,0.0032195105256352208,3,4,0.4394258917247443,COMPLETE
892,892,0.2601829506713412,2023-06-21 21:06:32.217879,2023-06-21 21:06:37.099483,0 days 00:00:04.881604,0.0032229343693988173,gbtree,0.47992689885184436,2.137229867911745e-06,depthwise,0.11077934014884756,0.037630157043186556,3,3,0.4657700352154238,COMPLETE
893,893,0.27113914574321746,2023-06-21 21:06:37.100436,2023-06-21 21:06:39.610905,0 days 00:00:02.510469,0.003856927168044577,gbtree,0.7232968743047385,1.0468973412372651e-05,depthwise,0.9938250265859394,0.0856869570349713,3,4,0.7556636392229534,COMPLETE
894,894,0.41202523774924665,2023-06-21 21:06:39.611857,2023-06-21 21:07:03.340487,0 days 00:00:23.728630,0.7282443958400752,gbtree,0.6862007311278103,0.006421162537822316,lossguide,0.039968743363470415,0.00043622415600300167,3,4,0.7607456479166844,COMPLETE
895,895,0.2712273594965881,2023-06-21 21:07:03.341483,2023-06-21 21:07:07.469952,0 days 00:00:04.128469,0.07066365353552487,gbtree,0.959747039080326,1.6122056881627757e-05,depthwise,6.371476886141592e-05,0.05158755978217831,3,4,0.8295405992950902,COMPLETE
896,896,0.2552695672344152,2023-06-21 21:07:07.470924,2023-06-21 21:07:09.781865,0 days 00:00:02.310941,0.4917012566761533,gbtree,0.6141942653120468,0.026906949934909975,lossguide,0.1872440066705202,0.07313243015556209,3,3,0.4213752849392407,COMPLETE
897,897,0.2680115526998324,2023-06-21 21:07:09.782820,2023-06-21 21:07:14.106642,0 days 00:00:04.323822,0.09625201485817449,gbtree,0.6407501016794108,0.048471643814924435,depthwise,0.0002510178189190362,0.06376125992981202,3,4,0.9681396718243598,COMPLETE
898,898,0.2582930603433064,2023-06-21 21:07:14.107603,2023-06-21 21:07:28.921339,0 days 00:00:14.813736,0.022771494200582186,gbtree,0.8012937038093251,0.022007238760976388,lossguide,2.8764248837586076e-08,0.006275284456592386,3,4,0.4809913238418439,COMPLETE
899,899,0.26416622267221396,2023-06-21 21:07:28.922404,2023-06-21 21:07:33.211217,0 days 00:00:04.288813,0.07649494614972094,gbtree,0.9952278680676498,0.0006090596900401507,depthwise,2.1014933949958053e-05,0.0542173748159607,6,4,0.6849342563229371,COMPLETE
900,900,0.2563102077745232,2023-06-21 21:07:33.212175,2023-06-21 21:07:37.247656,0 days 00:00:04.035481,0.01060124478932816,gbtree,0.7638891515763065,0.20134428610624358,lossguide,0.5280884239208641,0.04430347781982564,4,3,0.45205794867388366,COMPLETE
901,901,0.2579849792586953,2023-06-21 21:07:37.248607,2023-06-21 21:07:50.488563,0 days 00:00:13.239956,0.9920972707011652,gbtree,0.4410192961338538,6.617822847355665e-06,depthwise,4.939627572302294e-07,0.008651335212284538,3,4,0.46291818991484035,COMPLETE
902,902,0.3033094808589933,2023-06-21 21:07:50.489654,2023-06-21 21:08:12.039850,0 days 00:00:21.550196,0.0046416440817962125,gbtree,0.6278411832732149,5.063370753768058e-05,depthwise,0.7036514681311884,0.0014171690268838032,3,4,0.4078037009637393,COMPLETE
903,903,0.2905299357200641,2023-06-21 21:08:12.040843,2023-06-21 21:08:33.783281,0 days 00:00:21.742438,0.007303236044440291,gbtree,0.6984727904247833,0.38807686028429245,lossguide,0.3952609011697253,0.0016461511597898877,3,4,0.4342073029179798,COMPLETE
904,904,0.2639333142910089,2023-06-21 21:08:33.784256,2023-06-21 21:08:36.657901,0 days 00:00:02.873645,0.01594026583846667,gbtree,0.9042488325587487,0.00010320404594529847,depthwise,0.02560041373798276,0.06035812677089976,3,4,0.8442474696431285,COMPLETE
905,905,0.32008402148943044,2023-06-21 21:08:36.658852,2023-06-21 21:09:02.783234,0 days 00:00:26.124382,0.0024518032030919463,gbtree,0.99561815898772,0.0002143839266496204,lossguide,0.0004956194905314824,0.0011168493308286124,3,3,0.9301676105715313,COMPLETE
906,906,0.2688550900475412,2023-06-21 21:09:02.785071,2023-06-21 21:09:05.344655,0 days 00:00:02.559584,0.2036208051683061,gbtree,0.9396061682153053,0.002821379744489177,depthwise,0.015187183901901574,0.07117411775406049,3,4,0.5821700970258648,COMPLETE
907,907,0.3359301799285852,2023-06-21 21:09:05.346589,2023-06-21 21:09:28.247633,0 days 00:00:22.901044,0.0001701556376661549,gbtree,0.7469502122890674,4.688435053500065e-06,lossguide,1.4577753412100738e-06,0.0008801157030754879,3,2,0.47636982093206454,COMPLETE
908,908,0.26098190107787805,2023-06-21 21:09:28.248517,2023-06-21 21:09:44.224428,0 days 00:00:15.975911,0.0019632665627085247,gbtree,0.603354858882697,6.48866389433062e-08,depthwise,0.14813627254732387,0.0054614202831758905,3,4,0.4496446418438515,COMPLETE
909,909,0.2544791094064955,2023-06-21 21:09:44.225311,2023-06-21 21:09:48.691811,0 days 00:00:04.466500,1.8731299264158695e-05,gbtree,0.6673362283065342,2.7940590496171496e-08,lossguide,0.7048831787398188,0.0483170887605937,3,4,0.4931960906447002,COMPLETE
910,910,0.2666025164839408,2023-06-21 21:09:48.692797,2023-06-21 21:09:53.286251,0 days 00:00:04.593454,2.0121792149672323e-05,gbtree,0.438441546910893,1.208109794326933e-08,lossguide,0.002291149430351089,0.039894439245584876,3,4,0.499970118444947,COMPLETE
911,911,0.27770043999741406,2023-06-21 21:09:53.287138,2023-06-21 21:09:57.322799,0 days 00:00:04.035661,1.0687323948174442e-05,gbtree,0.6783045863256258,1.834866130547786e-06,lossguide,1.1654224240821578e-07,0.04762948574123993,4,4,0.8815526965579316,COMPLETE
912,912,0.37345835768050395,2023-06-21 21:09:57.323759,2023-06-21 21:10:26.660667,0 days 00:00:29.336908,0.3222865180190234,gbtree,0.6658483537887772,1.0297583389210438e-08,lossguide,0.00557815370469357,0.0005538907814882881,5,4,0.5241521669419555,COMPLETE
913,913,0.26294991462450795,2023-06-21 21:10:26.664112,2023-06-21 21:10:31.683606,0 days 00:00:05.019494,1.8526907987786204e-05,gbtree,0.7814045023227527,3.255869053972154e-06,lossguide,0.07713916965900858,0.03534656146182748,3,4,0.486556930815609,COMPLETE
914,914,0.2738197185462153,2023-06-21 21:10:31.684564,2023-06-21 21:10:35.746617,0 days 00:00:04.062053,2.5166269746477036e-05,gbtree,0.6568090504020581,1.9489981496243598e-08,lossguide,0.004075551738139501,0.04323815817244257,3,4,0.7802638134840069,COMPLETE
915,915,0.26123779572987643,2023-06-21 21:10:35.747593,2023-06-21 21:10:43.460258,0 days 00:00:07.712665,0.02558018572673549,gbtree,0.4020086347134014,7.825274472205166e-06,lossguide,7.962685457846444e-05,0.015330558326722811,3,4,0.4708616571220533,COMPLETE
916,916,0.262917798369086,2023-06-21 21:10:43.461140,2023-06-21 21:10:47.668203,0 days 00:00:04.207063,0.4386667458590099,gbtree,0.6804598254368972,2.3544953231469803e-06,lossguide,0.2317606194834708,0.04883794543732351,3,4,0.4949714457932077,COMPLETE
917,917,0.2662881935152612,2023-06-21 21:10:47.669160,2023-06-21 21:10:53.154174,0 days 00:00:05.485014,0.011857991317812497,gbtree,0.6684650526154076,1.2222147158772151e-05,lossguide,0.5620932802673633,0.034851303094365335,3,4,0.9513916452024098,COMPLETE
918,918,0.5396958472270121,2023-06-21 21:10:53.155044,2023-06-21 21:11:32.426282,0 days 00:00:39.271238,7.565899457458493e-06,gbtree,0.6472552058855031,5.361811205380154e-08,lossguide,2.843539069223029e-06,0.00014488551524218416,8,5,0.6242143247859935,COMPLETE
919,919,0.5714937741784221,2023-06-21 21:11:32.427273,2023-06-21 21:11:57.311541,0 days 00:00:24.884268,0.12666337048555543,gbtree,0.8741544059730229,5.182197187032905e-06,lossguide,0.9949121218441915,0.00011218391382997043,3,4,0.9234620524120072,COMPLETE
920,920,0.25793153418562903,2023-06-21 21:11:57.312561,2023-06-21 21:12:06.220012,0 days 00:00:08.907451,5.851648402861335e-06,gbtree,0.6341488650461439,1.0920035808500035e-07,lossguide,0.052929258107085694,0.012831871338676202,3,4,0.4786284997322885,COMPLETE
921,921,0.25925295391910524,2023-06-21 21:12:06.221012,2023-06-21 21:12:09.340140,0 days 00:00:03.119128,1.5372172694566293e-05,gbtree,0.8334669140378399,3.1358897160161106e-08,lossguide,0.009359320188856624,0.05311141225309943,3,4,0.4635229961134354,COMPLETE
922,922,0.28103702905024347,2023-06-21 21:12:09.341097,2023-06-21 21:12:31.405417,0 days 00:00:22.064320,3.143396564902388e-05,gbtree,0.6551939497829626,2.1756471606245524e-07,lossguide,2.5966323549682153e-07,0.0018969575588341843,3,4,0.4713295432327147,COMPLETE
923,923,0.25422559159800895,2023-06-21 21:12:31.406335,2023-06-21 21:12:35.916588,0 days 00:00:04.510253,1.1781438438286922e-05,gbtree,0.9681031569855875,1.0327089045774925e-07,lossguide,0.002498292415200647,0.039950699233006225,3,4,0.46056376831025375,COMPLETE
924,924,0.26227639522006607,2023-06-21 21:12:35.917599,2023-06-21 21:12:40.699729,0 days 00:00:04.782130,1.3765923534343902e-05,gbtree,0.9628496448925304,4.226682492050426e-08,lossguide,0.0012954710941584446,0.04130128680524395,3,4,0.7409972780550073,COMPLETE
